tweet_text,month_of_tweet
13 y old Lana from Nablus is fighting leukemia in the department and… …,1
"For Every fight won, for each battle lost. For admiring Leukemia Fighters. #supportandpray…",6
"This guy is suffering from leukemia for 9900 chromosomes AD, but yet… …",5
Warriors welcome 8-year-old leukemia patient …pic.twitter.com/dFgdGt7Ytp,4
"When a stage 4 leukemia Cancer Fighter, Beater and Winner takes a #boss photo…",7
Thx to Mayor and kemal_saracoglu_vakfi foundation that support kids with leukemia and…,10
