tweet_text,month_of_tweet
From Bush Hall last week for the Bowie memorial show for teenage cancer trust! @ Bush Hall,2
A great Honor finally meeting Jo Paveya wonderful lady who was the Cancer research winter run…,2
"1 letter from mum with 1 son killed, 1 son in hospital, brother missing, a husband dying (cancer) & a 7yr old crippled child",2
"Dryathlon DONE (you can still done, link in bio!) I deserve this one! #cancer…",2
Very special night tonight at Stand Up To Cancer - taking some photos for these cheeky lads…,2
How #BetaGlucans Boost #Immunity & Fight #Cancer Beta glucans are found in the cell walls of…,2
Wishing all the luck in the world with his battle with cancer. Be strong Hitman,2
Spent today doing this @ Cancer Research UK,2
Awful news about Bret Hart and his cancer! Horrible disease,2
My second year helping out at the Tenovus Cancer Care get together this weekend. Love giving…,2
But as sure as the eventual result of cancer.,2
"This is our manager, Elaine getting in the world cancer day mood onThursday #ADayToUnitepic.twitter.com/QdXhDxWvaY",2
Healthy start of the day! Great mix to fight cancer! #prana #shakti#viniyasa #fusion #pray…,2
LHR --> BHD for 2-day workshop with the UK ASAIL project: laser accelerators for cancer therapy…,2
"Surely Terry Wogan's fight against cancer was private, not secret. And, is Bruce coming back to Leeds?",2
"Huge kudos to #VanessaHudgens on stage as Rizzo #GreaseLive right now, so soon after losing her father to cancer. #Strength",2
"World Cancer Day on Thursday 4th Feb, we've got an Altern8 on, mask & make up party, it's £1…",2
I knew Terry Wogan battled cancer cos Tess Daly wished him well as he was inwhilst she did minus himhow sad #RIPTerryWogan legend,2
"When there is darkness, there is light. Made a video for my 30th birthday on #cancer awareness…",1
Great fun and very touching doing the Cancer Research 10k Winter Run… …,1
My beautiful friend steph_filer just shaved off her long locks for Ovarian Cancer Action raising…,1
My Wogan tribute is on eBay. All proceeds go to Cancer Research. Bids are on! @ Sonos…,1
1hr 13 minutes! So proud we ran 10km for cancer research and raised £625- thank you to everyone…,1
"The sooner they find a cure to cancer the better..... RIP Terry Wogan @ Tilehurst, Berkshire",1
Proud of this guy. 10k run for Anthony Nolan blood cancer. Most entertaining sponsor criteria:…,1
What a cruel killer cancer is RIP Terry Wogan heavens ready for a kind heart,1
Before a #winterun #tube #underground #charing #cross #way #cold #shoes #morning #cancer…,1
Cancer Research Winter Run London 2016. #winterrunserieslondon @ Trafalgar Square,1
I can't believe that #sirterrywogan has died of cancer today I love seeing him on…,1
Terry Wogan has died??? I'm heartbroken. Fuck 2016. Fuck cancer.,1
In honour of Sir Terry Wogan. We will donate £1 to Cancer Research for every pint of Guinness we…,1
Can we all change our pic to this please. For all those lost to this horrendous disease x. #Cancer pic.twitter.com/HJ4DlQdiiy,1
Yes! I've finished it! Proud of my race time. And happy for my help in fighting #cancer #london…,1
Fucking cancer again #RIP #terrywogan,1
"Come along and help raise money for cancer research @ Beach Ballroom, Aberdeen",1
Another legend lost to cancer this month. R.I.P #terrywogan,1
""" BREAKING: Terry Wogan dies aged 77 after a battle with cancer So sad He is a Legend Sadly missed .",1
"Everyones dying from cancer. Not Wogan, why Wogan",1
Sad to hear about Terry Wogan. Cancer gets YET ANOTHER of the good ones. As does 2016. #terrywogan,1
Just before the Cancer Research winter 10k just popped by to say Hi to the Prime Minister,1
Tackling killer disease make a fist celebrities wearing unity wrist band for cancer care good enough for us but stigma for refugees,1
"do u mean man dies of cancer from cigarettes, they r killer legal highs",1
“ #Cancer's are true friends. They always want to cheer you up.”,1
"And there ends the month of ""No Alcohol"" .... In support of cancer research UK. For whatever…",1
Doesn't my wife look amazing? Not even cancer and chemo can dampen her beauty ukipad…,1
not just smear test but self examining your breasts too. It was self examining my testicles that caught my cancer very early!,1
Ready to Westminister #winter #run #series #cancer #research #uk #london #trafalgar…,1
"Newshour - ""Safer"" Cancer Therapy For Children's Brain Tumours, 30/01/2016 GMT - …",1
"Billionaire cakes are mighty tasty. Only £1 each, all proceeds go to Cancer week…",1
Recycling (@ Cancer Research Thirsk) pic.twitter.com/67OTibnvbp,1
O man. Cancer Bats destroyed it the other night! Had a such a great time. Went down on my own…,1
"6 yrs since we lost my big towering gentle uncle Willie to cancer. I wish I knew he was so sick, for longer. I wish I got to know him more.",1
higher pension no compensation for the loss of fours years state pension. & stress of working longer after Cancer diagnosis,1
lucky devil dryathlete for cancer research 3 days left,1
Get yours now #adaytounite 4th February 2016 get yours at world cancer day . Co . U.K please…,1
"Indeed. While Baillie is eating mince pies, Phillipa is fighting cancer...and Phillipa is the one being attacked.",1
Interesting discussion about managing nodules. Can patients understand cancer risk at least as well as clinicians? #BTOG2016,1
"Your clicks, likes and tweets support cutting edge cancer research. Join the fight! … przez",1
CANCER FUCKING BATS @ The Dome #cancerbats #canada #cancersucks #thedome #sabotage…,1
Bloody love Cancer Bats and so should you Full gallery up on soon…,1
"Me and Liam Cormier (Cancer Bats) tonight - felt brave and hit the circle pit, no regrets.…",1
A clinic on the anniversary of my cancer diagnosis reminds me how much & help blood cancer patients,1
"THE MOTHERFUCKING CANCER BATS @ The Dome, Tufnell Park",1
"Amazing time with Ben at the Beating Bowel Cancer Parliamentary Reception. Inspiring, full of…",1
In 1 week - Cancer: Health in the Headlines (£8/£5) - #Oxford,1
'Take us more seriously' Exeter teen cancer sufferer demands #Exeter …pic.twitter.com/KMcgrOcLhN,1
The project transforming cancer follow-up care at Exeter's RD&E #Dawlish …pic.twitter.com/nMrMFnz9l0,1
The project transforming cancer follow-up care at Exeter's RD&E #Exeter …pic.twitter.com/QDZPLRNq5k,1
Help me out guys as I fight in a boxing match to help cancer… …,1
'Take us more seriously' Exeter teen cancer sufferer demands #Exeter …pic.twitter.com/yjqUUkT9wA,1
Mr describing outcomes of emergency surgery in colorectal cancer. pic.twitter.com/jb9fIm4N1s,1
The project transforming cancer follow-up care at Exeter's RD&E #Dawlish …pic.twitter.com/RS9feDNgFX,1
The project transforming cancer follow-up care at Exeter's RD&E #Exeter …pic.twitter.com/1tJFfg7NoH,1
Voodoo dolls sold for charity £4.99 all monies go to the #macmillan nurses for cancer patients…,1
'Take us more seriously' Exeter teen cancer sufferer demands #Exeter …pic.twitter.com/iwnf17WkQy,1
Cancer bats were insane #cancerbats #liverpoolo2 @ O2 Academy Liverpool,1
"The nationwide campaign for Breast Cancer Now, the UK’s leading breast cancer research…",1
"When there is darkness, there is light. Made a video for my 30th birthday on #cancer awareness…",1
The project transforming cancer follow-up care at Exeter's RD&E #Dawlish …pic.twitter.com/uqv99FQtFZ,1
The project transforming cancer follow-up care at Exeter's RD&E #Exeter …pic.twitter.com/GTKw1MF1E1,1
Great night at 'Your Choice' with - board games & stories about cancer…,1
Former Teignmouth footballer dies of cancer at age of 42 #Dawlish …pic.twitter.com/qKxHRDiaZJ,1
Former Teignmouth footballer dies of cancer at age of 42 #Dawlish …pic.twitter.com/BVIrMG2CHU,1
Former Teignmouth footballer dies of cancer at age of 42 #Dawlish …pic.twitter.com/sWuCAQZJzQ,1
this is a real opportunity for hospice care to support cancer care,1
Y do thousands of people campaign against smoking and cancer when CBB quite clearly disregard these efforts by filming celebs smoking,1
I’m wearing a Unity Band for World Cancer Day on 4th Feb: #ADayToUnite,1
"January is Cervical Cancer Awareness Month! Every year around 530,000 women are diagnosed with…",1
Watching Tattoo fixers. Absolutely fantastic work for the young girl who had Breast Cancer. Well done you lot. Your all brill,1
"Together, we'll beat cancer! Supporters cheering on runners raising money for cancerresearchuk,…",1
", Juli! Fibrin matrices enhance the transplant and efficacy of cytotoxic stem cell therapy for post-surgical cancer",1
MY GRANDMA IS IN REMISSION @ CANCER SUCKS!,1
I really wish that cancer wasn't stealing one of our friends away from us,1
Sorry av not been tweeting much as on the 13th of January my other big sister Michelle Ramsey lost her fight to Cancer her funeral is 2daysx,1
:lMy #SmearForSmear selfie.Nominate JCCT16 £5 to 70070 to help prevent cervical cancer pic.twitter.com/SRU6ESzkeo,1
Dr John McKenna - What You Can Do To Prevent Cancer …,1
Had a well weird dream last night that this cute lad asked me out and then it changed and suddenly my mum had cancer. What the fuck,1
Blue Monday @ cancer research folkestone pic.twitter.com/ywZtzmGcUX,1
This guy though! Liam is fucking awesome & trying to raise money for Cancer charities. He's…,1
BLACK STONE CHERRY @ The Borderline for Teenage Cancer Trust and 300 of their closest…,1
he's a cancer. Oh and shooting an abysmal 44%,1
Great WOD in memory of 'Jess Fairclough' who sadly passed away to cancer.... I couldn't make it…,1
Luring Cancer With An Early Warning System …,1
""" #Leo builds up the confidence of shy Cancer as they learn to be more fun loving and out going.""",1
S M E A R F O R S M E A R Today marks the start of cervical cancer awareness week. Here…,1
"My #SmearForSmear for Attend your smear, reduce your risk of cervical cancer. I nominate:",1
Cancer bats were amazing as ever last night! treadwellclothing,1
"some said i look like a dancer ; when i show you my moves, you probably will get cancer. @ Step Up",1
Always great to see the Cancer Bats guys! @ Manchester Academy 3,1
Cancer Bats @ Manchester Academy 3,1
"#CR-UK Bellshill ""Jog on Cancer"" 4th Feb World Cancer Day! Get you're bands here pic.twitter.com/iwhvBi8wFr",1
#Stigmabase | IE - Many unaware of lung cancer dangers - Many Irish people appear to have a lack of awareness…,1
#Stigmabase | IE - Over a third of Irish People with Three or More Symptoms of Lung Cancer are Unconcerned - Over…,1
MWIE - Many unaware of lung cancer dangers - Many Irish people appear to have a lack of awareness about the…,1
MWIE - Over a third of Irish People with Three or More Symptoms of Lung Cancer are Unconcerned - Over a third of…,1
Paint North Devon purple and help beat cancer #Devonpic.twitter.com/17eNv1dns5,1
Fundraising appeal for Stone mother with cancer reaches past... #Staffordshire,1
Run past London landmarks and raise funds for Harlow breast cancer trials unit #Harlow #Essex,1
"“ Hi Kim, please could retweet this amazing charity. Which supports children who are suffering with cancer xxx”",1
Secondo round Rock Against Cancer: Sick Brain. @ LIVE MUSIC CLUB,1
Cancer charity coffee morning raises hundreds of pounds #Cheshirepic.twitter.com/njLVo1YZkm,1
I'm stage 3 Ovarian cancer everyday is a struggle shall fight hard and conquer,1
Iraq War veteran who lost a leg and is battling brain cancer uses his wheelchair to clear snow from Nebraska streets …,1
Photo for cancer update @ West Monkseaton,1
Dispute over new cancer scanner at Southend Hospital drags on #Southendpic.twitter.com/COl4kvZlRG,1
New drug for advanced skin cancer approved on the NHS pic.twitter.com/sc5o0rqWIq,1
Dispute over new cancer scanner at Southend Hospital drags on #Basildonpic.twitter.com/GUeKxFLod6,1
Drinking green tea can help fight #Alzheimers and #Cancer. … przez,1
Rick Wakeman’s David Bowie tribute tracks will raise cash for Macmillan Cancer… #Suffolkpic.twitter.com/097uWeXyYs,1
#CR-UK Bellshill World Cancer Day 4th Feb pic.twitter.com/AMO8TOIaJr,1
"Every second Fucking advert, Cancer this cancer that, such and tired of hearing that word, it never used to get plastered about everywhere",1
& molecular modelling event in Cardiff today Chaired by Dr Andrea Brancale,1
'Rapunzel' to donate her hair to young cancer patients #Cornwall #Kernowpic.twitter.com/Kvx1bqFYUo,1
"American Ambassador Urges Ugandans on Cancer Screening: According to Mahony, she managed to overcome ovarian c...",1
Coronation Street star's mother who survived cancer creates aid to help others after breast surgery #Manchester,1
The Jezabels Heather Shannon diagnosed with ovarian cancer pic.twitter.com/HPIukF9izE,1
& for W2016 | Cancer Awareness Campaign | photographed by…,1
Moon in #Cancer Find Your Family xx pic.twitter.com/2g74qU4Far,1
'UK astronaut' on living with cancer #Sussexpic.twitter.com/V8OaicP3vf,1
#digitalhealth Excellent evening of great presentations and connections. Cancer and technology. #preventionpic.twitter.com/8iVOjf9UiI,1
Free cancer support to come to #Chesham #Buckspic.twitter.com/TnX1Xj7QSS,1
BBC News: Sisters help launch cancer study aiming to end chemotherapy - … #genomes100k,1
Cancer patient committed suicide with overdose #Norfolkpic.twitter.com/gYWp1LhQZK,1
Tonight we lost a awesome #photographer to breast #cancer May You Rest In Peace My Beautiful…,6
IN PICTURES: Brave runners get Pretty Muddy for Cancer Research UK #Southendpic.twitter.com/PlhHfJ8R5n,6
More than 500 girls and women dress in pink to tell cancer to 'jog on' #Cymrupic.twitter.com/6xuWsCljQo,6
"Intros from ""Entrepreneurs Vs. Cancer""... (@ Manchester Cancer Research Centre) pic.twitter.com/cJnqARDFJ7",6
"#Essex: Popular cancer support scheme targets ""hard to reach"" parts of the community pic.twitter.com/sNQyCEqA9J",6
Golden Birthday 28/28 #june #junebaby #goldenbirthday #cancer @ Stadium of Light,6
Síle Seoige reveals how #Yoga helped after battling cancer - Irish Examiner #Yogapic.twitter.com/3uZUOU1wdS,6
"Popular cancer support scheme targets ""hard to reach"" parts of the community #Basildonpic.twitter.com/zcb3ph4GP7",6
"Popular cancer support scheme targets ""hard to reach"" parts of the community #Southendpic.twitter.com/Nc5ujn8bcg",6
#Essex: North Fambridge sailing instructor completes journey around Britain for cancer… pic.twitter.com/ljZ60krXpx,6
Síle Seoige reveals how #Yoga helped after battling cancer - BreakingNews.ie #Yoga,6
Health Matters: Cervical Cancer Awareness #Cheshirepic.twitter.com/lQBnWiSeBU,6
IN PICTURES: Brave runners get Pretty Muddy for Cancer Research UK #Basildonpic.twitter.com/AdMfhuwiIR,6
#Amersham School has an Hair-larious time for cancer charity #Buckspic.twitter.com/igWqWEiNBI,6
"to Jaheim for inspiring me. To draconian lore, for outdating easement of cancer. To Leo's for anthropomorphic content. Love.",6
Much-loved former teacher and asbestos campaigner loses cancer battle #Buckspic.twitter.com/DoWBLHiCBb,6
We're taking about cancer at the OLGBT glass-making workshop #olgbt #cancer #community #engagementpic.twitter.com/bmcHWyMac6,6
Watch Jon Bon Jovi Make a Surprise Visit to Lifelong Fan Battling Cancer pic.twitter.com/tLnKl7i1TS,6
Ramadan Kareem for everyone the most beautiful song of Ramadan and cancer patients revealed today ♡ :) :* <3 …,6
"The Lunar Walk for Breast Cancer Support Gibraltar who offer support, information and practical…",6
Thank you to the Breast Cancer Support Group for inviting us to cut the ribbon together with Dr…,6
Swansea Half Marathon smiles through the miles for Breast Cancer with…,6
Everyone subscribe to scarce on YouTube much better that cancer alert*drama,6
"Great day yesterday Horseracing to beat Cancer we raised £25,000 well done everyone",6
"Hospital midwife raises more than £1,000 to battle cancer in pregnancies with… #Cheshirepic.twitter.com/UUwIUSEYYS",6
Dad and son canoe 284 miles for breast cancer charity #Somersetpic.twitter.com/ulBXnEVrh0,6
5K Race For Life for Cancer Research UK done. Jogged it in 50… …,6
"we WILL beat Cancer someday #raceforlife (i miss u mama..tita mila, momy beth) @ Basildon…",6
To my beautiful mum and grandma. I am so proud of how you bravely fought cancer and eventually…,6
you are almost certainly right. Biase of the media is like a cancer.,6
you are very immature and your comments inflammatory. This is not a game - cancer funding being cut right now.,6
My turn now... Relay for life Walking from 00.30 until 04.00. #cancer #kanker #relayforlife…,6
#SummerLights #Macmillan #Cancer #Support over £600 raised by… …,6
Completed Cancer Research Pretty Muddy RFL in Basildon today... Really struggled round the…,6
"..good, it wld b strng, &UK leavng wld nt cause ths mess. EU is a disease, a cancer. NOONE leaves a floating ship..",6
Cancer charity appeals for volunteer therapists #Cheshirepic.twitter.com/RWbZG1jnbj,6
When life gives your cancer unleash your #innergeek #startrek #command #geeklife #geekgirl…,6
My new #dance partner Harry. Gr8 #marketing! mybollox 'bollox 2 cancer #BML16 @ The…,6
There ain't no party like a Bpositive party... #Bpositive #Glastonbury #cancer #Saturday…,6
"Just came back from holiday to find cancer research fundraiser on at Pilgrims Way, Wembley - still time to support if you are nearby.",6
#Stigmabase | IE - The skin cancer low-down from Down Under - He told Irish Medical Times that in the early days…,6
Teen Marcus is kicking off the afternoon's activities with a talk about his cancer journey…,6
MWIE - The skin cancer low-down from Down Under - He told Irish Medical Times that in the early days of the…,6
Beautiful day to run a 10k for cancer research #cruk #raceforlife #runlondon @ Victoria Park,6
Talking about global cancer communication in a bldg dating back to 1497. asco aiom…,6
A year ago today my mum sadly passed away from Pancreatic cancer. This past year and a bit has…,6
Lucy in Trot for Life cancer ride #Hampshirepic.twitter.com/1pxhVETjyv,6
Let's get muddy #prettumuddy #cancer #besties #5k #royalmarsden I'm so proud of my best friend…,6
#Essex: Loving wife from Ramsey launches fundraising drive for new cancer centre pic.twitter.com/GwgMJDCJcz,6
Friends raise cash for cancer charity by competing in golfing marathon #Buckspic.twitter.com/mOuxrRibRv,6
Good luck to redditch customer Paul who is boxing for a cancer charity. Sponsored by…,6
12-year-old cancer survivor to take part in six-mile walk for children's charity #Buckspic.twitter.com/EElzreVsTz,6
#Essex: Loving wife from Ramsey launches fundraising drive for new cancer centre pic.twitter.com/IChJzOvCzU,6
#Essex: Musician and ex-critic dies after struggle with cancer pic.twitter.com/hEtQjUa4jp,6
ATN Star Signs: Cancer Full range of diamante zodiac t-shirts will be available to order online…,6
ATN Star Signs: Cancer Full range of diamante zodiac t-shirts will be available to order online…,6
The star sign of ATN is Cancer. More reason to sparkle brighter over the next few weeks @ All…,6
Campaign for eye tests to spot cancer a ‘success’ #Suffolkpic.twitter.com/NAkFr4OYnj,6
Selling cakes for Breast Cancer today at London Waterloo East @ Waterloo East Railway Station -…,6
When the cat dying & your mother refusing cancer treatment aren't the worst things to happen in the week.,6
Crispr Wins Key Approval to Fight Cancer in Human Trials #business #marketing,6
Les insectes c'est le cancer,6
That time of the month again #donate #platelets #leukemia #cancer… …,6
Strong cancer survivor hosts tea party to help other sufferers #Berkshirepic.twitter.com/OVkD4cLAi2,6
Cervical cancer screening important for lgb women and transmen too! #TUClgbt,6
Tom Jones' 'heart stopped' when his wife received cancer diagnosis pic.twitter.com/nU8mv19xao,6
IN PICTURES: School holds its own Race for Life for cancer charity #Basildonpic.twitter.com/tnGLnhPO6p,6
sugar feeds cancer cells #Macmillan stop promoting sugar for coffee mornings by using #sugar,6
IN PICTURES: School holds its own Race for Life for cancer charity #Southendpic.twitter.com/7UHjvruEaE,6
thanks! Both myself and Jeff loved it! Thanks for having us.,6
"Shots complete time for some pain meds and cold compress on the area. After having cancer,…",6
"Horse riders to complete fundraising hack for £100,000 cancer appeal #Southendpic.twitter.com/0aEoIsTmI3",6
"#Essex: Horse riders to complete fundraising hack for £100,000 cancer appeal",6
"Horse riders to complete fundraising hack for £100,000 cancer appeal #Southend",6
"#Essex: Horse riders to complete fundraising hack for £100,000 cancer appeal pic.twitter.com/LYKIXv29f4",6
"#Essex: Horse riders to complete fundraising hack for £100,000 cancer appeal pic.twitter.com/WbmGYenhnI",6
"Horse riders to complete fundraising hack for £100,000 cancer appeal #Basildonpic.twitter.com/62dJa7YSRV",6
Today I had to sadly say goodbye to one of my good friends who lost his battle to cancer My…,6
I'm at Cancer Research UK,6
Cancer survival rates are cause for pride - AM #Cymrupic.twitter.com/GByQl7jCut,6
#LiveStrong New band replacement. Always supporting this charity despite the darkness. Cancer…,6
Josh Marshall was heartbroken that the scar left by his son Gabriel's fight with cancer made his…,6
"Ma Ma, film review: ‘Cancer movie starring Penelope Cruz makes you scoff and… #Londonpic.twitter.com/RecySB1zZJ",6
Yesterday I lost my only surviving grandparent to lung cancer. He was told that my mother was…,6
#wednesday day173 cgmlifestyle #chsrity #mind #cancer #fundraisingfun @ Galleywood Social Club,6
#Newport woman with cancer had three inch tumour hidden under fatty lump #Cymrupic.twitter.com/B7KSQrbf2X,6
#Essex: Family to host party of their lives to celebrate end of cancer treatment for their… pic.twitter.com/g471LNWodc,6
#Essex: Family to host party of their lives to celebrate end of cancer treatment for their… pic.twitter.com/MlaR4Sl5AK,6
Family to host party of their lives to celebrate end of cancer treatment for… #Southendpic.twitter.com/YxhXs85ReO,6
"Rotary Ride raises £1,000 for prostate cancer charity #Cymrupic.twitter.com/m12tIrsdh0",6
Family to host party of their lives to celebrate end of cancer treatment for… #Southendpic.twitter.com/iNHvWRKkwH,6
#Essex: Family to host party of their lives to celebrate end of cancer treatment for their… pic.twitter.com/Mwy5aAtQt4,6
Family to host party of their lives to celebrate end of cancer treatment for… #Basildonpic.twitter.com/0cG1LE8Srp,6
'My goal is to see that mental illness is treated like cancer' - 'QuoteoftheWeek #mhsm,6
"Race for Life 10km - ""Cancer, we're coming for you"" @ Arther Seat Hollyrood Park",6
"2014 – Author and activist, Gerry Conlon died of cancer, aged 60. …pic.twitter.com/DRoq1pmNEf",6
#blackandwhitephoto of the day with dancing interpretation of #Stromae - Cancer…,6
Local News: Fundraising pupils put on their running shoes in aid of cancer charity #Essexpic.twitter.com/nSXzeQUug5,6
"Nearly £20,000 raised for Prostate Cancer UK by Wigan's team of 13 pic.twitter.com/uCTrOB5LaG",6
preforming a song written for her brother about his battle with cancer such an…,6
Here for our first bowel cancer network meeting with partners listening to the cancer vanguard.,6
"Ball Girl-ing at the first Soccer and Spandex event, last weekend, in aide of Cavendish Cancer…",6
New charity video highlights cancer care in Gwent #Cymrupic.twitter.com/RUYt8jZXzW,6
"Yesterday the cat died. Today my mum starts radiotherapy for cancer. Having paid vets bills, can I just thank all UK taxpayers for the NHS.",6
Cancer charity chiefs to see rewards of their work at #Southampton General… #Hampshirepic.twitter.com/FY0LURqOo7,6
#Essex: NHS team to complete cycle ride to raise money for new state of the art cancer… pic.twitter.com/hs7dVYgLkD,6
Attended a wonderful evening to raise money for pancreatic cancer… …,6
my teacher can get cancer ebola,6
Investigation into work of cancer surgeon at Royal #Stoke... #Staffordshire,6
#Essex: Nurse tackles Inca trek in memory of cancer patients pic.twitter.com/u9NoXNVDTN,6
#Essex: Nurse tackles Inca trek in memory of cancer patients pic.twitter.com/LiyhrQunMZ,6
Nurse tackles Inca trek in memory of cancer patients #Southendpic.twitter.com/R9xT0Gi6cL,6
Nurse tackles Inca trek in memory of cancer patients #Basildonpic.twitter.com/Tea8umJ5xe,6
"If you're concerned about breast cancer, you might be wondering if there are steps you can take…",6
Back out today after a couple of weeks rest on the Cancer research open on the river Tees at…,6
Yo-yo dieter inspired to lose weight after son's cancer treatment #Herefordshirepic.twitter.com/rjF3ry2x6Z,6
If you #GiveASpit consider joining the blood cancer donation register. So easy to join the…,6
Iron Maidens Bruce Dickinson Singing Better Than Ever After Cancer pic.twitter.com/DKkwxheKaX,6
"Take that, bad knee, stroke, aneurysm, and cancer x2! He's going stronger than ever. Happy…",6
#Kidderminster teen’s selfless act to support young cancer victims #Worcestershirepic.twitter.com/LK6xxQghiS,6
"72 holes later and over £700 raised for Macmillan cancer support,… …",6
#Essex: Fundraising pupils put on their running shoes in aid of cancer charity pic.twitter.com/Rt2uSmY5YG,6
#Essex: Fundraising pupils put on their running shoes in aid of cancer charity pic.twitter.com/O4vFbIX2rf,6
Fantastic Day by all involved raising loads of money for Cancer Research UK @ Met. Police Sports…,6
#Essex: Fundraising pupils put on their running shoes in aid of cancer charity pic.twitter.com/CXpuQP3U7P,6
Fundraising pupils put on their running shoes in aid of cancer charity #Benfleet #Essexpic.twitter.com/im2BFGkag7,6
Fundraising pupils put on their running shoes in aid of cancer charity #Southendpic.twitter.com/ZjLzfoGXvS,6
