tweet_text,month_of_tweet
#Essex: GALLERY: Hundreds get on their bikes in huge cancer charity fundraiser pic.twitter.com/DkENZAR80q,5
Eeeek - in 24 hours I'll be starting a 26.2 mile walk to raise funds for new cancer care centre…,5
Just 1 days to go until our Charity Ball in aid of Cancer Research and Mcmillan…,5
Five members of the same family are planning a walk under the stars after one of them beat breast cancer #Cymrupic.twitter.com/eJyTbMJdUG,5
Burlesque dancer opens up about her terminal cancer diagnosis in heartbreaking video #Cymrupic.twitter.com/hJ31qMmCKg,5
Friends team up for event to help Cornard cancer sufferer enjoy one final holiday #Suffolkpic.twitter.com/NFzKAo59X4,5
Life carries on as normal sometimes despite cancer. #seagullfucking #seagulls #birds…,5
#Essex: Family hope to rally support for brave 18-year-old who has battled cancer four times pic.twitter.com/LrrJV3Z3uF,5
"Colchester woman took her own life after losing two of her partners to cancer, an inquest rules… #Essex #Colchesterpic.twitter.com/Zu2WKXPZTf",5
I'm out at the Cancer Support Centre today. This is the beautiful tranquil space at Mid West…,5
#Northampton widower overdoses on wife's leftover cancer medication after saying he 'wanted to be with… #Northantspic.twitter.com/bHI02t6dp9,5
#Essex: Family hope to rally support for brave 18-year-old who has battled cancer four times pic.twitter.com/4YPIlqNCUa,5
"Flashback: On this day in 1981, Bob Marley died of cancer at the age of 36. Robert Nesta…",5
Family hope to rally support for brave 18-year-old who has battled cancer four times #Maldon #Essexpic.twitter.com/lPoARuMFaW,5
Family hope to rally support for brave 18-year-old who has battled cancer four times #Colchester #Essexpic.twitter.com/on2AGBKfgR,5
Family hope to rally support for brave 18-year-old who has battled cancer four times #BurnhamOnCrouchpic.twitter.com/hD217cO8P7,5
My mum used to have a big health encyclopaedia when we were kids (who knows why) and just as Google does literally everything was cancer,5
Heartache as Bradley Lowery's devastated mum reveals his cancer has worsened #sheffieldpic.twitter.com/3vp9WHvZ5G,5
Fundraiser takes on 40km to Machu Picchu for breast cancer charity #Bedfordshirepic.twitter.com/88i7q46XXl,5
#rip #robertmiles you were #awesome #fuck #cancer @ Smart Xcape Real Estate Agent Puerto Banus…,5
Ugh. Just found out my great uncle has less than six months to live. Another reminder than cancer is the biggest cunt out there.,5
Fenn Holidays raise hundreds for cancer charity. #Cambridgeshirepic.twitter.com/iPRQKp0k8r,5
"·(°[Definin⁹ € #spirit ² consume world's cancer, there's plenty of other stuff ⁴'em doctors ² do. Wish € luck.]ⁱ)·{(˚[ł×≈#™⁰¹]ⁿ)≠",5
EVENTS - Show Cancer the Red Card - Cancer Screening Awareness Day at the Sovereign Centre next Saturday #afcb #afcbcstpic.twitter.com/GXyu9ruhKF,5
Dom Bergin from #Derbu dies after cancer fight and Do It For Dom... #Derbyshirepic.twitter.com/JYKKp20DI2,5
After work training run today with Natasha. We will be completing our 10k in July for Cancer…,5
Appeal to trace #Peterborough brick workers after former employee develops cancer #Cambridgeshirepic.twitter.com/rX0YFhwIJE,5
"Hopefully one less cancer site to worry about Watch ""We need to like literally #SaveEF"" on YouTube -",5
Sophie’s cancer story touches TV comedian Dara O’Briain’s heart #Suffolkpic.twitter.com/M8lwtrRxgb,5
#Essex: Gran who is fighting cancer is burgled for the second time in a month pic.twitter.com/dwGP07p1hh,5
"Sad to hear about the death of Trance music master, Robert Miles. Horribly unexpected cancer…",5
Teddington women are digging deep to raise money for the charity that helped 5-year-old rare cancer… #Londonpic.twitter.com/NaTUe33P9V,5
Cancer Bats to perform #BlackSabbath set as Bat Sabbath in Birmingham - pic.twitter.com/RSgJdMwKcU,5
Clinic available with jlbaesthetics to book cancer Jodie on 0750590782 #aesthetic…,5
Gran who is fighting cancer is burgled for the second time in a month #Basildonpic.twitter.com/0RVBhwtwMG,5
Gran who is fighting cancer is burgled for the second time in a month #Southendpic.twitter.com/20yGEgAiBa,5
Gran who is fighting cancer is burgled for the second time in a month #Southendpic.twitter.com/gNoDIiNnix,5
#Essex: Gran who is fighting cancer is burgled for the second time in a month pic.twitter.com/ydzDkDPsng,5
#Essex: Gran who is fighting cancer is burgled for the second time in a month pic.twitter.com/XmFBDxfKdW,5
COMPETITION TIME - Find the ballPROSTATE CANCER AWARENESS . Like this post and write either…,5
Two-hour fitness challenge to raise funds for cancer treatment #Somersetpic.twitter.com/HDe2wogQOf,5
vavimakeup nailed it today on the beautiful apollineameel for warriors_against_cancer_vzw…,5
Prince Charles and the Duchess of Cornwall visit Cancer Centre in Northern Ireland #Politicspic.twitter.com/B4Oo8it0Oy,5
Cancer patient’s bike ride to repay ‘ward that saved my life’ #Sussexpic.twitter.com/XPy6HvvjEr,5
"#Indonesia, another state & society trying to develop as moderate & secular,but slowly destroyed by the subversive retarded cancer of #islam",5
Macmillan Cancer Support bus to travel around Norfolk #Norfolkpic.twitter.com/HfpCCk6McS,5
"At 12.55pm today, Tuesday 9th May 2017 dad lost his battle with brain cancer. He passed away…",5
Kick off for Cancer official celebrity line up May 27th who's reaching? Going to be live!!…,5
Chinese Startup Infervision Emerges From Stealth With An AI Tool For Diagnosing Lung Cancer #business #marketing,5
Cancer survivors boosted by ‘HOPE’ course #Norfolkpic.twitter.com/iH7U7btdF5,5
Talking skin cancer prevention,5
TOTALBODY x BREAST CANCER NOW || From today I am realising a mini series highlighting where I…,5
APPEAL: How your postcards from across the world could brighten cancer-stricken South Yorkshire tot's day #sheffieldpic.twitter.com/6nctN3GSF1,5
#victoria #sliced #cakesale #cancer #london #charity #1 #dronestagram #instayum #nom @ Gipsy…,5
Local News: Inspirational aunt diagnosed with cancer during 12 half marathon bid - so niece steps in to… #Essexpic.twitter.com/4plr9BAaXG,5
Young mum with terminal cancer refused drug that could prolong her life #Cymrupic.twitter.com/8DwwiIabvp,5
I think that particular smell when u get off a sunbed is the smell of cancer,5
#cakesale #cancer #fundraising @ Gipsy Hill,5
#Essex: Kind-hearted teenager was set to donate Ed Sheeran tickets to terminally ill cancer sufferer pic.twitter.com/DFOtOtIFif,5
Kind-hearted teenager was set to donate Ed Sheeran tickets to terminally ill cancer sufferer #Colchester #Essexpic.twitter.com/DaZlDRwb4L,5
Mindshare video raises ovarian cancer awareness: To raise awareness about… #agencies #cosmopolitan (via,5
Lung cancer patient takes abseil challenge #Sussexpic.twitter.com/4oydjqYkoe,5
COMPETITION TIME - Find the ballPROSTATE CANCER AWARENESS . Like this post and write either…,5
"Olly, aged 5, has drawn up a bucket list after his cancer came... #Devonpic.twitter.com/Dy3mF2CD1m",5
Scientists studying cancer stumble on 'breakthrough' in search for baldness cure #Politicspic.twitter.com/66H1vKoXWZ,5
"I've decided to do Walk All Over Cancer this June, and would love it if people would click the…",5
"Great cycle today for the Helen Rollason Cancer Charity bike ride. 15 miles, great weather an…",5
"#Essex: Healing group raise £1,500 for a cancer charity pic.twitter.com/OTqcUn5sdi",5
Healing group raise £1500 for a cancer charity #Thurrockpic.twitter.com/77hpwI1sQD,5
Healing group in Thurrock raise £1500 for a cancer charity #Thurrockpic.twitter.com/QtuKJG3XHb,5
Healing group raise £1500 for a cancer charity #Thurrockpic.twitter.com/zvGilxzRe1,5
Norfolk cancer patient announces run for Jeremy Corbyn’s seat #Norfolkpic.twitter.com/urxm2Fd4Gk,5
#KingsLynn store staff pedal on for breast cancer cause #Norfolkpic.twitter.com/mtqgnj7XgW,5
J.W. -- Inform me more about your fight on cancer. How [...] … #Swiss #hookup #date #chat,5
"Fantastic answers Expose religion for what it really is. ""Bone cancer in children? What's that about?""",5
Ben Youngs drops out of Lions squad to support his family following sister-in-law’s terminal cancer… #Norfolkpic.twitter.com/Js8iDBB0Yu,5
"Hook a duck in Abbots Langley, win a free 1 month membership at YMCA and talk to us about physical activity and cancer. pic.twitter.com/5TjUZmqlQi – at YMCA Centre",5
#Essex: Inspirational aunt diagnosed with cancer during 12 half marathon bid - so niece steps in to finish pic.twitter.com/cWwgMYPRgj,5
Inspirational aunt diagnosed with cancer during 12 half marathon bid - so niece steps in to finish #Basildonpic.twitter.com/MEHJrOPNF3,5
Irfon Williams knows that he is going to die of cancer and this is how he deals with it #Cymrupic.twitter.com/ypAJYLqMhW,5
The #Romsey School Choir Festival Tuesday 4th July 6pm a Event raising funds for Jane Scarth Cancer Care pic.twitter.com/vdg9NsjC1z,5
Inspirational aunt diagnosed with cancer during 12 half marathon bid - so niece steps in to finish #Southendpic.twitter.com/6F70B9Puw5,5
"Aspirin May Prevent Cancer From Spreading, New Research Shows #business #marketing",5
Highbury tech company wins award with blood count device for cancer patients #Londonpic.twitter.com/5cHivQRlvq,5
"Breast Cancer Coalition of Rochester Offers Free, Five-Week #Yoga - My Twin #Yogapic.twitter.com/431LaLfs3A",5
#Essex: Big pink truck helps to drive home cancer awareness,5
Former Black Flag Bassist C'el Revuelta Dies From Brain Cancer #musicpic.twitter.com/NOqtbbnxtj,5
#Essex: Big pink truck helps to drive home cancer awareness pic.twitter.com/DSiRhLFTkR,5
Big pink truck helps to drive home cancer awareness #Southend,5
Big pink truck helps to drive home cancer awareness #Southend,5
Big pink truck helps to drive home cancer awareness #Basildon,5
"Tropic Of Cancer with Demdike Stare at Jazz Café (May 31, 2017) pic.twitter.com/fYTVkotwrt",5
Pub offers free meals for cancer support nurses throughout May #Oxonpic.twitter.com/6WbUfJAjYB,5
Progress #cancer #research #institute #health #medicine #fire #tragedy #hope #monolith…,5
"New perspectives against prostate cancer, 2017 AD: Tim Baldwin salzmanart #leonardo…",5
10 Things Every Woman Should Do to Help Prevent Breast Cancer #Fitnesspic.twitter.com/IFcJzFhcJV,5
"Wendy Dio Talks 3rd Annual Ride for Ronnie, Importance of Early Cancer Detection + Dio Disciples Plans #musicpic.twitter.com/Pdu1S8LBNj",5
Cancer ribbon done today fundraiser tattoo #design #tattoo #tattoos #tattooartist…,5
Trusts fail to meet bowel cancer test waiting times target … via,5
"THIS SUNDAY - #CHRONICALLYACUTE ""Uniting to Help the Fight Against Blood Cancer"" - Come along &…",5
Before I go and vote I was wondering what plans you have for NHS as my 11 yr old undergoes a long battle with cancer at RMCH? pic.twitter.com/NloJBVXDEl – at Childrens Hospitals Appeal,5
fundraising for PROSTATE CANCER UK. Donate to Vicki's JustGiving page … #barnsleyisbrill #sheffieldissuper,5
Cancer sufferer left in 'agony' after being 'ignored by GP' #Maldon #Essexpic.twitter.com/mgI3GspwM6,5
Prostate cancer: Blood test could help target treatment #Londonpic.twitter.com/ryEygCaVL4,5
Cancer sufferer left in 'agony' after being 'ignored by GP' #BurnhamOnCrouchpic.twitter.com/z0P1wVewYr,5
"I'm at KidsCan Children's Cancer Research Centre - in Salford, Lancashire",5
"A man ran Humber Bridge, York and London Marathons to remember close family he lost to cancer #Cymrupic.twitter.com/WsXQwBaVju",5
Head shaves for #Newport mum with inoperable cancer #Cymrupic.twitter.com/UGD8yc0l3w,5
Iron Maiden's Bruce Dickinson shares details on “getting stuck in” to his cancer diagnosis - pic.twitter.com/Hlq8uJsJuG,5
"All the hoorays, mother does not have cancer after all - many thanks to everyone who crossed your paws for her! pic.twitter.com/UaR8BJKEGa",5
Bruce Dickinson Feared Singing Like 'Bag of Spanners' After Cancer Fight #musicpic.twitter.com/0RpkumQztk,5
MP in cancer awareness bid #Southendpic.twitter.com/KU6UCtQ8iL,5
"One of our best friends, producer & dj Helly Larson, was diagnosed with brain cancer 6 month…",5
MWIE - Cancer survivor beginning to lose his sight sets sail around Ireland to raise money for charity - He…,5
#Stigmabase | UK - Cancer Poverty - Yes It Is A Thing! - You hear about different forms of poverty as we go about…,5
#Stigmabase | UK - Cancer Poverty - Yes It Is A Thing!,5
MP in cancer awareness bid #Basildon,5
Ladies who lunch for a good cause. Foreign Sisters Lunch for Cancer… …,5
Devoted family to tackle gruelling Tough Mudder race for pancreatic cancer charity #Bucks,5
Belles to battle breast cancer with power walking marathon #Maldon #Essexpic.twitter.com/oOCTbme3co,5
#Daventry all set to ‘go green’ for cancer charity day #Northantspic.twitter.com/WTkJZkYzZl,5
pitching about innovative real-time dosimeters for cancer patients pic.twitter.com/EjHetBzOdK,5
Belles to battle breast cancer with power walking marathon #BurnhamOnCrouchpic.twitter.com/UkecaTLaks,5
Half hour early - nice & quiet - everything crossed (@ Cancer Centre at the Queen Elizabeth Hospital),5
Raise awareness for prostate cancer. Can you please up load a everyone. Cheers…,5
18-Year-Old Mexican Student Designs Bra That Can Detect Breast Cancer #business #marketing,5
Video update is given on #Croydon TV star Delroy Anglin's cancer... #Surrey,5
"Supercomputers Assist In Search For New, Better Cancer Drugs #business #marketing",5
Why cancer isn’t putting brakes on Jules and pals #Southendpic.twitter.com/HhmwYSj2z7,5
My sister tracy ringing the bell after finishing her radiotherapy for breast cancer #breastcancer #surviver pic.twitter.com/frwk4ECCx5,5
Why cancer isn’t putting breaks on Jules and pals #Basildonpic.twitter.com/xXNx5TOOZn,5
2 months to go! Lots of training and events! I'm fundraising for PROSTATE CANCER UK & I'd love…,5
18-year-old Mexican student designs bra that can detect breast cancer | The Independent …,5
Now qualified to support cancer clients through complementary… …,5
'Know the Signs' to fight lung cancer #Colchester #Essex,5
Thank you to for the donation of £1000 from the Community Shield. #fundraisingcardiffpic.twitter.com/1p0f32EMYa,5
Sheffield novelist's cancer charity donation - The Star #sheffieldpic.twitter.com/7DbwinRcUA,5
Sheffield novelist's cancer charity donation - The Star #sheffieldpic.twitter.com/MCtyAGGZh0,5
'Know the Signs' to fight lung cancer #Maldon pic.twitter.com/UTp8DOYLrb,5
Sheffield novelist’s cancer charity donation #sheffieldpic.twitter.com/Vpb2tLM6n7,5
BBC newsreader Rachael Bland fighting cancer tells of struggle to avoid hot-desk germs #BBCpic.twitter.com/ojhLczvSMo,5
"If You Love Boobs, You'll Love This Ad For Breast Cancer Awareness #Fitnesspic.twitter.com/lSDzBudf5p",5
The finish line after the Arc Cancer Support 10K. Absolutely shattered! It was a great run for…,5
"01/05/16: ""#FuckCancer."" My strain of cancer has been killing people for at least 1.7 million…",5
#allsaints #mensstyle #menswear I found this #jumper from #charityshop cancer_reasearch_uk…,5
How drinking THREE coffees a day can cut prostate cancer risk #Birminghampic.twitter.com/KrunHEgfFT,5
4 weeks until my 2nd 10K! I am running the Great Manchester 10k for the Teenage Cancer Trust…,5
He's off! The Cancer Bonus Tour #tcbt17 @ Concorde 2,5
‘I will never be free of cancer now’ - Laura Hughes’ determination to fight cancer as guest of honour for… #Norfolkpic.twitter.com/9HKf4ws3PS,5
"Rest in peace Cassandra, this song is for you #fcancer #fighter #LETfamily…",5
Man and dog walk 100 miles to support cancer charity #Somerset,5
Teacher battling kidney cancer is racing ahead with parkrun challenge #Cymrupic.twitter.com/CKWx41Q9n6,5
Such a good day yesterday! Dan was diagnosed with cancer this time last year and now has…,4
Brentwood vs. Cancer @ Brentwood Centre,4
Show Case Brice Conrad - Selestat contre le cancer #Show #Case #Brice #Conrad #Ehoh #Selestat…,4
"So, has already raised 50k this year to support kids going through cancer.",4
Zombie Elvis to run ‘world’s dullest marathon’ in Martlesham Heath for Macmillan Cancer Support #Suffolkpic.twitter.com/VjSX8eR02f,4
#Essex: New cancer support hub opens at nearby hospital pic.twitter.com/xMVqnXrMPK,4
I do enjoy Coffee & a Cigarette mind you I neither encourage or recommend Smoking its bad for your health & causes #Cancer,4
"Amazing teenager who died of cancer has raised £250,000 for charity #Manchesterpic.twitter.com/tOZ6gLLIl4",12
My little sister just told me awful news... if you think cancer can walk around you.. no fucking…,12
#Wowzers! @ Cancer Research UK,12
#Stunning #Textures... @ Cancer Research UK,12
#Vintahe #Wool #Cape... #needisaymore? @ Cancer Research UK,12
And A #ProperGentleman's #window for the #Men of #Henley! @ Cancer Research UK,12
A #Marvellous #MerryChristmas #Window! Reminds Me of #JudyGarland... @ Cancer Research UK,12
Plea to help blind boy who has twice beaten cancer fulfill his... #Surrey,12
Prostate cancer survivor sets up unique support group #Hampshirepic.twitter.com/cfkDBUP5r5,12
Co-founders Ian and Lynne took buffet treats to the children's cancer ward. It's Good 2 Give…,12
An eight-year-old girl's very special Christmas gift to those battling cancer #Somersetpic.twitter.com/BUxMdcx3Yg,12
Hampshire couple decorate home to raise money for children's cancer unit #Hampshirepic.twitter.com/0vVfrOzFx0,12
#SShhh... We #Back on #Tuesday! #MerryChristmas #christmaseve @ Cancer Research UK,12
Adam has beard dyed for cancer therapy charity #Herefordshirepic.twitter.com/G1hGsaA7Ad,12
This #Trenchcoat just #Exudes #Luxury!... #glow #lux #luxe #glamour #glam @ Cancer…,12
Or this #Absolutely #Stunning #GatheredWaist #Trench? @ Cancer Research UK,12
Or How About this #Foxy #RidingJacket? #Joules @ Cancer Research UK,12
#Still Some #Great #Gifts #Instore! #Henley #Cruk #1DayToGo @ Cancer Research UK,12
"#Shrewsbury daredevil Freddie, 12, raises £1,600 for cancer charity after grandad taken ill #Shropshirepic.twitter.com/8KDJmFOoqy",12
He was a brave man. Amazingly he raised public awareness of cancer & started the fight against it.,12
MALICE Guitarist MICK ZANE Dies After Battle With Cancer pic.twitter.com/LcBsHTOUB6,12
"£500 donation each from John Terry & Frank Lampard to Cancer Trust, big respect.",12
Clairvoyant from #Stafford dies following battle with cancer #Staffordshirepic.twitter.com/YrmDtbwXIa,12
"Chelsea stars support man who has run nearly 1,000 miles for cancer charity #Surreypic.twitter.com/uRKQ0WOcRK",12
MALICE Guitarist MICK ZANE Dies After Battle With Cancer #musicpic.twitter.com/LNEcUl3Pnr,12
Seven gift ideas for cancer sufferers feeling alone in Bedfordshi... #Bedfordshirepic.twitter.com/EBBYBTUAhG,12
Beautiful night catching up with friends and raising money for Cancer Research @ Maesteg,12
'Scotts Menswear x One True Saxon x Casual Co Teenage Cancer' Weir from Dec 2016 by,12
Michael Buble had 'crazy' Christmas plans before son's cancer news pic.twitter.com/G1ONEyIDwA,12
"Outwell man died due to asbestos cancer, inquest hears #Norfolkpic.twitter.com/vZEE5U8QJ0",12
Chelsea stars support man who has run nearly 1000 miles for cancer charity #Londonpic.twitter.com/YMQONyfOmk,12
So proud of my amazing wife Meghan for catching this so early. Checking for mouth cancer is…,12
Delays star Greg Gilbert cancer appeal 'among fastest ever' #Hampshirepic.twitter.com/cIPzpEIH5V,12
"#Chester OAP walks more than 1,000 miles for cancer research #Cheshirepic.twitter.com/2CBpqve8ao",12
A 12-year-old cancer victim was laid to rest in a pink coffin with a white carriage #Cymrupic.twitter.com/Pve0jTm2iD,12
#Essex: Veteran footballer's gift to young cancer patients pic.twitter.com/IVV7Svm95v,12
Welsh researchers have made a major breakthrough in diagnosing bowel cancer #Cymrupic.twitter.com/M93OCBGDeR,12
#Essex: Veteran footballer's gift to young cancer patients pic.twitter.com/tWJDQa31kq,12
The Delays Frontman Greg Gilbert Diagnosed With Stage 4 Cancer,12
Chesterfield College students join fight against skin cancer #Derbyshirepic.twitter.com/zE0y7K9byE,12
The Delays Frontman Greg Gilbert Diagnosed With Stage 4 Cancer #music,12
How Prime Minister Theresa May helped me raise money for cancer equipment #Buckspic.twitter.com/y1qaVjC1eD,12
Out for a spin with the Mrs for the 1st time since cancer. Loved it. #fuckcancer #cyclinglife…,12
Showbiz News: Crowdfunding campaign launched to save British singer from cancer #Worcestershirepic.twitter.com/I0SyyjazWN,12
The Singing Club at Cancer Services #Buckspic.twitter.com/AIYH7NTPaY,12
Living life to the full at Christmas with support from Sheffield cancer centre - Sheffield Telegraph #sheffieldpic.twitter.com/maXxLRvuAn,12
Living life to the full at Christmas with support from Sheffield cancer centre - Sheffield Telegraph #sheffieldpic.twitter.com/0kG2brC6eJ,12
"Delays Greg Gilbert crowdfunding for £100,000 cancer treatment #Hampshirepic.twitter.com/0B5LbwaT1m",12
School supports cancer charity for popular teaching assistant #Worcestershirepic.twitter.com/nrgKDQz1AK,12
#Southampton rock star diagnosed with cancer and fundraising for life-saving treatment #Hampshirepic.twitter.com/GrRm3BPiVB,12
This 19-year-old cancer survivor is now training to be a nurse #Hampshirepic.twitter.com/8VIrS7CqnK,12
"Woman, 24, arrested on suspicion of posting abusive Facebook message about cancer fighter Bradley… #Cambridgeshirepic.twitter.com/do11k3oh8l",12
Worcestershire Acute Hospitals NHS Trust cancer surgeon charged with fraud #Birminghampic.twitter.com/ONUJIRgCOt,12
#Kenilworth brothers to attempt ‘drop kick challenge’ for charity which helped cousin beat cancer #Warwickshire,12
Sheffield scientists set to get £1 million boost for cancer research - University of Sheffield News #sheffield,12
Sheffield scientists set to get £1 million boost for cancer research - University of Sheffield News #sheffield,12
#Essex: Fundraising for beloved Chelmsford teacher who died of cancer...,12
#Northampton couple to host charity trampoline event to fund cancer patients' presents #Northantspic.twitter.com/y3l5kxstjr,12
Harlow pensioner Terry Card raises hundreds for St Clare Hospice and Macmillan Cancer Support #Harlow #Essexpic.twitter.com/XnZfAy7E2J,12
Sadness as cancer sufferer who desperately wanted to see toddler son open his Christmas presents passes away #Buckspic.twitter.com/MZ2qeAsyOF,12
CHARITY BID: Baring our bottoms for bowel cancer #Derbyshirepic.twitter.com/AxeFS6b1Jx,12
Thank you to Clic Sargent & St Jude's Children's Cancer charity (Signet Jeweler) for giving my…,12
About thirteen years ago a Japanese cancer survivor continued her job of wrangling a bunch of…,12
Brave mum who was diagnosed with cancer while pregnant passes away #Buckspic.twitter.com/5HxRYkenVy,12
Brave Bradley Lowery's battle against cancer inspires #Northamptonshire police officer to help appeal #Northantspic.twitter.com/CD2G68fw1R,12
Bogus callers who said they were collecting for cancer charities have sparked a police warning #Cymrupic.twitter.com/6nmbQE8lFj,12
Prostate cancer laser treatment could be a game changer for men #Politicspic.twitter.com/EKDgMG32pD,12
Sometimes communication requires multiple devices sing_with_us team meetings @ Tenovus Cancer Care,12
"As a Recovering alcoholic. If I can diagnosed with terminal cancer & stay clean, what's your excuse. #diedsober 2016pic.twitter.com/8v5pjbTdgi",12
Celebrating Mum being cancer free for 3 years today @ Jamie's Italian Westfield Stratford,12
Cancer charity launch new campaign #Worcestershire,12
Thom Yorke's longtime partner dies of cancer pic.twitter.com/QAva4JXOhJ,12
#Wowzers.. What Did I#Tell You!.. #pharrellwilliamsxadidas #humanrace #trainers @ Cancer…,12
Britain's Got Talent star performs for cancer patients and staff #Cheshirepic.twitter.com/861uskQjtp,12
Cancer treatments could be delayed by Royal Cornwall Hospitals... #Cornwall #Kernow,12
"Due to the events in Berlin last night,unfortunately,I will not be appearing on to discuss Prostate Cancer...maybe later",12
Boxing couple raise thousands in fight against cancer #Hertfordshirepic.twitter.com/i1YGeEjDok,12
MASTODON Drummer On Upcoming Album: 'It's About Going Through Cancer' #music,12
"famine seems unlikely, cancer not a certainty",12
"Santa busy peddling for cancer... #charity #christmas2016 #cancer #kenilworth @ Kenilworth,…",12
Terminal cancer patient who killed dementia-suffering wife left note to say 'sorry for nuisance' then… #Politicspic.twitter.com/scniO40V86,12
Not sure who recommended me to but Thank you> 0810 Tues piece on Prostate Cancer. Fame at last !!,12
NHS bosses move forward with controversial cancer services... #Staffordshirepic.twitter.com/Tifwv0ADuM,12
cancer ..,12
So proud! Great night at the boxing and 5k raised for cancer research #whitecollarboxing…,12
Keen footballer diagnosed with breast cancer wants everyone to self examine #Herefordshirepic.twitter.com/9lBDuWEL2K,12
Shoppers help Norfolk cancer charity shops ring up their best year #Norfolkpic.twitter.com/6rVKDd567F,12
Legendary 'Rockline' Host BOB COBURN Dies After Battle With Cancer pic.twitter.com/toYaNiLkAj,12
Legendary 'Rockline' Host BOB COBURN Dies After Battle With Cancer #musicpic.twitter.com/aMzPa7DIGS,12
Legendary 'Rockline' Host BOB COBURN Dies After Battle With Cancer #musicpic.twitter.com/aStFKtDXXN,12
Legendary 'Rockline' Host BOB COBURN Dies After Battle With Cancer #musicpic.twitter.com/Al5HEZmLFC,12
Legendary 'Rockline' Host BOB COBURN Dies After Battle With Cancer pic.twitter.com/oqdTnAHynQ,12
#ginger the wonder #food that fights #cancer @ Tracy Fance Clairvoyant-Medium,12
Legendary 'Rockline' Host BOB COBURN Dies After Battle With Cancer #musicpic.twitter.com/nVunKxFjX9,12
Legendary 'Rockline' Host BOB COBURN Dies After Battle With Cancer #musicpic.twitter.com/NDWW9g9ojC,12
