tweet_text,month_of_tweetNew post (What Science Says about Link Between Diet and Cancer) has been published on Rantes,5
What Science Says about Link Between Diet and Cancer - …,5
judge my shit from cancer/fapping-worthy pic.twitter.com/5mu6VnPDsB,5
'NHS treatment delay' caused cancer patient's death Unforgivable …,5
"The day I say I hate community ER, it surprises me and keeps my brain occupied. Meningitis. New cancer. Osteo. IV hypertension mgmt.",5
The Chemo Made Me Do It - Green #cancer #survivor,5
#EverybodyLetsAll #fightcancer and support B+Foundation by voting for me for #missjetset2016 … #cancer,5
Powder causes cancer #law …,5
automatically has cancer No good characters you gotta let /v/ shill you into buying a vita and cyber sleuth I'll look into,5
Congrats to #Pitt RB James Conner on learning he is cancer free #BeatCancer #ConnerStrong …,5
Check out my new blog post! Lawsuits Over Baby Powder Raise Questions About Cancer Risk by RONI CARYN RABIN,5
let the cancer begin #Overwatchpic.twitter.com/s0Khwdb2ty,5
Well i just heard unicorns killed my girlfriend for the first time and holy fucking shit i have stage 4 cancer...,5
I fucking hate cancer!!!,5
Cancer True story,5
"Patient Power Now Covering Head/Neck Cancers: Patient Power, a global leader in connecting cancer patients an...",5
National Cancer Institute admits millions of #cancer patients never had cancer at all …,5
"The Royal Marine Hotel, Dunoon will be glowing gold on the 1st of September to support childhood cancer awareness pic.twitter.com/u9D2wPzald",5
didn't know walmart had a cancer section pic.twitter.com/Pw0oW9TJH0,5
WITH MEMORIAL DAY THIS WEEKEND FIND IT IN YOUR HEA TO HELP A VETERAN BATTLING CANCER GOD BLESS,5
this woman has obfuscating HealthAuthority & Fraternity ofPhysicians to deal w/ along w/ cancer diagnosis I know I'm living it,5
English News 'NHS delay' caused cancer patient's death,5
Let's honor our loved ones by protecting them from Alcohol and Cancers-Lose the Booze-JMF Research BC,5
"help us kill cancer forever. please donate and give cancer the middle finger, donation link in…",5
"Tf kind of comparison is this Holy shit, white ppl don't give you cancer?!!??! …",5
"5 years ago today my Dad was diagnosed with cancer. So on behalf of everybody that's suffered we want to say... Dear cancer, #F #RIP",5
Childhood Cancer TalkRadio Live: General Counsel for the Children’s Cancer Therapy Development Institute,5
New Data for Eisai's Halaven® (eribulin) and Lenvima® (lenvatinib) in Hard to Treat Cancers will… #ots #Wirtschaft,5
Pittsburgh Panthers RB James Conner announces he is cancer-free,5
Update: I think I've given myself skin cancer. #palepeopleproblems,5
Doctor Claims That People Die From Chemotherapy Not Cancer,5
cancer,5
Thanks We are praying it's not cancer.,5
WITH MEMORIAL DAY THIS WEEKEND FIND IT IN YOUR HEA TO HELP A VETERAN BATTLING CANCER GOD BLESS,5
This is cancer,5
untag before I get cancer costcred,5
Pampered chef ceramic bowl w cherries breast cancer Help whip Cancer pink ribbon: $39.95End Date: Wednesday ...,5
"One Person's Cancer Can Be Fought Using Someone Else's Immune Cells, Study Finds …",5
These Wigs Help Girls With Cancer Be Princesses,5
Please read and sign the Breast Cancer Patient Education Act petition! …,5
Thoughtful post on ethical decision-making around breast cancer prevention and removing healthy breast tissue. | …,5
WITH MEMORIAL DAY THIS WEEKEND FIND IT IN YOUR HEA TO HELP A VETERAN BATTLING CANCER GOD BLESS,5
Two months ago I requested prayer for a dear friend of mine who had been diagnosed with Cancer. She has had 8...,5
LSU mascot Mike VI diagnosed with rare cancer #sports,5
I'm not really into cry babies TBH. Cant Go wrong with a Cancer though,5
Just Pray that it's not cancer.,5
Pitt RB James Conner announces he’s cancer-free …,5
Rock legend Wilko Johnson on surviving 'terminal' cancer …,5
Pitt RB James Conner announces he’s cancer-free …,5
I started crying because I confessed to you and Corey that I'm being tested for Testicular Cancer?,5
Pitt RB James Conner announces he’s cancer-free …,5
Pitt RB James Conner announces he’s cancer-free …,5
Pitt RB James Conner announces he’s cancer-free …,5
WITH MEMORIAL DAY THIS WEEKEND FIND IT IN YOUR HEA TO HELP A VETERAN BATTLING CANCER GOD BLESS,5
Could've cured cancer but instead we figured out how to turn corn into sugar poison. And it's so GOOD. Go us!,5
Pitt RB James Conner announces he’s cancer-free …,5
Looking for a young Shihtzu for a person that lost her dog to cancer,5
cancer sucks ass,5
Pitt RB James Conner announces he’s cancer-free …,5
Pitt RB James Conner announces he’s cancer-free …,5
Tf kind of comparison is this holy shit. White people give me cancer …,5
smh. The man just beat cancer and people are going to bust his chops about his faith. No respect.,5
Novel trial approaches may help to make cancer treatments more precise #Oncology #News,5
Mongolian Economy - Mongolia is leading the world in terms of rate of liver cancer,5
Very important message to all Canadians-Reduce your risk for Cancers-Avoid drinking any Alcohol it is carcinogenic,5
A 27-Year-Old Died After A Doctor Mistook Her Breast Cancer For #fitness #fit #health pic.twitter.com/IRCWSwRixK,5
WITH MEMORIAL DAY THIS WEEKEND FIND IT IN YOUR HEA TO HELP A VETERAN BATTLING CANCER GOD BLESS,5
Wonder if an alkaline diet would stop the cancer?.,5
A woman with skin cancer posted a graphic selfie stick is shaped like a human arm to make it look like you're never alone,5
"Australia’s Biggest Morning Tea! TODAY at Concord Library 10am to 11.30am, help support this fantastic Cancer Council fundraising event!",5
James Conner cancer free,5
>He instantly gets lung cancer,5
President Barack Obama & Argyle Pink Diamonds Tyrone Argyle Cancer Formula,5
WITH MEMORIAL DAY THIS WEEKEND FIND IT IN YOUR HEA TO HELP A VETERAN BATTLING CANCER GOD BLESS,5
I think I have tongue cancer,5
WITH MEMORIAL DAY THIS WEEKEND FIND IT IN YOUR HEA TO HELP A VETERAN BATTLING CANCER GOD BLESS,5
Cancer survivor pic.twitter.com/YeRC3AuaiB,5
wastes of oxygen like these are the reasons why cancer still exists on this planet …,5
Finally some good news - NO CANCER in the mass or cysts removed from my breasts!! I'm so happy I could jump but I'm way too sore for that.,5
[SB Nation] Pittsburgh Panthers RB James Conner announces he is cancer-free … #Pitt,5
"now, on that note GET CANCER SWOOSH 7F",5
Cancer care meets big data: SA's latest treatment breakthrough #Opines on #BigData,5
"Lawsuits Over Baby Powder Raise Questions About Cancer Risk, via …",5
cancer?,5
The Texas Medical Board: Save Doctor Burzynski's Life-Saving Cancer Treatment - Sign the Petition! … via,5
LSU's Tiger Mascot Mike VI Diagnosed with Cancer; School Estimates Treatment Could Extend Life from 1 ...,5
WITH MEMORIAL DAY THIS WEEKEND FIND IT IN YOUR HEA TO HELP A VETERAN BATTLING CANCER GOD BLESS,5
Cant Go wrong with a Cancer though,5
Young Canterbury woman uses diagnosis to educate others about breast cancer,5
Cancer free love!!,5
Sometimes I wish I had cancer,5
Check it out! I donated to Janelle's Battle with Lung Cancer via,5
This looks like cancer. …,5
Combining Chemotherapy and Nigella Sativa for Cancer Eradication:,5
"YOU BOUTTA DIE FROM CANCERS AND THE CURE is on ur man's pinky, reachin out to save yo stubborn ass: whatchu do then",5
Lawsuits Over Baby Powder Raise Questions About Cancer Risk...,5
"BostonGlobe: Jill Biden headed to Boston for cancer ""moonshot"" pic.twitter.com/7gn6x2wNp2",5
"Love the idea, not crazy about the name >> Knitted knockers offer gentle support for breast cancer patients",5
BC citizens message-Reduce your risk for Cancers-Avoid all Alcohol it is carcinogenic-,5
Don't let Donald Trump win that nigga cancer,5
Wondering What Caused the #Cancer? …pic.twitter.com/uuDMigTIYw,5
time for some cancer,5
tumor profiling finds targetable pathways and extensive CD8+/PDL1+ immune infiltration in inflammatory breast cancer,5
New cancer immunotherapy approach combines tumor fighting power with fewer side effects … vía,5
as somebody who has also been fighting cancer I wish you all the best,5
Pittsburgh RB James Conner is now cancer free after having Hodgkin's Lymphoma for the past 6 months. #pittsburgh #p…pic.twitter.com/aumUqTZDfP,5
"Robert Downey Jr., Chris Evans, and Gwyneth Paltrow visit fan battling cancer",5
a rash came up on my thigh and i looked for some topical to put on it and almost used fluorouracil but this shits for cancer smh,5
Consider being on my radio show … to promote your passion #cancer cures #Social Media,5
My dad talked to me for the first time in over a week only to tell me that my dog has cancer whaddufuck no time for sad shit,5
my PC has cancer,5
"if you didnt know cooked tomatoes and marijuana prevent cancer. not cure, but prevent.",5
"Meanwhile, Cuba's $1 cancer treatments turn citizens into flesh eating mutant zombies (I am Legend)",5
"May is skin cancer awareness month, do you check your spots?",5
Robert Downey Jr. and Chris Evans Are Real-Life Superheroes When Surprising Cancer Patient #senihiburan,5
Does Baby Powder cause cancer in women? Research into link mixed,5
that and the fact his shotties do too much damage at range and that invincibility of cancer UGH NOOOBY DUDE,5
How Spark and Hadoop Are Advancing Cancer Research - Datanami,5
"WebMD ""Can vitamin D help you lose weight, fight depression, or even avoid cancer? #Th… pic.twitter.com/mIXPLfZWhZ""",5
Role of Radiation Therapy Evolves for Elderly Patients With Breast Cancer #bcsm …pic.twitter.com/LF9ylq5uGo,5
I Helped My Wife Kick Cancer's Butt #breast #cancer #survivor #walk,5
"HOXA5 protein acts as tumor suppressor in breast cancer, lab cell st udy shows",5
I Helped My Wife Kick Cancer's Butt #breast #cancer #survivor #walk,5
I Helped My Wife Kick Cancer's Butt #breast #cancer #survivor #walk,5
I Helped My Wife Kick Cancer's Butt #breast #cancer #survivor #walk,5
Careful... I Already Kicked Cancer's Ass #thyroid #cancer #survivor,5
Careful... I Already Kicked Cancer's Ass #thyroid #cancer #survivor,5
Careful... I Already Kicked Cancer's Ass #thyroid #cancer #survivor,5
LSU's Tiger Mascot Is Diagnosed With Inoperable Cancer #shareablepic.twitter.com/1DdMWRoMOS,5
"""Scientist discovered chinese herb that kills cancer in 40 days """,5
"Help the #RedCross meet the high demand for platelets. Give for cancer patients, organ transplant patients & more:",5
Cancer care meets big data: SA's latest treatment breakthrough …,5
Reduce your risk for Cancers-Avoid all Alcohol it is carcinogenic,5
Actual cancer …,5
"If you know someone who has cancer and you love them, tell them about Poly MVA.",5
Dad died from operable pancreatic cancer after NHS trust seriously delayed treatment - Mirror Online: …,5
Aftacancer UKProduca ready2 … ibztour22\29aug bkme,5
Got the Pitt-Penn State game on my mind now that we got word is cancer free #H2P,5
find another scrim my PC has cancer,5
Praying my dad will fight thru this cancer bs & live to watch his grandchild grow up..,5
shaine has had cheeto cancer since 6th grade,5
The latest Cancer Research Digest! … Thanks to,5
Chemari is riding in the Great Cycle Challenge. Support Chemari's efforts to fight kids' cancer. …,5
I'm raising money for Catherine's Cancer Credit Collectio. Click to Donate: … via,5
I've remembered why I stopped playing World of Tanks... Players are absolute cancer Just a bunch of angry 10 year olds,5
"We are raising public awareness about cancer. If you have any question, our experts can help.",5
Robert Downey Jr. and Chris Evans Are Real-Life Superheroes When Surprising Cancer Patient: So who is this lu...,5
cancer …,5
"Breads, pavs, buns and pizza bases contain cancer-causing chemicals, says latest CSE report via",5
How far can you ride? Find out. Join Great Cycle Challenge this June and ride to fight kids' cancer.,5
Cancer Fairy is going to have to stop donating (I donated a lot before I was Cancer Fairy). ~$307.50 total. pic.twitter.com/mvbi5qZh6W,5
Eating Healthy Early in Life May Prevent Cancer,5
If only there were studies to prove that tobacco is a cause for cancer. Maybe they should make the public aware.,5
"That is true. However the cancer has spread far and wide. It will take years to drain the swamp. We the People are the Silent Majority, we have the patience...#MAGA",12
"Thank you, darling. He's a Cancer!",12
CANCÉR PLEASEEEE #HoróscopoZinoElFINAL,12
… Confusion About Testosterone Therapy and Prostate Cancer,12
"Hybrid Sperm may help combat cervical cancer, suggests study …",12
"Hybrid Sperm may help combat cervical cancer, suggests study",12
"There are bigger issues of course, but just because there’s cancer doesn’t mean we shouldn’t treat flus.",12
...but that's not just depressing shit you literally said you've thought about killing yourself or wishing you had cancer JUST so they'll notice you.. …,12
"Retweeted James Woods ( Say what one will about but without it, the cancer of the...",12
"Girl, 7, battling terminal brain cancer defies medics - but only after her family made a heartbreaking decision …",12
Know something that just makes me so mad is when a residents family member comes in with not a lick of a nursing background /health care background and starts going off like they know the cure for cancer . Stfu ugh,12
"Girl, 7, battling terminal brain cancer defies medics - but only after her family made a heartbreaking decision …",12
"Some nun that I don't know (Sister McDaniel) has left me 2 voicemails today. And in the second one she went on to tell me that her mom is dealing with depression and that her brother, Joe Long, has cancer. #Pray4JoeLong",12
"#healthiswealth, #curecancer, vegan cancer, vegan vs meat , cancer vegan diet, vegan cancer cure... - …",12
"Attn health policy makers in USA. This is what a govt funded, universal healthcare system can do. Cost of two 'life-changing' cancer medicines slashed by over $100k … via",12
"I’d say he’s even better in this film. He was getting treatment for skin cancer whilst filming and was advised not to finish the singing numbers, but he did It’s incredible from the very start. I’ve got a feeling you will love it...",12
"nigga survived Malaria, Hepatitis, Pneumonia, Dysentery, Skin Cancer, Anthrax, 2 plane crashes/explosions in 24 hours, shot himself in the foot while hunting sharks, hit by mortar fire in WW1 and a ruptured kidney/liver damage like what!? pic.twitter.com/FnoKoMFx1J",12
"It's like ""The English Patient"". I know nothing about it, but I sense that I'd never watch it,even if it was 50p,in a Cancer Research Charity Shop",12
Outrage after India minister terms cancer 'divine justice' - …pic.twitter.com/BvAq9PaijF,12
"Death of Catholic mother of 8 who delayed cancer treatment, and the abortion debate - The News Minute",12
". and I witnessed what I’m pretty sure was a first date! It appeared to start our really well, but by the time we left it had devolved into her trying to convince him that Xtianity is the one true religion, and him trying to convince her that feminism is cancer.",12
I sent food gift cards to a friend who is fighting cancer and “Dad” picture frames and a donation to two former students who lost their father this week. #Dayofhappy,12
Cancer No doubt …,12
Cancer #HoroscopoZinoElFinal,12
Helping improve the life quality of cancer patients and their parents …,12
"This games multiplayer is complete and utter cancer. I'm sick of being quickscoped, jump-shotted and outclassed by everything. Unless you're a high level or have a big bank account; you can't play this game without wanting to commit suicide. Twice.",12
"HUGE thank you to our presenting sponsor for their continued support during this year's Coaches vs. Cancer Holiday Tournament! With their support, we will #beatcancer #CVCSTLpic.twitter.com/mRw9tU83HN",12
intro twitter is so cancer lml,12
FUCK CANCER UNTIL THE DAY I DIE NO ONE DESERVES THAT SHIT I HOPE EVERYONE BEATS IT RIP MY DAD!!!!!!!,12
#CRISPR enables breakthrough in our understanding of #genomics #cancer #biology and beyond - thanks for the helpful guide! …,12
""" WARNING!! PLEASE SEE THE HEALING OF ANUS CANCER IN THE NAME OF JESUS CHRIST IN HERE. """,12
Naturally. The diagnostic capabilities are concentrated in the capital where individual/insured financial capacities are higher. Perform cancer-specific screening clinics in the counties and I am certain you’ll be SHOCKED with a more accurate picture.,12
Good start for New Year. Life Saving Cancer screening physical! Just sent you an email. Happy New Year,12
"I'm guessing y'all are watching the Kumite? It's cancer, only funny.",12
CANCER,12
"FACT. This is just one example of why 4th-wave-feminism is a cancer. Rape Culture doesn’t exist, victim blaming is a lie; it’s called questioning a story, compliments aren’t harassment, holding the door for a female isn’t harassment, it’s just being polite. Just don’t be a tool! …",12
Birth Control Pills Linked to Breast Cancer–A Risk That Has Been Known for Decades … via,12
I am so sorry GG my Buster Jack Russell Corgie mix might have Cancer he is my emotional companion for my Anxiety and Depression.,12
93. (31/12/17) Wish 143 - Ian Barnes | 5/10 | cancer ; age ; time running out ; wshilist ; just ok pic.twitter.com/PtdXv0klC2,12
cancer,12
Cancer porfa cancer,12
this just gave me cancer …,12
"shut up Tammy, Tanya, talia, or whoever you are. Irrelevant tw You are a poor excuse for a human. You spread bile like cancer. Fuck off and disappear you troglodyte! pic.twitter.com/yKdUQvFA8B",12
"Works hard on cancer research, civil rights, writes books for kids instead of selling them high priced sneakers.",12
"I liked a video Cancer Full Moon Wealth Forecast (Jan 1, 2018)",12
How recreating horsepox in a lab could lead to cancer cures: “Oncolytic viruses are a technology that's being developed particularly in Canada to try and treat and kill cancers using viruses.” via /r/Futurology,12
Mum of Celtic fan Lee Ford who lost cancer battle had no idea he was unwell – thinking weight loss ...,12
"Praying, lost dad almost 2yrs now to lung cancer. Stage 4.within days of diagnosis he passed. It’s hard on you’ll I know. But suffering has ended now. God bless",12
"The real question is: can health systems afford a growth in transplantation medicine? How should medical need be prioritised, ie, new generation cancer drugs for the few over replacement hips for the masses?",12
"I have been fighting breast cancer for almost 10 years, and I have never lost faith in God! He has seen me through many storms, and I have FAITH he will sustain me for the rest of my life, however long that may be.",12
"18 with no kids, 5 piercings , no tattoos, & a cancer …",12
Dana Donofree Discovered a Business Idea After Getting Cancer Diagnosis Hot on BizSugar,12
The Cannabis Oil Recipe to Heal Cancer. The Safest Way to Make It - Core Spirit …,12
Fundraiser For Mom’s Cancer …,12
Sluh 47 Marquette 38 Final Sluh takes 5 place in the Coaches vs Cancer Tournament they face Vianney on Friday the 5th,12
"I'm dying Moe. Unless, you have a cure for cancer. Do you? Have a cure for cancer?",12
"MERCURY ALL-AREA: Inspired by his grandfather’s cancer treatment recovery, Pochet caps career as Golfer of the Year. …pic.twitter.com/7tnzvPRa9U",12
you know you live in a comfortable first world country when youve got animes in relation to feminism as your class in college holy shit i cannot get over this cancer,12
In so much pain I can't even lift my legs off my bed. Can't even talk very much without my abdomen feeling like it's bleeding. Cancer is really kicking my ass today. And the oxys are going through me like water. If you have any prayers to send my way. Id really appreciate it.,12
"Prayers! We may have been on opposing sides Thursday, but we’re all on the same team in this fight! Go mighty card, beat cancer …",12
NowPlaying GORILLA TITS - CANCER 17:55,12
I know. They r hard to love. They leave their friends behind and use their family to attain gud social image. Clap cancers.,12
Congratulations to varsity basketball on the 3-1 record and 5th-place finish at the Coaches vs. Cancer Tournament this week! Thanks to all those who volunteered countless hours organizing and running this event for such a worthy cause! #AMDG #SLUHAthletics #SLUH200,12
I get double teamed in solos both from behind turn on one guy with full shield and his boyfriend 1 health fortnite is cancer fuck this,12
Cancer,12
"Hybrid sperm may help combat cervical cancer, says study …",12
"Hybrid sperm may help combat cervical cancer, says study …",12
all about what it's like to get a #mastectomy for the #1in8 that need to have #cancer removed from their #breastpic.twitter.com/7HdGyMoO7p,12
Mate we are buying no one in Jan and coming 5th. Glazers are a cancer they won't care about bad results until they realise there is no champions league money in their bank account.,12
Stereotactic Radiosurgery Alone for One to Two Brain Metastases from Cancer of Unknown Primary |,12
Will #Lordsugar #AlanSugar upgrade to 5G when the time comes? I wonder how many youngsters will be manipulated into leading the way with human microchips and 5G cancer causing wifi !,12
Lawrence Burns: says “I love the Children’s Hospital of Michigan Foundation!” Please support by buying the new bow tie benefiting kids with cancer at go to …pic.twitter.com/nKp1Yod3j2,12
ay fuck cancer x2,12
#HoroscopoZinoElFinal CANCER MARICAAA. pic.twitter.com/Tk4trZmios,12
"Any other ppl feel pain through others? When i think about my dad's health and how he won't live as long as my mom, i don't cry until i think of how much it'll destroy her. When i found out my uncle had cancer, i wasn't really concerned about it until i thought about my cousins.",12
"LOL... the best they have is ""Bernie woulda won."" He wrote a rape fantasy and crushed the Brady Bill.He's a cancer",12
Dandelion Benefits including cancer and digestion:,12
'Dying man' who claims he has cancer related to asbestos exposure seeks damages against former employer …,12
"When kids battle cancer, study finds therapy dogs can benefit entire family …",12
Cancer Astrological and Psychic Overview for 2018 …,12
Podcast: An Inside Job: Healing Wisdom for your Cancer Journey An interview with Susan Barbara Apollon Advice...,12
"Like the time your rep came in my room at the Hosp when I was getting 5 FU and cystplatin and said ""if only you had breast cancer, we could help you"". I guess my stage 4 throat cancer wasn't cool enough for your fake organization.#NeverForget",12
10 Cancer Causing Foods You Probably Eat Every Day...,12
Clean your colon: Eating #fiber helps prevent #colon cancer- #detox #cleansing,12
Benjy Metry is fundraising for Benjy's Run to STOP Cancer!: …,12
Cancer cancer cancer cancer cancer cancer cancer cancer cancer cancer virgo virgo virgo virgo virgo virgo virgo virgo virgo virgo #HoróscopoZinoElFINAL,12
I still haven’t told her I have cancer I don’t think it’s good idea.,12
That movie had so much potential and fell short. Didn’t say if the mom survived her cancer diagnosis. The kid seemed to begin to cope with his bipolar disorder/anxiety/depression.,12
"the signs as vines, again: cancer",12
"Sad In this 21st century this horrible cancer of racism is still being fought, when it's called out some will try to dismiss it while hiding behind Christianity & other cloaks of excuses. It must be confronted in order to eradicate it.",12
"Aaaw, poor Isis guy. Good thing he never hurt anyone and I hope his sister got her cancer treatment.So unfortunate the cameras turn off and he got beaten. I think we should bring them all to Canada for hugs because they are really good guys, they are just misunderstood",12
Chuck beat cancer. Chuck deserves a little respect.,12
"#MAGA, they have advocates for crony capitalism and deregulation in the white house. It's a good thing that Trump supporting white nationalists are immune to cancer, being pure blood Aryan and all",12
"Ironically 50's a Cancer too, and also a petty disease sufferer. Lol pic.twitter.com/sfkASC8SUB",12
"#CountryBeforeParty Medicaid expansion improves early-stage cancer detection, led to an increase in the number of cancer diagnoses-in states Medicaid was expanded,… Petition to expand in Missouri - download now takes secondspic.twitter.com/H66X9S1PCc",12
That's offensive to cancer mate.,12
Dogs bring light into 'nightmare' of childhood cancer,12
"I will. Pray for my mom as well, she has metastatic cancer and is staying in my home. She is only expected to live another month or two.",12
Woman Takes Her Wedding Vows Just Hours Before Cancer Takes Her Life …,12
it was time for my yearly mammogram and ultrasound after the plot twist of breast cancer took my right breast and man that scanziety is so strong and so real thankfully my left boob can stay as it's cancer freee pic.twitter.com/jyqrJw5cnu,12
"Surgery was 9 days ago and she isn't any closer to coming home. Potentially a second surgery coming in the next few days because of complications with her recovery. Fuck Cancer, and fuck cigarette companies pic.twitter.com/SBL0e5bNmQ",12
Not a cancer. Just made a mistake. Trump is a Cancer.,12
