tweet_text,month_of_tweet
"As you must know by now, I am participating in the Leukemia & Lymphoma Society’s Man & Woman of the Year...",5
Early presentation of osteonecrosis in acute lymphoblastic leukemia: Two children from the Nordic and Baltic cohort …,5
*face palm* Take an aspirin? My son was diagnosed with leukemia in 2012... Any advice for that?,5
I may have caught a leukemia today at work so there goes tonight's happy feeling.,5
"If you pray, a little girl had a major setback in her leukemia fight. Marrow replacement is last line of defense Kind thoughts welcome too",5
Bout to do this black tie fundraiser for leukemia #charity #comedy… …,5
I'm thrilled my comedy partner Krisha is here to support my fundraising campaign for the Leukemia & Lymphoma Society and so is she #MWOYKnoxpic.twitter.com/v3CP1tAnjd – at Jackson Terminal,5
National Children’s Leukemia Foundation Shut : This Is Why It’s OK Not Donate … via @,5
National Children’s Leukemia Foundation Shut Down: This Is Why It’s OK Not To Donate Money,5
#Science #Cool Preclinical: Researchers harness metabolism to reverse aggressiveness in leukemia #Tech #Retweetpic.twitter.com/eol1mwhDYn,5
Lay off the name calling. I read your Twitter intro about leukemia. There was nothing about what I wrote attacking you.,5
"Not now, idiot, I'm going to instantly die of leukemia",5
"Gettin ready for this charity event benefiting the Leukemia and Lymphoma Society at Cities, hope…",5
"A BIG, important event I'll be emceeing Friday night. We're raising $ for good friends' daughter who has #Leukemia",5
Leukemia & Lymphoma Society names chief medical officer #Hematology #Oncology,5
#GMI GlycoMimetics shares surge on positive news on acute myeloid leukemia candidate. Read more: $GLYC,5
#GMI GlycoMimetics shares surge on positive news on acute myeloid leukemia candidate. Read more: $GLYC,5
VIDEO: How can plasma cell #leukemia be managed? w/ of #mmsm,5
ASXL2 is essential for #haematopoiesis and acts as a haploinsufficient tumour suppressor in #leukemia. pic.twitter.com/wUhaDTUOT8,5
Leukemia patients face unique dental challenges. But dentists can also recognize the early warning signs.,5
Same my baby cousin is battling leukemia …,6
'We Are Still A Family Of Five:' Powerful Angel Wedding Photo Honors The Son They Lost To Leukemia,6
Had a dream last night that I kept visiting in the hospital because he had leukemia. Wth thank god it was only a dream!,6
This 1-year old girl with #leukemia only has a 2% chance of finding a bone marrow match. pic.twitter.com/j4l91Ey28N,6
I added a video to a playlist Sir Charles @ Leukemia & Lymphoma Society,6
"Popular ""Diet"" Ingredient Now Linked to Leukemia and Lymphoma in New Landmark Study on Humans",6
HAHAHAHAHA …,6
The end omg …,6
DREAM finish for leukemia challenge …,6
CMLHope Americans Favor Investment in Cancer Cure: (NewsUSA) - Sponsored News - As divisive as... #CML #Leukemia,6
I'm fucking screaming …,6
Thank You for putting a smile on Mikey's Face...He's battling Leukemia and this jersey made his Day pic.twitter.com/OG6d4PYuSj,6
THE SKILL,6
"Please pray for my wife, Kathryn, as she battles leukemia. Her bone marrow transplant is tomorrow.",6
This never gets old …,6
Why is this so funny …,6
Aspartame is linked to leukemia and lymphoma in new landmark study on humans …,6
A Neighborhood Fixture in Spite of Eviction: He’s closing in on 60 and ... #CML #leukemia,6
This is actually so funny …,6
Fuck sake im literally in the worst mood,6
Life Expectancy of Patients With Chronic Myeloid Leukemia Approaches the Life Expectancy of the General Population …,6
Life Expectancy of Patients With Chronic Myeloid Leukemia Approaches the Life Expectancy of the General Population …,6
How the doctors took on childhood leukemia... and won via,6
Someone ft me,6
Really need a wee as well,6
bullshit. Have you heard of Havroni? Cures Hep C. How about every antibiotic. Chemotherapy for leukemia.,6
Shit mood,6
Gonna get smashed,6
Cba I just want a cuddle,6
Bored,6
Have not been on much. Dealing with a sick kitty. One good thing is feline leukemia test came back negative. Vet gave i v fluids twice.,6
Characterization of children with FLT3-ITD acute myeloid leukemia. A report from the AIEOP AML-2002 study group …,6
Liberty Lake PD surprise 11yo while she was raising money for her Leukemia treatment So kind of them.pic.twitter.com/yO7D09CZY7,6
Click here to support 5 Year Old Fighting Leukemia by Jeddrick O'Brian Carter,6
"Please pray for our friends in NC ( & their precious son Harrison, who relapsed w/leukemia today after being in remission.",6
"The Leukemia & Lymphoma Society Names John P. Leonard, MD of Weill Cornell Medicine and NewYork-Presbyterian its 201…",6
Thank you Leukemia & Lymphoma Society for the Sox tickets! It's a beautiful night for a ball game! pic.twitter.com/8AVqfdYPjg,6
"Blood cancers—leukemia, lymphoma and myeloma—made up almost 10 percent of all... #CTCALifepic.twitter.com/VDk12PPtfF",6
"Why would you say ""kink leukemia"" and not ""leukinkmia""",6
CMLHope Americans Favor Investment in Cancer Cure: (NewsUSA) - Sponsored News - As divisive as... #CML #Leukemia,6
Newlywed needs a #bonemarrow donor 2 beat #leukemia! Register now 2 help at ! #givingtuesday #teamjane,6
Improved Detection of Invasive Pulmonary Aspergillosis Arising during Leukemia Treatment Using a Panel of Host…,6
Childhood Leukemia Was Practically Untreatable Until Dr. Don Pinkel and St. Jude Hospital Found a Cure,6
Why do you always say you're going to kill yourself? — Maybe I am hehehe …,6
when one of the kids u nanny has leukemia and a bad week of no immune system the same week my immune system decides to crash and burn,6
"Smhw I got my name from my mum's patient, who suffered leukemia :')",6
So we finally found out what my baby girl died from. She had leukemia:(,6
thanks you have just given me an eating disorder,6
"Eleanor was diagnosed w/ high-risk Acute Lymphoblastic Leukemia & after 2 years of treatment, she’s in remission! pic.twitter.com/YSYS0OetSh",6
#Leukemia News: Principal component analysis uncovers cytomegalovirusassociated NK cell activation in Ph leukem...,6
Which optimal therapy for high-risk chronic lymphocytic leukemia? Dr Barr & Dr Alyea of explain:,6
Popular “Diet” Ingredient Now Linked to Leukemia and Lymphoma in New Landmark Study on ... - …pic.twitter.com/nl22Kc6x88,6
I'm getting bare fat,6
Texan is first adult in U.S. to receive updated stem cell transplant for leukemia treatment- …,6
CMLHope Americans Favor Investment in Cancer Cure: (NewsUSA) - Sponsored News - As divisive as... #CML #Leukemia,6
CMLHope The Leukemia & Lymphoma Society: Dr. Leonard is the Richard T. Silver Distinguished Pr... #CML #Leukemia,6
"Popular “Diet” Ingredient Now Linked to Leukemia and Lymphoma in New Landmark Study on Humans JUN 27 • ""FOOD"" TO...",6
World map of Chronic myelogenous leukemia (CML),6
93 percent of advanced leukemia patients in remission after immunotherapy #Advancedleukemia #cancer #immunotherapy,6
One of my Sunday school boys who is 14 was in remission from leukemia found out today that it came back,6
"*andrea looking at her perfectly normal foot* ""I think I have leukemia""",6
"Three years ago, we found out my grandma had breast cancer, and a year ago, my grandma was fighting against leukemia. Time has been flying",6
#AKinGoa HaifaBanna: #Urgent any #blood type is needed at AUBMC for a Leukemia patient Amin bou nassar in critical condition.03801857 - …,6
ECS for MRD via NCI! The NCI has awarded the Druley lab an RO1 to use error-corrected sequencing for MRD analysis in leukemia! Thanks 2 NIH!,6
#AKinGoa HaifaBanna: #Urgent any #blood type is needed at AUBMC for a Leukemia patient Amin bou nassar in critical condition.03801857 - …,6
This little girl has been diagnosed with leukemia. The Pub is helping out the family any way we can. Please stop...,6
i called him pupper he cant get the leukemia i forbid it,6
HaifaBanna: #Urgent any #blood type is needed at AUBMC for a Leukemia patient Amin bou nassar in critical condition.03801857 - 03151491 …,6
Tougher Than Cancer via #leukemia #orange #survivor #walk #cancer,6
Tougher Than Cancer via #leukemia #orange #survivor #walk #cancer,6
Tougher Than Cancer via #leukemia #orange #survivor #walk #cancer,6
Tougher Than Cancer via #leukemia #orange #survivor #walk #cancer,6
love u,6
DREAM finish for leukemia challenge - rice #college #usa …pic.twitter.com/Efe6ehh8fb,6
Another reason to stay in shape. Helps prevent leukemia! #lab4life #ASCLS …,6
CMLHope Americans Favor Investment in Cancer Cure: (NewsUSA) - Sponsored News - As divisive as... #CML #Leukemia,6
CMLHope Lexington resident receives Dr. Cynthia Lucero Humanitarian Award: The Leukemia & Lymp... #CML #Leukemia,6
bye u embarrassment,6
GlycoMimetics Doses 1st Patient in Phase 2 of Clinical Trial of GMI-1271 in Newly Diagnosed Acute Myeloid Leukemia,6
new phone who dis,6
"Three recent CMU running backs have tragically died the past four years: Ontario Sneed (heart), Derrick Nash (leukemia), now Zurlon Tipton.",6
Steve Abell begins chemotherapy on Wednesday for treatment of Chronic Leukemia. This is an answer to prayer as...,6
Are you actually a sexual — No course not …,6
Damn u fitty …,6
Wish Georgia would stop growling at me,6
Asking Alexandria / closure,6
#Leukemia News: Global Market Study on Bone Marrow Transplant Latin America to Register Highest Growth Rate by ...,6
"Sylvia Hatchell video: When I went for leukemia treatment, Pat Summitt called every day.",6
Getting Involved with the Leukemia Research Foundation - Oil and natural gas executive Mike Nasatir serves...,6
This my friends is not the American average,6
GIVE US A SCREAM MOTHERFUCKERS,6
shut up bruv ur gross,6
I love people with pretty eyebrows,6
We have a foundation 4 days like this. Our buddy Harrison just suffered relapse (leukemia). Have to help him Win Anyway!,6
that's not enough to win my heart bitch <3,6
[VEGF] [Clinical Curative Efficacy of Lenalidomide Combined with Chemotherapy for Acute Leukemia and Its I... PM,6
Wish my Bae did this …,6
Can I just have a genuine answer if you're single o... — No I'm asexual …,6
Are you speaking to anyone? — No I'm asexual …,6
Do you actually have a girlfriend? — No I'm single xx …,6
Are u actually 18? — Yeh I am …,6
So my platelet count is 114. My Doctor would rather blame Prosecco than Leukemia. I may have to move.,6
Ash arrived last summer. He tested positive for feline leukemia. He’s real healthy and we hope he stays that...,6
This is why I love making #music and why is amazing. #indierock #leukemia …pic.twitter.com/JFtpg82MeS,6
#Urgent any #blood type is needed at AUBMC for a Leukemia patient Amin bou nassar in critical condition.03801857 - 03151491,6
"Let's get physical! Study shows that exercise reduces risk of 13 cancer types, including #myeloma and #leukemia pic.twitter.com/pdtt5lKUmo",6
"Hope you'll like my essay re playing tennis after leukemia, relating to Victoria Duval playing #Wimbledon2016 after lymphoma",6
Congratulations on beating leukemia,6
Christopher’s story about his battle with leukemia during college makes us proud to be a sponsor of,6
Resistance to chemotherapy is associated with altered glucose metabolism in acute myeloid leukemia.,6
Consumption of #artificialsweetener increases risk of #lymphoma and #leukemia in men and women.,6
"Dr. Caulford of #Scarborough's uninsured clinic stands w/ Adil, who tells his story of having leukemia, but no OHIP. pic.twitter.com/ptaltjWs9h",6
The most common adult leukemia is not just one disease?! Important new research …,6
I feel so shit I'm gonna get so drunk,6
I've literally chewed the whole inside of my mouth,6
No one ever fucking trusts me,6
I just supported The Leukemia & Lymphoma Society by shopping #YouShopAmazonGives …,6
Don Pinkel and the Total Therapy V Study of 1968 via #leukemia,6
So fucking pissed off,6
"Cappie is such a fucking liar, she lies about her j... — Shut up idc …",6
yes because an electronic device can receive leukemia.,6
Can't wait to go sleep,6
Craving chocolate so bad,6
Georgia is such a cunt,6
"Don't want to scare anyone (it's not about me), but if you guys know anything/have dealt with Acute Myeloid Leukemia I appreciate any advice",6
Context: Sir Butch had me read this aloud in class and my mom who had leukemia already refused chemotherapy at the time. Not my best moment.,6
Read how Primary Children’s Hospital is helping Georgia Brady battle #leukemia:,6
Read how Primary Children’s Hospital is helping Georgia Brady battle #leukemia:,6
Read how Primary Children’s Hospital is helping Georgia Brady battle #leukemia:,6
when u see if you've been diagnosed with leukemia,6
"She is Nalina Garcia, has leukemia and she has no money to pay for their treatments. #helpplease #leukaemia #Nalina",6
Hiring Immediately: Edmonton Marathon Volunteers to support Leukemia & Lymphoma Society of Canada on August 21!,6
Hiring Immediately: Edmonton Marathon Volunteers to support Leukemia & Lymphoma Society of Canada on August 21!,6
Pubmed: [Research Progress on the Role of Chromatin Remodeling Factor BRG1 in Acute Myeloid Leukemia].,6
That's very true …,6
Wish everyone would fuck off,6
#Leukemia News: New method to grow and transplant muscle stem cells holds promise for treatment of muscular dys...,6
Didn't know u were 23 can't message u considering I... — I was joking I'm 18 …,6
"#Trains, Cars & A Trip To Mars song ""Rainbow Skies;"" is about her nephew's battle w/leukemia pic.twitter.com/Ean6PQ9sjw",6
can you send my 5year daughter Esme a video message she is fighting leukemia we found out last week. Thank you,6
NCCN Publishes New Patient Education Resources about Myelodysplastic Sy... #CML #leukemia,6
"Could be cause for concern. Worst case would be hemophilia or leukemia, but without a complete hx, hard to say. Needs PCP FU",6
It is people's business when she's been lying to ev... — Everyone calls her Cappie …,6
don't post it all over Twitter,6
I'm in the worst fucking mood,6
It's been a good year in the fight against cancer. Four new drugs funded by The Leukemia & Lymphoma Society were...,6
Most Popular “Diet” Ingredient Now Linked to Leukemia and Lymphoma … via,6
I liked a video from My Personal Battle With Mantle Cell Lymphoma Leukemia,6
ur so cute — Why thankyou …,6
"Hearing on Rome today,I really would like to get him in touch with player Cruz Carter fighting leukemia",6
Cappie says she lied about her first name because s... — It's not really anyone's business but hers is it …,6
Mantle Cell Lymphoma Leukemia Cancer Story ...,6
I added a video to a playlist My Personal Battle With Mantle Cell Lymphoma Leukemia,6
Mantle Cell Lymphoma Leukemia Cancer Story ...,6
I added a video to a playlist My Personal Battle With Mantle Cell Lymphoma Leukemia,6
"-injury, and is sometimes an indication of a larger problem such as leukemia.",6
R u speaking to anyone — Yes I have a girlfriend …,6
R u trans — No …,6
How old r u — 23 …,6
I want to talk to you but I feel intimated and that... — Message me I'm nice really …,6
How old is cappie and is that her real name — 20 and not my place to say ask her …,6
"In aid of Leukemia research, Sunday 28th August, great cause worthy of support. pic.twitter.com/o9zSHzSI4W",6
"Hey Canvas family! As many of you know, Hannah Abbott was diagnosed with Leukemia this weekend. Let's stand with...",6
I don't know you but you seem lovely and it seems l... — Thank u …,6
I'm hungry again,6
Actinium Sponsored Acute Myeloid Leukemia Awareness Month to Feature Webinar Focused on Transplantation: $ATNM,6
Why did you name him luke? It's because he has leukemia... Lmfao this movie is something else,6
Most Popular “Diet” Ingredient Now Linked to Leukemia and Lymphoma … via,6
Childhood Leukemia Was Practically Untreatable Until Dr. Don Pink... #PeritoEnGrafoscopia,6
What about the four year who lost his to leukemia living off of the PFOA water!! You Care,6
Childhood Leukemia Was Practically Untreatable Until Dr. Don Pinkel and St. Jude Hospital Found a Cure,6
Never been happierpic.twitter.com/aIhjlZpsX0,6
Feel sick now,6
Gabrielle and Carlin were best of friends. Carlin has leukemia and silica's disease. Love this little man! pic.twitter.com/MS4TxN4HOP,6
shall we put up the price,6
Thought you might like this. I did this for Eagles Fly for Leukemia. Jerry Thierolf pic.twitter.com/Hlcia90gXp,6
It's a deal …,6
"Understandable, I worked for the Leukemia & Lymphoma Society, and find that very distasteful.",6
"Please pray for my baby girl, Hannah, who has been diagnosed with leukemia. #teamhannahpic.twitter.com/tEMrZssYQj",6
"Childhood Leukemia Was Practically Untreatable Until Dr. Don Pinkel and St. Jude Hospital Found a Cure: A half century ago, a young d...",6
Got a call letting me know my cat doesn't have feline leukemia or FIV. We celebrating,6
Signs and Symptoms of Leukemia …,6
Childhood leukemia was practically untreatable until Dr. Don Pinkel & St. Jude hospital found a cure.,6
Childhood Leukemia Was Practically Untreatable Until Dr. Don Pinkel and St. Jude Hospital Found a Cure - Smithsonian,6
"""Pre-leukemic clones that survive chemotherapy are linked to a higher risk of leukemia… pic.twitter.com/NiUpfRBOfj",6
"To 3 year old Cole in Alberta. Cole has leukemia. He loves hockey, Minions, Teenage Mutant Ninja Turtles and...",6
Tougher Than Cancer via #leukemia #orange #survivor #walk #cancer,6
Tougher Than Cancer via #leukemia #orange #survivor #walk #cancer,6
Tougher Than Cancer via #leukemia #orange #survivor #walk #cancer,6
Childhood Leukemia Was Practically Untreatable Until Dr. Don Pink... #PeritoEnGrafoscopia,6
Our Racing Against Leukemia club race is coming up on July 22-23 at Thompson Speedway Motorsports Park! We will...,6
Childhood Leukemia Was Practically Untreatable Until Dr. Don Pinkel and St. Jude Hospital Found a Cure #travel #ne…,6
I hate the fucking rain,6
I'm raising money for help recover from leukemia . Click to Donate: … via,6
I'm gonna fucking kill myself in a minute,6
shut up bruv,6
I still haven't got a fucking sausage roll,6
"Tue, 28 Jun 2016 15:52:14 GMTSmithsonian Childhood Leukemia Was Practically Untreatable Until Dr. Don Pinkel and...",6
#aminosweet is the new name for this...Aspartame is linked to leukemia and lymphoma in new landmark study on humans …,6
Relapse of leukemia after bone marrow transplantation: Cytomegalovirus infection has no…,6
"Tue, 28 Jun 2016 15:52:14 GMTChildhood Leukemia Was Practically Untreatable Until Dr. Don Pinkel and St. Jude...",6
"Meet Liam. Liam just turned 3 and is battling leukemia, but that has not stopped this amazing little boy! Liam...",6
Study Shows High Remission Rate in Leukemia Patients Treated with Inotuzumab Ozogamicin – ADC Review - Pfizer's ...,6
My fuckin dog got leukemia omfg can we live!!! Wtf!!,6
We would like you to meet Miss Reagan! She is 7 years old and was diagnosed with Leukemia when she was 4. Her...,6
#Leukemia News: Novartis to CoDevelop Two Xencor Bispecific Antibodies,6
#Leukemia News: New method to grow and transplant muscle stem cells holds promise for treatment of MD,6
Study Shows 76% Objective Response Rate in Newly Diagnosed Acute Myeloid Leukemia Patients Treated with Vadastuxi...,6
#leukemia news: The Leukemia & Lymphoma Society Names John P. Leonard MD of Weill Cornell Medicine and NewYorkP...,6
#leukemia news: Novartis to CoDevelop Two Xencor Bispecific Antibodies,6
you don't have leukemia.,6
The U.S. Food and Drug Administration (FDA) also recommends genetic testing before giving the chemotherapy drugs to patients with #leukemia,6
"Hugo, 15, leukemia, wished to go on safari! Read his story from #TravelTuesdaypic.twitter.com/BfaQvOov13",6
Relapse of leukemia after bone marrow transplantation: Cytomegalovirus infection has no protective effect: Re...,6
Relapse of leukemia after bone marrow transplantation: Cytomegalovirus infection has no protective effect: Re...,6
Relapse of leukemia after bone marrow transplantation: Cytomegalovirus infection has no…,6
"As few as one diet soda daily may increase the risk for leukemia in men and women, and for multiple myeloma and...",6
Motion to rename ALL (acute lymphoblastic leukemia) so that Google / PubMed searches can actually return meaningful results.,6
I spent my evening last night photographing the sweetest 2 year old boy who was just diagnosed with leukemia.,6
Relapse of leukemia after bone marrow transplantation: Cytomegalovirus infection has no…,6
meowwwwww gee,6
Relapse of leukemia after bone marrow transplantation: Cytomegalovirus infection has no…,6
love you more,6
i love u x,6
Ur always number 1 to me …,6
Thanks for the follow! Can you ask your imaginary friend in the sky about all those little kids with leukemia? #religionIsIll,6
you know me,6
Being a #toddler battling #leukemia isn’t easy. See Georgia Brady’s story here:,6
What Is《Most Common》 Types Of Cancer In《Children》? Leukemia Brain tumors Lymphoma,6
She does. …,6
wot eva,6
"#MyOneWordDistraction ""Give"" Cord blood: Non-controversial source of #stemcells Used to fight #leukemia #sicklecell+pic.twitter.com/bAX4z7xSZJ",6
Who the fuck do u think ur talking to u little bitch …,6
Being a #toddler battling #leukemia isn’t easy. See Georgia Brady’s story here:,6
tell gee to put her foot down or I will spit on ur sausage rolls,6
Tonight is gonna be messy bruv,6
Help Luis Danvers Leukemia Fund every time you shop:,6
Can't believe I've STILL not got my sausage roll.,6
idk where we are fu k sake mammmmmma,6
I'm gna kill Georgia if she isn't here soon,6
I'm literally gonna punch Georgia if we don't go greggs soon,6
HURRY UP IM BORED,6
Being a #toddler battling #leukemia isn’t easy. See Georgia Brady’s story here:,6
We still are !!!! …,6
Gonna name him Steven Gerard,6
Jokes I'm gonna the whole 8 incher down in one,6
Patients with #AML remain at risk for late recurrence after HSCT #Leukemia #LeuSM #BloodCancer,6
CMLHope Americans Favor Investment in Cancer Cure: (NewsUSA) - Sponsored News - As divisive as... #CML #Leukemia,6
CMLHope Capitals Alumni Exhibition Jersey Auction: All proceeds will benefit Pedal For Hope an... #CML #Leukemia,6
Might keep it as a pet,6
I'm gonna kiss my sausage roll so much,6
OMG I HATE TRAFFIC,6
Hey I'm actually in lincolnloushire,6
Can't wait to get smashed in like a hour omg,6
I'm being so fat today like I'm craving food not vodka,6
Being a #toddler battling #leukemia isn’t easy. See Georgia Brady’s story here:,6
cheekypic.twitter.com/eGBUOmXLvQ,6
Help support the Dubois County Leukemia Association & E5 Foundation with 100 Men Who Cook: ….pic.twitter.com/iOQOBAXfsc,6
Relapse of leukemia after bone marrow transplantation: Cytomegalovirus infection has no…,6
Stopped off on the way for a cheeky snack before my sausage rollpic.twitter.com/0R2dXi9MP4,6
Longtime DOE Bioenergy technologies leader Brian Duff loses battle with leukemia -,5
CAMERA Snapshots: Israelis Discover Cure for Leukemia - Does the Media Care? …,5
"100% of all ticket sales will go directly to The Leukemia & Lymphoma Society (LLS) to cure leukemia, lymphoma, Hodgkin’s disease and myeloma",5
"This is truly a remarkable report, how they finally found a real cure for Leukemia. not a hoax, no ""in 50 years""...",5
Charlotte Fire shares special moment with boy fighting leukemia …,5
"Aleki is #Samoan, has #leukemia & needs a #bonemarrow donor! Pls & register",5
Thanks to for lunch today! Our SPN 3 class raised over $350 for Leukemia & Lymphoma #wearelampherepic.twitter.com/hTqf3ZnerR,5
Ryan Wilcox has been battling leukemia for a year,5
Michelle Esposito is crowdrising for Leukemia. Please DONATE a pillow to a child with #cancer,5
"CMLHope Avon Elementary Students Raise Nearly $50,000 for Leukemia Society: Over the past 12 y... #CML #Leukemia",5
This is me and my son Ryan from this past weekend at a fundraising event for the Leukemia Foundation. Ryan is a...,5
Eight-year-old U.S. girl with leukemia selling pink lemonade to cover her medical bills …,5
#Chinese has #leukemia & needs a #bonemarrow donor! Hear her story: #MondayMotivation,5
he was probably too tired cause of the leukemia,5
A little update on myself..lol I'm doing good good report from the Dr there is no trace of leukemia in me...,5
Megyn Kelly rips cowardly Dem ‘for attacking a leukemia patient’ #humor #share #like #funny,5
Blood Drive Event supporting my daughter battling leukemia at her school #teamkeishalee…,5
Please help us support the Fight against Leukemia! … Call 703-580-1800pic.twitter.com/Hi1PAUjt2B,5
Pictures of Rashes and Bruises from Leukemia … via,5
"Hey sky, i want to ask a favor,if you can share this on youtube, my friend got leukemia.Translate it pic.twitter.com/tSeyzVPMXR",5
"Hey, i want to throw this here and ask you to share this on youtube, Translate please,he has leukemia pic.twitter.com/MrGlINQyWN",5
"Agree with Dr. Sanner's answer to ""Leukemia tests negative, von willebrands neg, but i bruise easy, weak muscles, bon..."" -",5
This may be a shock to you.. but I have lymphocytic leukemia,5
All proceeds benefit the Leukemia and Lymphoma Society Arizona Chapter pic.twitter.com/FCmFTsSJSN,5
I do since I was diagnosed with leukemia.,5
