tweet_text,month_of_tweetI just published “Ain’t I A Woman: Reflections on Living and Dying with Breast Cancer” …,1
this nikka talkin about cancer and all dese nikkas finna do is catch 40 yd passes wit 1 hand all game wtf …,1
"This little guy lost his battle with cancer. How sweet it is to have known him, his parents and fur-sister. pic.twitter.com/Sgu1tDIhjr",1
More details about the shadowy cancer that is growing in the heart and brain of the White House. …,1
#HelmChase #Kendal so a patient with throat cancer is given tablet form anti biotics to treat Sepsis? Are you fucking kidding me right now?,1
"Both tøp's and MCR's version of ""Cancer"" are equally good in their own way.",1
"Starbucks, the company that has seen homeless vets without jobs decides to give them to refugees #LAWSUIT #BoycottStarbucks",1
Take back #email power with Using it. Love it. Check out,1
Penn researchers attempting to harness power of big data to help cancer patients avoid ER visits #Opines on #BigD…,1
Your girl got TWO JOBS!!!,1
Main Line Health System Strategic SWOT Analysis Review Prices from USD $125,1
"strange that it's the only ""religion"" that shows up on DNA tests..... higher breast cancer, Tay-Sachs disease, etc. Very strange....",1
"Ideology is a cancer: For decades a little undemocratic little island dominate the establishment of the whole of Latin America, amazing! …",1
"Hi Tina, I am a psychology student looking for cancer survivors to complete my short survey at …",1
"Court Rules Against Monsanto, Allows California To Put Cancer Warning On Roundup",1
#alcoholawareness Breast Cancer and wine-Bad combination Alcohol is carcinogenic-None is best,1
But pisces and cancer are literally partners in crime …,1
I have cancer with a month left to live and don't want the card I neeeeeedddd it and then I'll be cured my life is in your hands.,1
"UK's 8yr old boy is in Kansas City, MO, having surgeries and fighting bone cancer. He is a lovely person. Please . …",1
"An environment so polluted as to initiate cancer, lung disease, loss of vision,emphysema,leukemia, etc.",1
Substances in Cinnamon Affect Breast Cancer Cells … via Blogs,1
"My Aunti Janet is in Hospital and they just found out she has Lung, Liver, Cervical Cancer,, she took care of me when I were",1
R.I.P Cousin Smh Cancer Mann...,1
#DrPolFanContest me and my mom love your show i want to be a vet when im older i am 13 and my mom is battling an unknown cancer we love you,1
"Wow, that's crazy. Glad you're cancer free!",1
"When I say he's cancer,I mean it.",1
Could sharks be the key to solving human cancer?,1
GRASAG- UPSA Women's Commission To Provide Free Breast Cancer Screening At Madina Market #GCNews … via,1
"Yah, it's been 11 years since WebMD told me I had cancer. Still kicking somehow.",1
"Get the word out. Lung cancer is more common than you think, even among non-smokers... … via",1
"Today's #MissionMonday post is from Emily Hoffman a 34 year old Cervical Cancer survivor from St. Charles, Iowa. pic.twitter.com/Ybda5KWTg3",1
Congratulations Auntie on Uncle series 3's portrayal of cancer minus the sweeteners and worthiness. At last... #darkbutLOL,1
Genuinely shocked that Norah Jones isn't a cancer.,1
"Cancer screening sucks in general, including: Lung Cancer Screening -- Benefits Few, May Harm Many … via",1
judges wear ribbons for domestic violence. Ribbons supporting police. Cancer & the It doesn't mean they won't do their job,1
"Happy Mind, Healthy Body …",1
"What Questions Do You Have About Cancer Research, Treatment Or Care? - WBUR pic.twitter.com/ME9o8joYjf",1
PLEASE vote for GMU so Camp Kesem can come and help kids at Mason who have been affected by their parent's cancer,1
Scientists ! Try our Gene Edit Off Target Analysis FREE … #Genetics #CRISPR #bigdata #Bioinformatics #biotech #cancer,1
"that vid gave me cancer, I'm too scared of heights for that shit oml",1
"""Szczur Auctions His Paintings for Cancer Research"" via App: …",1
"EL's Sara Cafaro gives her grandmother, who is battling cancer, flowers before the game. pic.twitter.com/MDTVpumcau",1
"Check out Audrey's story on 2018 Ohio State commit Dane Goodwin & his father, who is back as Capital's coach this year after battling cancer …",1
Drugs firms are accused of putting cancer patients at risk over price hikes …,1
I hate say that after a 68 day battle cancer dad past away 1/23. GoFundMe campaign: …,1
"Over double the amount of people in the U.K. have cancer so it's not really comparable, but still more attention needed regardless …",1
7th stage cancer …,1
Report that statins may reduce risk of breast cancer greeted with skepticism by the news media.,1
"Troll says hes glad former Man #City ballboy, 19, died from cancer pic.twitter.com/uE1Bys3E8l",1
"that's like saying, why can't we see the positives in cancer, as it kills some bad people too... #madness",1
I hate say that after a 68 day battle cancer dad past away 1/23. GoFundMe campaign: …,1
"Court Rules Against Monsanto, Allows California To Put Cancer Warning On Roundup « CBS Sacramento",1
Next level cancer pic.twitter.com/wE4lESJkMH,1
All the best i to have cancer to and am being treated at GCUH. All the nurses are very caring,1
#Telomere Length #telomerase Linked to Genomic Alterations in #Cancer … #genomics,1
"Day 28. New cancer blog post, closeup pics and coconuts.",1
"Hi Taylor, I am a psychology student looking for cancer survivors to complete my survey at …",1
"""Causes cancer"" is a very long bow to draw especially given the lack of scientific evidence to conclusively support it.",1
I hate say that after a 68 day battle cancer dad past away Monday. GoFundMe campaign: …,1
"Parents of a cancer patient tied the knot at Now, they have a message to share:",1
"20170130: Laura Donnelly Telegraph: Simple breath test could catch a pair of deadly cancers much earlier: research [ stomach, oesophageal …",1
How You Can Continue to #Work During #Cancer Treatment …,1
I hate to say that after a 68 day battle cancer dad past away 1/23. GoFundMe campaign: …,1
#Cannabis ~Cannabis ought to be legal. It ought to be researched for its medicinal qualities. But people who sell homemade cures for cancer…,1
"People can get cancer and have thier hair falling, you just cannot prevent bad things FROM happening..",1
This is Piper she has Cancer... Her days are numbered... Today she's not feeling well... I will cherish everyday...,1
I hate say that after a 68 day battle cancer dad past away Monday. GoFundMe campaign: …,1
"On Tap for #AllThingsCancer, Where We're Talking ALL things #Cancer pic.twitter.com/BI6OIYDcnj",1
Learn to teach yoga to those in treatment for cancer. Yoga for Cancer teacher training April 7-10th at Blue...,1
New Study Finds Smoking Marijuana Has No Proven Link To Lung Cancer …pic.twitter.com/0IAZw2FK9N,1
Study Shows No Proven Link Between Weed-Smoking and Lung Cancer - Complex,1
I hate that after a 68 day battle cancer dad past away Monday. GoFundMe campaign: …,1
"#bepbb In forty years, we've moved from ~20% to ~80% of children's cancers being cured. Its not enough. But it's good.",1
There's a special place in Hell for people who steal from cancer charities.,1
Don't miss Cancer of Many Colors's Fashion for Fighters event this Thursday at the Holiday Inn Hotel & Suites...,1
The teams are doing a Coaches vs. Cancer event. They worked together to raise funds and awareness.,1
Please share HALF of the profits donated to cancer research …,1
"if my classes haven't given me cancer yet, i'm sure this dirty ass spicket water in my apt has",1
"Hmm, on Lung cancer screenings (low dose CT scans frequency produce false alarms)",1
Franciscan Health seeking volunteers to participate in cervical cancer study.,1
Syrian father pleas for son who has cancer to be allowed entry to US for treatment following immigration ban pic.twitter.com/YdYwPl7slc,1
Kids with cancer killing a generation with overprice medication. It's fucked.,1
"what a beautifully written story, I could feel Mr. Browns optimism as in Nov I had my first cancer free scan (kidney)",1
Stevie's Cancer Survivors' Guide to Check-ups … via,1
"Just got great news that my cousin is cancer free! So happy, grateful, and relieved! Only one last chemo treatment to go!",1
Could sharks be the key to solving human cancer? via,1
They don't want no smoke they don't want no cancer,1
"Also, this pic looks like it's edited compared to what was really said; NAMELY a mushroom is out there as opposed to cancer ,:\",1
"Fuckkkkkkk Cancer Tio, you're my hero pic.twitter.com/fIN3LyfwP4",1
I hate to say that after a 68 day battle cancer dad past away1/23. GoFundMe campaign: …,1
Quenched activity-based probe imaging beneficial in NMSC #DSNHealth #cancer,1
I wish Cancer got a Cancer and die!,1
wing cancer dissaprove,1
First study of a drug designed to starve cancer cells to death is underway at pic.twitter.com/tDFT6ngfXD,1
It should be my brother's 50th birthday today. I miss him all the time. Fuck you cancer. Fuck you pic.twitter.com/1mUhtrfaVX,1
France biggest user of pesticides in EU. Third largest on planet earth. France is cancer alley of Europe. Leukemia and brain cancer. Bayer,1
"""gambler2 It's not that simple but a lot of people do that for their health. Not a 100% guarantee they don't get cancer though""",1
I hate to say that after a 68 day battle cancer dad past away 1/23. GoFundMe campaign: …,1
"'Roll on session two!' Nat, 22, starts cancer treatment after public raises £50000 in less than a month - Gazette …",1
I start to tear up at the slightest mention of breast cancer,1
Cancer drugs price rise 'costing NHS millions' …,1
I definitely need all of them. by #Cancer_A7 via,1
I hate say that after a 68 day battle cancer dad past away 1/23GoFundMe campaign: …,1
Moisturizing Skin Creams Could Raise Skin Cancer Risk …,1
"embiid: helps families bond. paul millsap: starts arguments, kills friendships, causes cancer.",1
Retweeted Tallahassee Democrat ( Could sharks be the key to solving human cancer?...,1
"One more day to go! Please give generously, I'm gasping! Raising money for Cancer Research UK. Thanks! …",1
I hate that after a 68 day battle cancer dad past away 1/23 GoFundMe campaign: …,1
"Trends and patterns of disparities in cancer mortality among US counties, 1980–2014 …",1
#StanfordUniversity Stanford Researchers Develop Deep Learning Algorithm to Diagnose Skin Cancer. Read more:,1
Thank you Damon Runyon Cancer Research Foundation for having the courage to speak out!',1
"Diabetes could be a warning sign of cancer, new study suggests … vía",1
"Court Rules Against Monsanto, Allows California To Put Cancer Warning On Roundup",1
Help Save Maggie from Cancer! Please donate if you can,1
aye fuck cancer,1
It's not that simple but a lot of people do that for their health. Not a 100% guarantee they don't get cancer though,1
Wow cancer is me …,1
#astrology CANCER February 2017 Astrology forecast with Candace! ... - … # #Retweetpic.twitter.com/9rT1lUYsd6,1
I hate that after a 68 day battle cancer dad past away Monday. GoFundMe campaign: …,1
We offer free yoga classes for those in treatment for cancer.,1
Check out my latest piece for Cervical Cancer has become the #1 cancer killer of women in Africa. …,1
Could sharks be the key to solving human cancer? pic.twitter.com/c8MVI7gakr,1
The government: Lower the age of cervical cancer screening to 18 for high risk groups - Sign the Pe... … via,1
I hate to say that after a 68 day battle cancer dad past away Monday. GoFundMe campaign: …,1
Your commercials give me cancer and make me want to never turn on TBS again.,1
#KristenStewart at the Knott’s Berry Farm ‘Scream Against Breast Cancer’ Initiative in LA : …pic.twitter.com/BaPFqS951q,1
"Bannon believes Islam is a ""cancer"" (his word). He's not as concerned with Jews; not surprising since he's a Goldman guy",1
FitnessTips4Us: The Biggest Cancer Causing Food Revealed - You Wont Eat It Anymore� …,1
I hate that after a 68 day battle cancer dad past away Monday. GoFundMe campaign: …,1
that laugh could cure cancer …,1
I liked a video from 10 Things You Didn't Know Actually Cause Cancer,1
NPR News: Lung Cancer Screening Program Finds A Lot That's Not Cancer #kids,1
"A young lady that I have known since she was a girl is now in the hard fight against cancer, please help Haley...",1
Researchers Uncover Mechanism for Cancer-Killing Properties of Pepper Plant …,1
Cancer can kiss my fucking ass.,1
New post: Mesothelioma is A Deadly Cancer …,1
Eating the right food may help stop breast cancer returning pic.twitter.com/kWLGnWCE5Z,1
Sharks show novel changes in their immune cancer-related genes ... … #Biology Sciencepic.twitter.com/nj0JEypiRo,1
IBMVoice: Putting IBM Watson To The Test For Cancer Care #healthcare …,1
My last chemo treatment was today. One step closer to cancer free. No blog post - I have a video to share instead. …pic.twitter.com/o5coVriGpr,1
I hate that after a 68 day battle cancer dad past away Monday. GoFundMe campaign: …,1
Yes Islam is a cancer must be destroy,1
"Become a supporter, and partner with a child in their fight against cancer! via",1
Gets cancer but not from smoking - bruh I can't do shit right,1
helped more than 500000 women deal with breast cancer. Greatmission. #FollowThem. … przez,1
#SubWayLive: New #mom needs a #miracle cure for brain #cancer #help #give #healthy #Alter…pic.twitter.com/fULopbWcae,1
That poor cat gets to watch you get finger cancer from endless masturbation,1
"My husband said, #Trump will never get a break, even if he cured cancerPeople need 2 act like decent human beings again",1
PRESS RELEASE » Europe Cervical Cancer Test Market Trends Analysis and 2020 Forecasts Report #Opines on #Healthca…,1
"PRESS RELEASE » Cervical Cancer Screening Market & Patients, by Test Type (Pap Smear HPV DNA VIA) in North America …",1
there is cancer in my blood there is water in my lungs //,1
Kinda wanna tan buttttt kinda don't wanna maybe get skin cancer,1
I hate to say that after a 68 day battle cancer dad past away 1/23GoFundMe campaign: …,1
"thank you. It did. No obvious cancer which was the big concern. Lots of pain now, but thankfully working pain meds.",1
Annual PINK OUT girls game tomorrow vs Upper Dauphin! Come support the girls with their fight against cancer!,1
"it's official #RoundUp causes cancer #climate Court Rules Against Monsanto, Allows California To Put Cancer Warning",1
"Kids/teens w/ #cancer tend to be very responsive to #chemo tolerating higher doses; however, innovative, less toxic treatments needed.",1
Explains my cancer …,1
My last chemo treatment was today. One step closer to cancer free. No blog post - I have a video to share instead. …pic.twitter.com/Z8O3GFeh8e,1
"Thank you, Karen! Sophie had pancreatic cancer. It was very sudden or so it seemed.",1
Proud to fund childhood cancer research with …,1
Fuck Cancer #breastcancer #medicateresponsibly #educateyourself… …,1
your food tast like our grandma's boob milk and your food gave me cancer,1
Consider being on my radio show … to promote your passion #cancer cures #Social Mediapic.twitter.com/vYwYgGVsPj,1
I hate to say that after a 68 day battle cancer dad past away 1/23. GoFundMe campaign: …,1
"Raised over $35,000 for childhood cancer, shaved heads, swept cross… …",1
He looks so unhealthy. Wonder if rumors of prostate cancer are true?,1
we're such cancers !!,1
I've just given to Tracy's page. Tracy is fundraising for Cancer Research UK to help beat cancer sooner. …,1
My non-human #cancer treatment team has rallied to make certain I relax & play. Now if only I could train them to do housework... #petspic.twitter.com/SYu1Wrbocw,1
"Proton Therapy Group meets MON, 2/13 at 7pm @ HUPTI due 2 Valentine's Day. All affected by prostate cancer welcome. 877.251.6838 to register",1
My man is a Gemini w Aquarius moon he's faithful. Has Venus conjunct Saturn in Cancer,1
"prayer requests for the strongest of all warriors. brookie is going into emergency brain surgery as her cancer is spreding, you got this bb …",1
Food Bank Worker Hugs Cancer-Stricken Man As He Donates Free Pizza… #jesus #christ #consciousness #love #aimiamospic.twitter.com/7xvPugOoCp,1
Food Bank Worker Hugs Cancer-Stricken Man As He Donates Free Pizza for… #love #unconditionallove #aimiamos #iamlovepic.twitter.com/qDIZxPwkty,1
Found out one of my dogs has fuccin cancer,1
The Progressive Left has completely colonized college campuses and the news media. Social Media is next. Feminism is CANCER! #feminidiots.pic.twitter.com/NFDickrm42,1
New #mom needs a #miracle cure for brain #cancer #help #give #healthy #AlternativeTreatmentspic.twitter.com/P5bU6iFbvC,1
New #mom needs a #miracle cure for brain #cancer #help #give #healthy #AlternativeTreatmentspic.twitter.com/3FaaQtwZpU,1
Juan Williams is a pathological liar. He is a cancer at the heart of The Five. He hates Trump. We know that Juan. Can his ass now.,1
Selenium and glycoprotein are chemicals which are both found in human semen - They can reduce a womans risk of breast cancer by 50%.,1
Penn researchers attempting to harness power of big data to help cancer patients avoid ER visits #BigData,1
Could sharks be the key to solving human cancer? pic.twitter.com/WT0u0faHHw,1
My last chemo treatment was today. One step closer to cancer free. No blog post - I have a video to share instead. …pic.twitter.com/uVicNTAyV2,1
"So, Diet Coke Doesn’t Cause Cancer After All …",1
Via Lung Cancer Screening Program Finds A Lot That's Not Cancer,1
Fuck cancer.,1
"went well. No obvious cancer which was the big concern. Dealing with lots of pain now, but thankfully the pain meds work.",1
Could sharks be the key to solving human cancer?,1
My last chemo treatment was today. One step closer to cancer free. No blog post - I have a video to share instead. …pic.twitter.com/VVu0VeYwuC,1
U.S. Government Finally Admits Marijuana Really Does Kill Cancer Cells,1
...Islam a medieval cult based on hate and child abuse....stop this cancer spreading.,1
Weed-killer #Roundup to get cancer warning after chemical giant #Monsanto loses #California court battle …,1
"i hate those ads for medicines like ""it might eat your organs alive and kill you but it fights cancer!"" I'LL TAKE THE CHANCE THANKS",1
Went to the gym for the first time since my cancer and surgery. It felt grrrreeeaaattt!,1
I have never seen any thought going into weather or not you can sell cancer causing cigarettes.. why so much debate on natural pain relief? …,1
y'all don't u dersrand how excited i get when i hear people beat cancer. no matter if i know them or not !!,1
"AMEN! You don't allow cancer to grow, rot to continue, nor caustic gas to spread. YOU GET RID OF IT! …",1
woman under cancer treatment sent her kids to Somalia with grandparents and now in remission her kids couldn't board plane--many stories,1
See You Tonight for our annual Coaches vs. Cancer Event!! #BUNationpic.twitter.com/Kqo7gTr7v4,1
Cancer can suck my fucking dick,1
"SEE THIS BITCH. HE'S A RAVIN' LUNATIC. I HATE THIS MOTHERFUCKER AS MUCH AS I LOVE BREATHIN' & THAT'S SAYIN' SOMETHIN', I'M A CANCER PATIENT. pic.twitter.com/GTcs34s4TH",1
lmao lucky the internet didn't diagnose you with cancer,1
Wish was over in the U.K.! I'd get my revenge on my thyroid cancer,1
A Crime in the Cancer Lab not #fraud but outright #sabotage,1
Being a cancer is a struggle,1
Could sharks be the key to solving human cancer? pic.twitter.com/5EJndm1URG,1
Prostate Cancer Education/Support Meetings pic.twitter.com/chHh7qaBhM,1
common Jen he's dying of cancer this is what he wants,1
Tips On Having A Good Attitude Even When You Have Been Diagnosed With Cancer -,1
The fact that 3 FDNY firefighters died in the past week from 9/11 cancer scares me a lot,1
VA helps Marine Corps Veteran kick cancer and addiction; Army Veteran uses comedy to deal with PTSD … via,1
"Sun in Gemini, Moon in Pisces, Venus in Cancer, and your moon squares your mercury. You're psychic, conflicted between head and heart....",1
Study: Weight lifting helps breast cancer survivors stay healthy,1
"Court Rules Against Monsanto, Allows California To Put Cancer Warning On Roundup « CBS Sacramento",1
A complete cancer on America …,1
Fuck cancer!,1
NO on Price - this cancer survivor needs ACA. Insurance is a human right.,1
We've got ours.....have you got yours? Unity bands for World Cancer Day on 4th feb! We will be selling them on 3rd feb at Tesco Gatwick! pic.twitter.com/mztRVPJ6Ec,1
having fun breathing in your CANCER AIR,1
"Yes, majority of my research uses spatially-oriented cancer data from registries and claims. #Stopthisbill",1
#StanfordUniversity AI can detect skin cancer by looking at photos. Read more:,1
"""My religion says ranch causes cancer.""",1
"Another sneak peek into the cancer of $8s, there's always one of these ppl in a lobby …",1
bannon is a cancer. but he's only one part of the white supremacy administration... all of the pieces are in place,1
why the fuck isn't there a cure for cancer yet.,1
A cura do Cancer,1
It's like letting someone die of cancer because the chemo makes you ill. Sometimes the right thing isn't lollipops and rainbows.,1
Register your family for Tile Tales - Paint Night for Mon Feb. 13. Share your #cancer story by painting a tile,1
The Breast Cancer Site via,1
"I happen to be a Cancer, like the Zodiac Crab. Mess with the Crab, you get pinched with the claws. #crabclawed",1
#drpolfancontest Dr.Pol when i get older i want to be a vet i am 13 and my mom is battling an unknown cancer and we love you and your show,1
"#Immunotherapy, also called biologic therapy, is a type of cancer treatment designed to boost the body's natura... …pic.twitter.com/dJTFVHGTgd",1
A groundbreaking program to reverse and prevent cancer. #TheCancerRevolution is here:,1
I am a Cancer Fighter! Please help me #TackleCancer #TackleCancer #DCCVII #CancerFighter via,1
I'm a cancer I have such a bad temper bro it makes no sense,1
"Cervical cancer death rates are much higher than thought, study says",1
#GooglersUnite Hey SJWs Google says your cancer,1
Blue Monday fundraiser for Prostate Cancer #prostatehealth #prostatecancer…,1
Let's go and chaug joining forces to help those battling cancer #CoachesVsCancerpic.twitter.com/NPfm2AOsMx,1
I read online somewhere that microwaves can give you cancer? I knew those horrible appliances were bad! Can't replace a good oven with that!,1
"#Cancer can be quite sexually creative, when your need for security has been satisfied.",1
WORLD CANCER DAY -SATURDAY 4th FEBRUARY 2017,1
"Another week, another new BCSC paper! This time on breast cancer risk after ADH diagnosis:",1
Roadhog is cancer. …,1
"So, Diet Coke Doesn’t Cause Cancer After All #tcot",1
"I looked at that picture and thought bowling caused mouth cancer and I was all, ""Oh, shit!"" …",1
whats ur zodiac sign? — i was born july 20 so cancer …,1
Did you know that fewer than one in 10 cases of breast cancer are linked to the BRCA gene? #RHSBMS,1
you want your kids drinking cancer water? Only a matter of time. …,1
"You get over it though. I always thought that if I got cancer I'd always feel there was a cloud over me, but I don't.",10
I hope you don't suffer a tumor then. His walkthrough can cause cancer. I swear. =/,10
I support #PlayForPinkSA who give aid to breast cancer survivors. Pledge your support today. …,10
Tomorrow Saturday October 15/16 is not only game day but The Rams annual pink day in support of breast cancer...,10
#FFRNN #CANCER #Chemotherapy is a Waste of Money & its POISON that kills & causes a horrible death. … 007 #VIRAL,10
Queen Creek moms play football in support of cancer research -,10
I just entered the Breast Cancer Awareness Month #Sweepstakes! It's now your turn!,10
I'm sorry. Was that supposed to be a threat? Or perhaps a joke? Because it wasnt funny. Don't wish cancer on ppl asshole. #TCisnoJokepic.twitter.com/Fdh4AJSUdE,10
"Please help support Breast Cancer Research, add a #Twibbon now!",10
Playing at Tudor Lounge tonight... don't forget that tomorrow is our annual Pink Party for Breast Cancer...,10
I share Heathers pics today because she was feeling sick after her Cancer treatments today but snapping pics of Autumn made her feel good. pic.twitter.com/1UIo54hbLw,10
Prostate Cancer Treatment May Double Dementia Risk: Study..,10
And while it is great that people set up GO fund me's for recently dx cancer patients - we don't see ANY $$ attention for newly dx diabetics …,10
Much respect to the ladies that have breast cancer keep fighting and beat cancer ass,10
Retweeted Grasshopper ( #cancer #survivor #cancerfree #MMJ #Cannabis #holistic #natural...,10
Stages In Cervical Cancer Everybody Should Know To Avoid Dying From This Deadly Disease,10
"Analyst, Clinical Programs in Toronto, ON for Cancer Care Ontario (CCO)",10
cancer shouldn't be something to joke about ..,10
Watch on #Periscope: In Honor of Breast Cancer Awareness Month: Boob Fact Finding …,10
How I Cured My Stage 4 Cancer In Two Weeks For Less Than The Cost Of A Night At… …,10
From Elemis to Jo Malone: Pink beauty products to support Breast Cancer Awareness Month: This detan... Follow me,10
and .. I bought the song! I can't believe I saw yous! (I went to your show!!) buy the song to help cancer! pic.twitter.com/BpHzdCFCUV,10
how much of a cancer is he,10
