tweet_text,month_of_tweet7-year-old battling leukemia gets to live one of his lifelong dreams: to... by #anticancerclub via,12
Boy battling leukemia receives 'super' surprise from Texas cop,12
Boy battling leukemia receives 'super' surprise from Texas cop … #US #Law #Policepic.twitter.com/q0HQxjbwSg,12
"You're a skinhead, you BITCH. no dad, it's leukemia! leuk-what? Stop speaking german you fucking nazi!",12
Boy battling leukemia receives 'super' surprise from Texas cop,12
diagnosis and treatment of childhood leukemia …pic.twitter.com/9ya3dcNyZe,12
Boy battling leukemia receives 'super' surprise from Texas cop #police #pd,12
Boy battling leukemia receives 'super' surprise from Texas cop,12
Please #Pray and #RETWEET JoJo and his 3 siblings are enjoying a #Christmas this year fighting leukemia …,12
Our family is counting its blessings this Christmas. Girl shows spirit in leukemia battle …,12
Leukemia Most cancers – All the things You Must Know,12
Leukemia Most cancers – All the things You Must Know #Cancer #Brain_Cancer #Breast_Cancer #Colon_Rectal_Cancer,12
"#When I was in the hopsital, reaching 100 days was so inconceivable..."" #Leukemia #ayacsm",12
** Bad News ** NongYhok has Leukemia !! I don't know How's to explain cuz my English not very…,12
"I'm supporting my families fundraiser, please check it out: 'Nicholas''s leukemia battle' …",12
Across China: Crowdfunding cannot save China's leukemia girl,12
"Merry Christmas to all my fellow leukemia fighters . Stay strong , we are still here fighting that's a blessing to all",12
Happy Holidays from your Louisiana/Mississippi Leukemia and Lymphoma Society Family. Thank you…,12
"Please help support the fight against leukemia cancer, add a #Twibbon now! …",12
"He's good, thankfully. Then this morning my Aunt(who is in chemo treatment for Leukemia) was admitted at 3am.... *SIGH*",12
"and . My nephew has leukemia (in remission), so Children's charities for me.",12
PDF: Acute myeloid leukemia: a case report with palatal and lingual gingival alterations SHARE IT,12
Antifungal prophylaxis in leukemia patients …pic.twitter.com/FCiFWOZspt,12
Trumpety-trump! Happy the let me home for Christmas after quite a rough 3rd round of #chemo ... #Cancer #leukemia #cytarabinepic.twitter.com/8Sh4wdSpcm,12
Showered with LOVE. Greeting cards pour in to cheer Elly Wickenheiser who has leukemia.,12
Addy's Army Fights Leukemia! …,12
"Fuck that cop that gave me a ticket, I hope you get leukemia",12
Leukemia | Memorial Sloan Kettering Cancer Center …,12
can i plz have a smile more accessorie my son has leukemia and he has always wanted a smile more shirt or hat or anything,12
Time to go meet some beautiful souls battling with leukemia. Everyone keep the sick in your prayers this Christmas,12
Help Luis Danvers Leukemia Fund every time you shop:,12
Miracle Boy #WarriorKai in Wilson jersey!Ready to fight against Leukemia!,12
"Take the case of a woman whose illness, a rare form of leukemia, was diagnosed by IBM Watson af… via",12
hurry up,12
… | Boy battling leukemia receives ‘super’ surprise,12
Hate my life so much x x x x,12
Merry Christmas to my family and friends and 22 years #Leukemia free to me. #cancersurvivor #cancersucks,12
Across China: Crowdfunding cannot save China's leukemia girl,12
"Presents are given by parents in a ritual to ward off Santa, which is why only poor children get leukemia on Christmas.",12
My friend died from leukemia My pug died from my asshole uncle Aleppo is still at war Trump is elected president A lotta famous artists died,12
"Health damage caused by radioactivity by Fukushima explosion came out in Japan. Thyroid cancer, such as leukemia.",12
Crowdfunding cannot save China's leukemia girl #crowdfunding #startup,12
Wright State graduate student Eric North hopes to be social worker at hospital where he was treated for leukemia pic.twitter.com/sL5wZvfOAe,12
Panel predicts whether rare leukemia will respond to treatment,12
I'm sad you have to give up your charity helping kids with cancer. My son is 2 1/2 years into his fight with leukemia. Thanks,12
OBESITY-ASSOCIATED PROTEIN COULD BE LINKED TO LEUKEMIA DEVELOPMENT …pic.twitter.com/ESOr5AzS4n,12
Fighting Back #OrangeAwareness by silverdragonfly260 #epiconetsy #craftbuzz #UKSoPro #orangeribbon #leukemia #MS,12
I got a bratz quilt cover,12
Colombia finalizes 44% price reduction of leukemia drug Glivec. Novartis has already earned nearly $50 billion . . .,12
"""When I was first diagnosed, I didn't know what a bone marrow transplant was."" Life Interrupted #Leukemia #ayacsm",12
Feline Leukemia (FeLV) and Feline Immune Deficiency Virus (FIV) are transferable from cat to cat through...,12
please #HELP STUDENT LEUKEMIA far from home Team Schuyler Strong … Happy Christmas,12
A new opportunity to treat drug-resistant leukemia discovered,12
"Since dad was diagnosed with leukemia & went thru treatment, he's been weak & pretty much bed ridden. He was the spirit of the holidays.",12
Christmas is always full of spoilt brats that complain when their parents buy them the wrong car,12
"New van for man who lost wife to cancer, has daughter with leukemia: …pic.twitter.com/xf68L4ubsp",12
Across China: Crowdfunding cannot save China's leukemia girl,12
Emotional Aspects of Childhood Leukemia: A Handbook for Parents …pic.twitter.com/Tk1fJI5KAC,12
Christmas is the worst day of the year I hate it more than anything,12
I ain't leaving my bed today,12
Woke up in such a shit mood,12
Evaluation of maternal health and labor and delivery conditions as risk factors for childhood leukemias… #leukemia pic.twitter.com/UoY8UupKww,12
Acute lymphoblastic leukemia in patients with Down syndrome with a previous history of acute myeloid… #leukemia pic.twitter.com/ABMeex2uEh,12
The kinase inhibitors R406 and GS-9973 impair T cell functions and macrophage-mediated anti-tumor… #leukemia pic.twitter.com/33s3J9006B,12
Carotenoid intake and risk of non-Hodgkin lymphoma: a systematic review and dose-response meta-analysis… #leukemia pic.twitter.com/vkiHLGbVwD,12
HTLV-1 Tax-Specific CTL Epitope-Pulsed Dendritic Cell Therapy Reduces Proviral Load in Infected Rats with… #leukemia pic.twitter.com/OIjGs3Uosh,12
"ECIL-6 guidelines for the treatment of invasive candidiasis, aspergillosis and mucormycosis in leukemia… #leukemia pic.twitter.com/Ihpfobxy7M",12
LIN28B Activation by PRL-3 Promotes Leukemogenesis and a Stem Cell-like Transcriptional Program in AML. #leukemia pic.twitter.com/i5k7lr1bVW,12
Enhanced targeting of CML stem and progenitor cells by inhibition of porcupine acyltransferase in… #leukemia pic.twitter.com/rdyrTD7sor,12
Distinct patterns of B-cell receptor signaling in non-Hodgkins' lymphomas identified by single cell… #leukemia pic.twitter.com/xuYdfMsOdv,12
Young adult survivors most distressed after leukemia and lymphoma treatment,12
"""I was about four years old when the doctor diagnosed my younger brother with leukemia."" #Siblings #ChildhoodCancer",12
【ShanghaiDaily】 Crowdfunding cannot save China's leukemia girl,12
Crowdfunding cannot save China's leukemia girl …,12
Crowdfunding cannot save China's leukemia girl - Shanghai Daily (subscription) - pic.twitter.com/LkOsVgDBlG,12
9-year-old Ben was having difficulty combating the nasty side effects of chemotherapy needed to fight leukemia....,12
Crowdfunding cannot save China's leukemia girl - Shanghai Daily (subscription) …,12
Obesity-associated protein could be linked to leukemia development …pic.twitter.com/y8qEpxVXzr,12
Crowdfunding cannot save China's leukemia girl - Shanghai Daily (subscription),12
This makes me sad - China leukemia girl dies weeks after father embroiled in donation controversy:,12
"New van for man who lost wife to cancer, has daughter with leukemia - Austin American…",12
L.A. boy with leukemia bravely helps other cancer victims - …pic.twitter.com/zZWcoVBWd2,12
Promising drug a 'new paradigm' for treating leukemia,12
China leukemia girl dies weeks after father embroiled in donation controversy pic.twitter.com/0JTAyyGJc5,12
She never quit while being in the hospital and fighting off leukemia. #cancersucks,12
My Mama Nita is a two time cancer survivor! Fought leukemia twice and won. She is the reason why I actually enjoyed Christmas,12
China leukemia girl dies weeks after father embroiled in donation controversy: BEIJING (China Daily/Asia News… pic.twitter.com/cTokKNnf3t,12
Scientists Find Ginger Kills 91% Of Leukemia Cells And Shrinks Tumors In Vivo:...,12
#Leukemia Synergistic Cytotoxicity of Melatonin and Newgeneration Anticancer Drugs Against Leukemia Lymphocytes But…,12
#Leukemia Chronic Myeloid Leukemia. Methods and Protocols.,12
#Leukemia LIN28B Activation by PRL3 Promotes Leukemogenesis and a Stem Celllike Transcriptional Program in AML.,12
#Leukemia ECIL6 guidelines for the treatment of invasive candidiasis aspergillosis and mucormycosis in leukemia and…,12
When he was in Tata Memorial he cured my cousin of Leukemia. Service to people vs Criminal conduct.,12
"New van for man who lost wife to cancer, has daughter with leukemia - Austin American…",12
Discovery pinpoints cause of two types of leukemia,12
#Trending: Remote Controlled CARs: Towards a Safer Therapy for Leukemia.... @ ….,12
"New van for man who lost wife to cancer, has daughter with leukemia - Austin American-Statesman",12
"New van for man who lost wife to cancer, has daughter with leukemia - Austin American-Statesman",12
"3 years ago today, my dad was diagnosed with leukemia. 9 months later, his life ended at 54. He won't be here for Charlotte's 1st Christmas.",12
"New van for man who lost wife to cancer, has daughter with leukemia",12
"New van for man who lost wife to cancer, has daughter with leukemia #CervicalCancer",12
"New van for man who lost wife to cancer, has daughter with leukemia - Austin American…",12
"Helping Jim Fight Acute Leukemia … seriously,im scared for plz.",12
i would suffer through it no problem but it's the matter of her having leukemia and a severely weakened immune system,12
"sorry forgot to respond, my friends little boy, he was diagnosed with leukemia last week. He got to go home today though!",12
China leukemia girl dies weeks after father embroiled in donation controversy,12
China leukemia girl dies weeks after father embroiled in donation controversy,12
China leukemia girl dies weeks after father embroiled in donation controversy – The Star Online …,12
#Health China leukemia girl dies weeks after father embroiled in donation controversy - The Straits… #Southeast Asia,12
"Please help support the fight against leukemia cancer, add a #Twibbon now! …",12
"#China #Leukemia #Girl #Dies weeks #Father embroiled: , pic.twitter.com/ExwjhhTVEk",12
China leukemia girl dies weeks after father embroiled in donation controversy,12
"This is my Christmas Miracle. After 4 years of battling Leukemia, this little guy is finally cancer free!! pic.twitter.com/1BxxUfsvg1",12
#China leukemia girl dies weeks after father embroiled in donation controversy pic.twitter.com/5ZwpZXBgAv,12
Inroads against leukemia … via,12
Diagnosed last month JoJo's will b spending #Christmas Please #RETWEET Brave JoJo's Fight Against Leukemia …,12
#China leukemia girl dies weeks after father embroiled in donation controversy pic.twitter.com/u1ekWdxIzf,12
China leukemia girl dies weeks after father embroiled in donation controversy,12
"my husband had A.L.L, (leukemia) he did 3 years of chemo, finished on his 21st b-day, been in remission for 27 yrs",12
"TOBY Listen, I read in the paper that I'm on the benefit committee for the Child Leukemia Foundation. #Trump …",12
instead donate to the bearcat leukemia research Foundation,12
"""...I can’t hold back the tears or involuntary sobbing."" #ChildhoodCancer #Leukemia #pedcsm",12
Fasting can kill cancer cells of common childhood leukemia ...,12
Life interrupted #CancerCosts #ayacsm #leukemia,12
"very nice Jennifer did that. My husband and I have been wanting to do that one day, he had leukemia when he was 17 y/o in 1989",12
Leukemia? Anemia? How dare you make fun of cancer victims and people with disorders?! …,12
"Please pray 4 my friend Martha's son, Jack. He has been diagnosed with Leukemia. #AmazingSon #CallGod #keeptheprayerscoming #Justice4Jodypic.twitter.com/rBtMMpq23U",12
JoJo & his family will b spending #Christmas this year Please #RETWEET Brave JoJo's Fight Against Leukemia …,12
it was about how he had leukemia for 2-3 years,12
The latest Leukemia Daily! … #leusm #ash16,12
7-Year-Old Boy Battling Leukemia Fulfills Dream of Conducting an Orchestra - ABC News - via,12
#losing weight chronic lymphatic leukemia chanel lipstick online shop,12
The dog filter is more cancer than leukemia,12
"This Christmas, a 2-year-old battling leukemia is getting her holiday wish & more... by #gofundme via",12
"Happy 30th birthday to my best friend, the late Kristinie Mohd Yusof who passed away in 2003 because of leukemia. She was born on Christmas.",12
Make free vaccines against FIV (feline AIDS) and FeLV (feline leukemia) … via,12
NEW: Risk of leukemia following treatment for Hodgkin lymphoma … via #Hodgkin,12
Mr. Tebow one of my ninth grade Sunday school guys was diagnosed with leukemia would you send him a video of encouragement,12
Our patients need committed donors to save them from blood diseases like #leukemia & #lymphoma! Sign up 2day: pic.twitter.com/cP7NE5r9wj,12
Obesity-associated protein could be linked to leukemia development … vía,12
5 year old boy battling Leukemia proposes to favourite nurse.,12
Jasmine (leukemia positive) purrs in thanks for the gifts from our wish list! wish list link ==>...,12
"This Christmas, a 2-year-old battling leukemia is getting her holiday wish & more... by #gofundme via",12
My heart breaks for the three sweetest kitties suffering from feline leukemia.,12
Coach Quinn one of my ninth grade Sunday school guys was diagnosed with leukemia would you send him a video of encouragement,12
"At our Christmas Eve svc: three pediatric leukemia survivors. Same Dr, same hospital, same church, same Savior! pic.twitter.com/ZD8l3ajVJ1",12
#Positive #Trends In The #Treatment Of Leukemia And Lymphoma …,12
"Three #leukemia survivors: same church, same doctor, same hospital, same Savior! #ChildhoodCancer #miracles #ChristIsBornpic.twitter.com/wkiBogvQbR",12
Mr. Pereria one of my ninth grade Sunday school guys was diagnosed with leukemia would you send him a video of encouragement,12
"Reducing fatty acid production may help treat arthritis, leukemia - Reducing the production of fatty acids called ether lipids could be...",12
Mr. Sanders one of my ninth grade Sunday school guys was diagnosed with leukemia would you send him a video of encouragement,12
Pass through #savealife #Leukemia #stemcell #donor #cancer #makeadifference #islam #Muslims May Allah bring a match2him & cure him. Aamiin.pic.twitter.com/HEs2oZ0Lsn,12
Stanford scientists change human leukemia cells into harmless immune cells,12
#Leukemia survivor Anne Holzbeierlein credits a #clinicaltrial for her milestone remission. Read Anne's story. pic.twitter.com/DgcCXz7IAq,12
"This year I probably got the worst news of my life. My dad, my keystone, my only blood relative left was diagnosed with leukemia.",12
New insights into the molecular mechanisms of acute myeloid leukemia,12
"My dad when #Colts lose and Pagano comes on screen: ""Well, at least you beat leukemia.""",12
Risk of leukemia following treatment for Hodgkin lymphoma … via #Hodgkin,12
"Leukemia-Causes, Symptoms And How To Prevent It",12
"Leukemia-Causes, Symptoms And How To Prevent It",12
"Leukemia-Causes, Symptoms And How To Prevent It",12
"Leukemia-Causes, Symptoms And How To Prevent It",12
"Leukemia-Causes, Symptoms And How To Prevent It",12
"Leukemia-Causes, Symptoms And How To Prevent It",12
"Leukemia-Causes, Symptoms And How To Prevent It",12
sexy japanese girl sex long hair #adult acute lymphoblastic leukemia,12
Grande Prairie Boy w/ #Leukemia Becomes Youngest #Edmonton #Symphony Conductor #children #cdnpoli #kindness #alberta,12
Lex to not look like a leukemia patient.,12
"Leukemia girl dies, whose father trapped in donation controversy …pic.twitter.com/4rDcutQtw1",12
my girl xxxx,12
"Just when I thought this year couldn't get worst, I was in a video chat with my dad and he told me my uncle was diagnosed with leukemia.",12
baby,12
What do you call a skeleton with leukemia? via /r/Jokes,12
HAHAHAHAHAAAA …,12
"Yes, that. I mean he fought off cat leukemia for good. Proud achievement, that",12
New: Risk of leukemia following treatment for Hodgkin lymphoma … via #Hodgkin,12
It's fucking mad how one person can make you so happy,12
Chinese mum dresses as Santa to raise funds for leukemia-stricken child Seven-year-old Li Jiale is pinning his...,12
"#When I was in the hopsital, reaching 100 days was so inconceivable..."" #Leukemia #ayacsm",12
The T.J. Martell Foundation has supported several promising #leukemia breakthroughs Read more here:,12
So many clothes I need,12
I used to love my full Abercrombie tight fitted track suits x x x,12
what did U wear in the day then u were defo a chav,12
what I was 13 there and in the closet too,12
"""I found that lot of my friends were really distant..."" #Leukemia #ayacsm",12
60% of all childhood leukemia may be preventable. …,12
I don't understand why you would dress like that at 14,12
I love u too wife xxx,12
What the fuck did you dress like …,12
Feel so shit about myself at the minute,12
"An environment so polluted as to initiate cancer, lung disease, loss of vision,emphysema,leukemia, etc.",1
"Polo For A Purpose: Supporting The Leukemia & Lymphoma Society in Wellington, FL …",1
France biggest user of pesticides in EU. Third largest on planet earth. France is cancer alley of Europe. Leukemia and brain cancer. Bayer,1
PRESS RELEASE » Global Leukemia Partnering 2010 to 2016 #Opines on #Healthcare,1
leukemia schizophrenia polyethylene There is no significant risk to your health She used to be beautiful as well plastic decaffeinated clean,1
New study into leukemia offers clearer understanding of its biology … #LifeSciences #Medicine #myscience,1
"""my cancer is leukemia""",1
What is a haploidentical stem cell transplant? #leukemia #mmsmpic.twitter.com/QcxTUicJir,1
Tehran Tom has no soul. He blocked an Obama nominee with leukemia to cause President Obana personal pain.,1
First best: got to talk to my eldest niece in St. Louis for the first time since her leukemia diagnosis at Christmas & she's doing great,1
Stop spreading #FakeNews; neither Cotton nor Butts knew Butts had leukemia — …,1
One of our miracle kiddos lost his life to Leukemia and gained his wings today. He wasn't even 5 years old. My heart hurts.,1
"Hey Tom, remember Cassandra Butts? Remember how she died from leukemia awaiting her nomination because you wanted to hurt Pres. Obama? …",1
$BIEI patented technique can be used in the removal of HIV and leukemia cells. #PennyStocks $KGET $AMBS,1
Love this marathon-running woman! She runs for my mom and the Leukemia and Lymphoma Society! …,1
"#WATCH: Leukemia Patient Tases Cop, Checking Off Bucket-List Wish: pic.twitter.com/QVzjoFWd7h",1
#adult leukemia prognosis pictures of facking a virging girls,1
"""...I can’t hold back the tears or involuntary sobbing."" #ChildhoodCancer #Leukemia #pedcsm",1
"Leukemia Patient Tases Cop, Checking Off Bucket-List Wish #philly",1
Babies cured of leukemia using genetically modified T cells » Clarkston Daily #leukemia pic.twitter.com/zM6Fw4aM7e,1
Teen with leukemia granted Taser 'bucket list' wish pic.twitter.com/1CzQsAP4Rd,1
"Leukemia Patient Tases Cop, Checking Off Bucket-List Wish …",1
"For elderly patients w/ AML, adding androgen to maintenance therapy 5-yr survival by 53% … #study #leukemia",1
make sure to donate $$$ this week to support the Leukemia and Lymphoma Society!! pic.twitter.com/1O1XegDWsg,1
◦ Holo: The Arizona Yacht Club Presents Leukemia Cup & Birthday Regatta With Anthony Vela - SUP Magazine: SUP…,1
The Arizona Yacht Club Presents Leukemia Cup & Birthday Regatta With Anthony Vela … #Community #Industry #News,1
The Arizona Yacht Club Presents Leukemia Cup & Birthday Regatta With Anthony Vela #suppic.twitter.com/hrDJ3FIvoq,1
A new update has been posted to LEUKEMIA: …,1
The Arizona Yacht Club Presents Leukemia Cup & Birthday Regatta With Anthony Vela read more pad on link #sup #stan…,1
The Blacklist Trader: $SGYP is constipation while CPXX was leukemia/oncology big difference… #MedicBoardpic.twitter.com/qjbU4DHO7F,1
Which student body can raise the most money for The Leukemia and Lymphoma Society? Halftime boys b-ball game!,1
The Arizona Yacht Club Presents Leukemia Cup & Birthday Regatta With Anthony Vela #paddleboarding …,1
"""how do I get leukemia"" is definitely not the right joke to make here but it's the one that crossed my mind …",1
$SGYP is constipation while CPXX was leukemia/oncology big difference …,1
"In 2015, Alyssa developed leukemia. Her family is asking for a day of prayer on 3/5/17. Share her story below! …",1
"Alyssa Elkins has spent the past two years fighting leukemia, and while her family hopes for a miracle, the McConn…",1
"Alyssa Elkins has spent the past two years fighting leukemia, and while her family hopes for a miracle, the McConn…",1
"Alyssa Elkins has spent the past two years fighting leukemia, and while her family hopes for a miracle, the McConn…",1
"Alyssa Elkins has spent the past two years fighting leukemia, and while her family hopes for a miracle, the McConn…",1
"Alyssa Elkins has spent the past two years fighting leukemia, and while her family hopes for a miracle, the McConn…",1
"Alyssa Elkins has spent the past two years fighting leukemia, and while her family hopes for a miracle, the McConn…",1
"using a few month pic bc he looks rough now. he was just diagnosed with feline leukemia, and his eye is infected and needs to be removed. pic.twitter.com/DeUqsZueDl",1
"The vet called, this beautiful girl has leukemia. She is starting steroids and we will make her time left amazing. I'm heartbroken pic.twitter.com/SFhOCFUgr9",1
Not necessarily. Children treated for leukemia with radiation? Should they have just died young?,1
"""I wondered if this was too much for a new relationship"" #Leukemia #ayacsm",1
"when the hospital printed out a list of what was wrong with my grandfather, the page was full. And leukemia was just one on that list.",1
2017 Medical 1st: Babies Cured Of #Leukemia Using Modified T Cells Harvested From Donor Blood -,1
"After leukemia returned, Alyssa Elkins decided she wanted to fire a Taser",1
Prayers just weren't enough. Now we should help Mary's family recover TY! #MOTIVATIONMONDAY #Leukemia pic.twitter.com/Hx3S11zADZ,1
Ohio teen with leukemia fulfills shocking bucket-list item …,1
Ok. Nuts. Girl in Ohio wanted to #taser someone-#bucketlistwish she suffered fr. Leukemia. WHO wants to taze anyone??,1
"'Are you ready, young lady ' Girl with leukemia TASERS a cop …",1
I still have 2 Nashville Predators tickets for sale $39 each. The funds go directly to our philanthropy for Leukemia and Lymphoma. Lmk pls,1
"A courageous Lily - who is battling Leukemia - stopped by CCMF with mom, Heather, to #donate $1,400 raised through Sculpt for Lily!pic.twitter.com/thpSudDFsO",1
As a #LEUKEMIA SURVIVOR and Actress I WILL fight 4 you.,1
The Leukemia & Lymphoma Society reminds us that Feb 4 is #WorldCancerDay. They asked patients & supporters abt courage. 1/2,1
"left field again. Ever been to a child leukemia ward? We have buddy, and it ain't pretty!",1
Leukemia : two babies would be cured with immunotherapy …,1
"National Senior Director, Community and Fund Development: Leukemia & Lymphoma Society of Canada, The (Toronto ON):…",1
Teen dying from leukemia uses one of her bucket list wishes to taser a cop pic.twitter.com/DR3OVZJd2G,1
will be starting Pennies for Patients next week! Support the Leukemia & Lymphoma Society during lunch. #Turner202Strongpic.twitter.com/IMYSUFnYS5,1
"Stay tuned for details regarding an upcoming Leukemia & Lymphoma Society Benefit Motorcycle Run for Sunday, 4/30/17.",1
Pet Talk: A threat to felines - Feline leukemia virus (FeLV) … #cats #catcancer #cathealth,1
#Ohio teen zaps cop with stun gun to fulfill #bucketlist wish #leukemia #Newark,1
#LongIsland #TechNews: Ohio teen with leukemia fulfills shocking bucket-list item …,1
Ohio teen with leukemia fulfills shocking bucket-list item - …pic.twitter.com/deDuRxRtXX,1
Please share! Katie died after a long battle w/ cancer after defeating leukemia as a child. Medical $$ are huge. …,1
"12,315 lbs for chronic neutrophilic leukemia (CNL). 1,334,485lbs to go and #lift2beatbloodcancerpic.twitter.com/M8f4mA3s8j",1
"NEWARK, Ohio – A police sergeant in central Ohio helped a teenage leukemia patient cross off a wish …",1
This 4-Year-Old With Leukemia is Princess for the Day pic.twitter.com/5ms4WAAx46,1
Doctors in the UK successfully treated two babies with leukemia using #GeneEdited immune cells: by,1
Kicking off Pennies for Patients to help the Leukemia and Lymphoma Society. #klenkshinespic.twitter.com/Sz7SVgD1Kv,1
"The LLSC wants to work with you, and for you, to help end #leukemia #lymphoma #myeloma! Find out how you can help! pic.twitter.com/0FYq7ZNdtp",1
This 4-Year-Old With Leukemia is Princess for the Day pic.twitter.com/k9t8jIYAzs,1
