tweet_text,month_of_tweet"I said the same thing Arsene & then at 73 it just hit me that I could work no more (found out later had leukemia). 6 yrs later still alive but if I could give Arsene one comment: NEVER SAY NEVER,",11
"I just registered to help cure leukemia and other blood cancers. It's so simple, yet so rewarding as you could help save a life. Go register and be someone in need's match!",11
"As a leukemia survivor (11 years now) myself, I am particularly pleased when children are able to rise above their illnesses to succeed in life.",11
Fukushima Cover-Up: “Keep cancers a secret” say doctors — “We’re getting leukemia and cataracts and we die suddenly” — “Students having sudden heart attacks” — Officials “actively ignoring” reports of illness and death …,11
"ps don't google ""sudden bruising"" or ""random bruises"" bc apparently i now have leukemia.",11
"""Radiation for prostate cancer may increase leukemia risk pic.twitter.com/3NVCwvb6gC""",11
"Before losing his battle w/ #leukemia & a brain #tumor in 2015, Nick Konkler created an upgrade for kids' IVs: .",11
on CAR T-Cell Therapy Approval in Pediatric #ALL via #leusm #CA,11
on CAR T-Cell Therapy Approval in Pediatric #ALL via #leusm #CA,11
. on CAR T-Cell therapy approval in Pediatric ALL #endcancer via,11
Great work from some of my favourite colleagues at my old university! #childhoodcancer#leukemia #leukaemia …,11
Paper: Next Generation Sequencing (NGS)-Based Post-Transplant Monitoring in Acute Myeloid Leukemia Patients Receivi …pic.twitter.com/3wZuDL9P53,11
"#SSStrong we are only $195.25 from our Pennies for Leukemia goal! Share, donate, share, donate!!! …",11
It would be an honor to have you as a guest on my #genetics radio show/podcast. Would be great to hear your dual insight as a #ChildhoodCancer Survivor and research #scientist on the genetics of #leukemia. Watching your #TedTalk now!,11
'A little bit of comfort' in Nicholas' name #leukemia #teamnicholas #philanthropy …,11
'A little bit of comfort' in Nicholas' name #leukemia #teamnicholas #philanthropy …,11
Hairy Cell Leukemia,11
#Leukemia Integrated Risk Stratification Using Minimal Residual Disease and Sentinel Genetic Alterations in Pediatric Acute Lymphoblastic Leukemia.,11
#Leukemia Smoldering Development of Acute Megakaryoblastic Leukemia with Clonal Evolution in an Infant without Down Syndrome.,11
Santa Maria Novella! Seemed fitting 2 pray & buy goods cultivated by friars in 1221 & to public in 1612. Like a holy & right thing to do as an homage to my industry after a leukemia conference? #ProfumoFarmaceutica #CanUseAllTheHelpICanGetpic.twitter.com/omKVKYbDCS,11
"Chelsea & Steven have recently lost their 8-year-old daughter to leukemia. As you can imagine, money has been...",11
No. 3 Medical Innovation for 2017: Cellular Immunotherapy to Treat Leukemia and Lymphomas (Video) …,11
"Pregnant women living near fracking sites had a benzene biomarker in their urine 3.5 times higher than women from the general Canadian population. Risks: low birth weight, childhood leukemia and birth defects such as spina bifida. …",11
High School Student Graduates While Fighting Leukemia #FightingLeukaemia pic.twitter.com/33xmg9aYeN,11
Minimal residual disease is a major cause of relapse in #leukemia and #lymphoma. Learn more here: pic.twitter.com/7Yz4yOEacz,11
My dear friend Lin died due to complications from leukemia. I hope you can contribute to his family during this challenging time of coping and transitioning. …,11
Staunton's Aaron Childs fights rare leukemia via,11
"He's quietly been helping the homeless in his neighborhood for years (would've never gotten out if not for paps taking a picture of him with a gentleman he had sat next to). Opened up a charity foundation for leukemia, too, because of his sister.",11
It starting Again :( PICKBON A LEUKEMIA PATIENT,11
Patients with #leukemia and other types of cancer often receive platelets. Learn more. pic.twitter.com/fCXcXZQR4M,11
"*guest speaker singles me out in class* “Try to imagine for a second, that you were just diagnosed with leukemia” Me: “............ok”",11
Check out this story from the Staunton's Aaron Childs fights rare form of leukemia,11
Fiji will be hosting for a benefit concert this Sunday to help Madison Barker raise money for The Leukemia and Lymphoma Society. Let me know if you are interested in purchasing a ticket! pic.twitter.com/RN4O9L1TFm,11
FMP raises money for Lymphoma and Leukemia Society - Mahomet Daily,11
I dearly wish we had known about LCHF when my dad was battling acute leukemia he might still be alive today,11
Over 20 years ago I remember the flyers and the blood/Swab drive in my shul to cure Jay Feinberg of Leukemia. It was awe inspiring to meet a true hero of the Jewish people and the world. #Leukemia #getswabbedpic.twitter.com/5fNKtJPHTj,11
say a quick prayer for my lil dude. he was diagnosed w/ leukemia last night pic.twitter.com/KApasniPKA,11
"West Marine, The Leukemia & Lymphoma Society fundraiser garners more than $41,300. … #boating #outdoors #charity",11
"My colleagues and I are walking to raise funds for the Leukemia and Lymphoma Society, on November 16th, at AT&T Park. Please join us Park - Lot A, SF, Thurs., Nov. 16, 2017 05:00 PM PST You can also support the cause with a donation: …pic.twitter.com/zgvWGFat64",11
"I went through a battle with leukemia and food saved my life. It brought me to the question, how do we truly fund food and beverage in a way that's sustainable and allows these entrepreneurs to pursue their dreams? - #IFTNEXT",11
"After being diagnosed w Chronic Myeloid Leukemia last year, junior battles every day on & off the court, but he's ready to suit back up for the Hawks this season & prove he can still play. #NPHawks READ: pic.twitter.com/6LgJjaVWsa",11
Staunton's Aaron Childs fights rare form of leukemia via,11
Staunton's Aaron Childs fights rare form of leukemia pic.twitter.com/vjwA8KzQZP,11
Watch an 11-yr-old #leukemia survivor rise from his wheelchair to cross the football stadium as part of his goal to learn to walk again. Hail Gabe! #GoBlue: pic.twitter.com/50d7RzkQKT,11
Well you’re rude …,11
TCM is not going to help a premature infant. Or a child diagnosed w/T1 Diabetes or Leukemia. Or fix a paralyzed spine. Just want to be clear- your “good health decisions” are noble. My step-dad’s were too. Didn’t stop him from getting terminal cancer and dying at 42.,11
Five-year-old Gabriel was diagnosed with leukemia and his childhood was put on hold as he went through treatment. Gabriel's wish to go on a gave his family the opportunity to relax and reconnect after a difficult time. #MakeAWish #TravelTuesdaypic.twitter.com/CgG46lMqYw,11
Y'all's music helps me with not only day to day obstacles and with my mood for the day. Recently my grandpa was diagnosed with acute leukemia and y'all's music helps me stay level headed. They gave my Papa a month or a month and a half left to live.,11
Coping and Support for People with #Leukemia #fightingleukaemiapic.twitter.com/ShObcKGKk5,11
Found this gem of a pic yesterday. 1961 Heisman winner Ernie Davis (Syracuse). Crazy thing is Ernie Davis also died in 1963 from Leukemia. pic.twitter.com/YcUnfCTQhP,11
just wish he can recover from that leukemia and get back between the goal post,11
Longitudinal analysis of QOL outcomes in children during treatment for acute lymphoblastic #leukemia: A report from the Children's Oncology Group AALL0932 trial … via,11
"The CA Plano office hosted a bake sale that raised more than $1,000 for Leukemia and Lymphoma Society. Great job team! #LifeAtCApic.twitter.com/ySJPH125WW",11
I get coke …,11
You called Leukemia a whore? …,11
"Altus Metal, Marble and Wood President Chairs Leukemia & Lymphoma Society's Light the Night Drive pic.twitter.com/gDrwPWAOSk",11
My cat just been diagnosed with leukemia. I immediately suggested for him to be put down. Adakah aku kejam?,11
"Altus Metal, Marble and Wood President Chairs Leukemia & Lymphoma Society's Light the Night Drive pic.twitter.com/7XmhBu3nGf",11
The Leukemia & Lymphoma Society is thrilled to announce our 20th Anniversary Southern Chesapeake Leukemia Cup...,11
"West Marine & The Leukemia & Lymphoma Society Raise More Than $41,300 through In-Store Fundraiser #Yacht & #Sailin…",11
ICYMI: Haploidentical Hematopoietic Cell Transplant with Post-Transplant Cyclophosphamide and Peripheral Blood Stem Cell Grafts in Older Adults with Acute Myeloid Leukemia or Myelodysplastic Syndrome,11
Fighting Leukemia and Racial Inequality at the same time #FightingLeukaemia,11
Great news from the The Leukemia & Lymphoma Society and West Marine!,11
Here are some of the great things being done by Leukemia & Lymphoma Society contact me to help with my 2018 Man...,11
"I lost my mother to leukemia a few years back & her name was Gloria as well. While I’m no Jimmy Fallon, all I wanted to do was make her laugh too. It does get easier but there’s never a day that I don’t think of her. Fans like that our moms are irreplaceable. Peace pic.twitter.com/O96U9gHq9Y",11
"9. around 2005 i adopted a cat and found out a few days later he had leukemia - over the next ten years or so i took in four more cats with leukemia and/or FIV, neither one is a death sentence. my current two are healthy though",11
Discovery In The Treatment Of Leukemia: The Molecules Found In Avocados Are Targeting Cancer Cells …,11
Angels exist! Help the Leukemia & Lymphoma Society of Canada #buynow #angelsexist,11
LivingOnChi: #Fukushima #GeoEngineering Emily Chung 6/23/16 Scientists discover 1st #leukemia-like #cancer tha… …,11
"Leukemia, you're a bastard!! We had a good goalkeeper in Carl Ikeme then you took him away! Putaaaa!! #ARGNGA",11
#Fukushima #GeoEngineering Emily Chung 6/23/16 Scientists discover 1st #leukemia-like #cancer that can spread between species …,11
Mother calls hospice nurse 'vital part of the family' after helping daughter battle leukemia,11
"""shortly after finding out that he was diagnosed with ALL (acute lymphoblastic leukemia"" …",11
One of my old friends from school is currently fighting leukemia and is being hospitalized please keep her in your prayers.,11
"I’m just shocked, but HAPPY he is still around .... the leukemia should have taken him already",11
#Fukushima Cover-Up: “Keep cancers a secret” say doctors — “We’re getting leukemia and cataracts and we die suddenly” — “Students having sudden heart attacks” — Officials “actively ignoring” reports of illness and death. …,11
"I think its important to find a cause that speaks to you. My cousin was diagnosed with Leukemia at the age of 2. There are many children and families in our community that are going through these hard times right now. Donate, talk to these children, lift their spirits. #UWWCchat",11
In tears that my friend just found out their 4 year old son is in remission from leukemia! I just.... overwhelmed.,11
"rosemary doesn't enhance flavor it just makes whatever you're eating taste like rosemary, that is, an herbal candle you buy at the front desk of a yoga studio , that actually gives you leukemia",11
"Don't expect us tax payers to vaccinate you against feline leukemia, calci, distemper and rabies. Also, you'll need to figure out how to deworm yourself, as well... 8 /",11
"We celebrated Elizabeth Benitez, one of our employees fighting & winning a battle with leukemia, at Light The Night Walks in Miami & Fort Lauderdale. Here are some members of Kaufman Rossin's #LightTheNight team, “Journey to a Leukemia Free E!” pic.twitter.com/eFbK1mdYaj",11
FDA approves dasatinib for children with Philadelphia chromosome-positive chronic myeloid leukemia: … #CML #leukemia #newtherapies,11
"What are you doing this Saturday? Come out to our #Leukemia benefit at Queeny Park! Excellent raffles, beer, food and mediocre hockey - what would you do instead? …",11
"American who lives in the UK & experienced w both systems adds: this doesn't sum up 'what a single payer system really is like', but thanks. But, teen US niece can't get a surgeon appt fr Kaiser to redo her *failing*, unbearably painful knee graft (d.t. leukemia chemo) for months",11
Raider Kind volunteers for Leukemia & Lymphoma Society for annual Light the Night campaign to help cancer victims #kindness #cool2bkindpic.twitter.com/rRMsNhUtWZ,11
LivingOnChi: #Fukushima #Cancer #Leukemia #Autism #Dementia #Heart #Liver #Lung #Pituitary #Thyroid #immunesystem …,11
Mother calls hospice nurse 'vital part of the family' after helping daughter battle leukemia …,11
Fukushima Cover-Up: “Keep cancers a secret” say doctors — “We’re getting leukemia and cataracts and we die suddenly” …,11
"Thank you so much to all of those that donated and participated in #LightTheNight with RED. Our team's fundraising efforts and generous donations combined with our corporate sponsorship enabled RED to raise over $50K to benefit the Leukemia and Lymphoma Society in Columbus, OH. pic.twitter.com/0OZmsnuDou",11
Fukushima Cover-Up: “Keep cancers a secret” say doctors — “We’re getting leukemia and cataracts and we die suddenly” …,11
Fukushima Cover-Up: “Keep cancers a secret” say doctors — “We’re getting leukemia and cataracts and we die...,11
Support Reese Horn's Leukemia Journey by grabbing some Hurts Donut - Wichita Kansas #ReeseStrong treats. Just $3...,11
Tumor Lysis Syndrome in Chronic Lymphocytic Leukemia with Novel Targeted Agents …,11
"Clinical Research Coordinator II - Leukemia - #Duarte , CA ( ) Get Clinical Research Coordinator Jobs",11
"""A young boy named Landon Riddle was diagnosed with Leukemia, and was told by his doctors that he only had an...",11
Study: Leukemia is more Deadly for Blacks #FightingLeukaemia pic.twitter.com/zfH5HWv0DF,11
"Our Anisomycin small molecule relvealed the link between oxidative stress, cellular diff. & galectins in Leukemia",11
Brock (2nd from right) had leukemia as a baby. Our transportation service helped his family get him to treatment. Brock is now cancer free. pic.twitter.com/9Kk4Mcx7iJ,11
Brock (2nd from right) had leukemia as a baby. Our transportation service helped his family get him to treatment. Brock is now cancer free. pic.twitter.com/ePUUmeO4Xh,11
Brock (2nd from right) had leukemia as a baby. Our transportation service helped his family get him to treatment. Brock is now cancer free. pic.twitter.com/NVaUQA7LPK,11
Brock (2nd from right) had leukemia as a baby. Our transportation service helped his family get him to treatment. Brock is now cancer free. pic.twitter.com/dERvZX8RoF,11
Brock (2nd from right) had leukemia as a baby. Our transportation service helped his family get him to treatment. Brock is now cancer free. pic.twitter.com/RVdW2kJeUa,11
Brock (2nd from right) had leukemia as a baby. Our transportation service helped his family get him to treatment. Brock is now cancer free. pic.twitter.com/A2QhOG5xzQ,11
Brock (2nd from right) had leukemia as a baby. Our transportation service helped his family get him to treatment. Brock is now cancer free. pic.twitter.com/JirroYczfz,11
Brock (2nd from right) had leukemia as a baby. Our transportation service helped his family get him to treatment. Brock is now cancer free. pic.twitter.com/anS32j20v8,11
New article is out #AML #leukemia …,11
Brock (2nd from right) had leukemia as a baby. Our transportation service helped his family get him to treatment. Brock is now cancer free. pic.twitter.com/nirHfF9m6x,11
[Watch This] 5 signs of Leukemia you probably don't know but should. #Leukemia #Symptom #Health...,11
Help Luis Danvers Leukemia Fund every time you shop:,11
“Keep cancers a secret” say #doctors “We’re getting leukemia & cataracts & we die suddenly” “Students having sudden heart attacks” … Fukushima #genpatsu #energy #waste #humanrights #climate #law #journo #womenpic.twitter.com/bRxl6Vq3nh,11
"Don’t forget how he stalled the nomination of a longtime friend of Obama until she died of leukemia, simply to spite him. …pic.twitter.com/gF4rrQT2ae",11
"News & Views - Selective Inhibition of FLT3 by Gilteritinib in Relapsed or Refractory Acute Myeloid Leukemia: A Multicenter, First-in-human, Open Label, Phase 1-2 Study - pub. 11/14/17 … #AMLOnTheGo #AML #BloodCancerpic.twitter.com/Y5wQWJg0H8",11
Early Response-Based Therapy Stratification Improves Survival in Adult Early Thymic Precursor Acute Lymphoblastic Leukemia: A Group for Research on Adult Acute Lymphoblastic Leukemia Study. …,11
#OurBurlington team is so proud of our partnership with the Leukemia & Lymphoma society and the groundbreaking cancer research we've been able to support! #Cancer #FightCancer #Retail #GiveBack …,11
#clinicaltrial Study of the Use of Venetoclax in Patients With Chronic Lymphocytic Leukemia (CLL) Under Real‑Life …,11
Everyone please pray for peace over my family. My cousin Jaydn lost her battle with leukemia. She fought long and hard but God had other plans. pic.twitter.com/sKhWbWkQTA,11
Check out Preventing fungal infections after chemotherapy in acute leukemia patients … via #Leukemia,11
What procedures it’s used for may be an ethical question but surely there can’t be ethical doubts about sparing a child the kind of chromosomal abnormalities that create childhood leukemia’s.,11
"Diagnosed with leukemia 6 months ago, unable to work, needing a free roof, of #BellefonteDE got one today. Thanks JR Walker Roofing. #NCCCares #NoRoofLeftBehindpic.twitter.com/o3JURF30eX",11
Happy #NPWeek to all #NursePractitioners! Thank you to our team members for their dedication to our #leukemia patients. We couldn't do it without you. #endcancer …,11
"919 Lacrosse will host the Trey Ennis Lacrosse for Leukemia Memorial Tournament this weekend at Jordan High School. Trey, 15, was a member of the Jordan High School boys lacrosse team before succumbing to #leukemia in May .More info: Andrea Matthes at amatthes74 pic.twitter.com/yEALu05yWJ",11
Study of the Use of Venetoclax in Patients With Chronic Lymphocytic Leukemia (CLL) Under Real‑Life Setting: Status…,11
I want a boyfriend …,11
Andrea was fighting leukemia. She couldn't get a lifesaving stem cell transplant until she completed pricey dental work. She had no funds left to cover this essential expense. That's when you stepped in. #hopeispic.twitter.com/vJpErnKG1y,11
"Howzit Logan, my one friend is a loganster and he’s recently been diagnosed with leukemia at age 10. It would mean the world to him if you could mention him in one of you vlogs. His name is Rowan Piorkowski. This kid is always denting the universe and 100% always a savage.",11
"Hey mark, I have a friend who’s part of the dohnation and has recently been diagnosed with leukemia at age 10. His name is Rowan Piorkowski and it would mean the world to him if you mention him in the vlogs. This kid ain’t camera shy and is always shocking the world",11
Success with CAR T-cell therapy in pediatric ALL will spread to adult and older populations:,11
ICYMI: FDA Approves New Pediatric #Leukemia Treatment #Cancerpic.twitter.com/pvLiWdx9ux,11
"Thanks so much for your wonderful comment, my friend. Gene Krupa was a friend of mine since I was a child. In fact, I played with him a number of times, including his concert for leukemia shortly before his death from the disease. What a great man he was! Thom",11
Fukushima Cover-Up: “Keep cancers a secret” say doctors — “We’re getting leukemia and cataracts and we die suddenly …,11
"Meet us at IHK Saxon pavilion, 3E74 We will be happy to present you our products and services and discuss about your needs in PCR-multiplex technologies in pathogen diagnostics, Leukemia, Contract development and manufacturing. on site: pic.twitter.com/6wYPqKZ009",11
We're seeking input on #Besponsa for acute lymphoblastic leukemia (#ALL) for our #pCODR review #leusm pic.twitter.com/TdMBEuIsLA,11
"Thank you to all who walked and contributed to The Leukemia & Lymphoma Society's (LLS) Light The Night Walk. With your efforts, the Maxor team raised over $14,000 for this important cause. Your encouragement and support is much appreciated. pic.twitter.com/zNrtmTvIyw",11
"I just donated to The Leukemia & Lymphoma Society. Help patients with blood cancer live better, longer lives. Visit …",11
"My dad has doabetes, I was a 5% risk this summer in my blood work, which I'm thankful for. What disgusts me I what it costs to have cancer, a few years ago my mom was diagnosed chronis myeloid leukemia, without the miracle work in foundations, meds would be $175,000+ a year...",11
WebMD: You have leukemia Me: starts thinking about what it would be like if these are my final months 2 hours later ...Oh wait my only symptoms are dry skin and a headache?,11
Fukushima Cover-Up: “Keep cancers a secret” say doctors — “We’re getting leukemia and cataracts and we die… …,11
"Coping with #Leukemia or #Hodkgin's #Lymphoma Medivizor can help with personalized, reliable, and understandable c…",11
"As our family goes into battle today for my uncle Jim who starts treatment today for leukemia, if everyone could just say a quick prayer for him to beat this",11
The CHOP made me start to study medicine because of what they did with Chemo. I learned too much about that. I already knew about vaccines and believe that's what caused her leukemia in the first place. It was after her being jabbed.,11
Check out: Safe to switch to imatinib for long-term use after initial treatment with ... … via #Leukemia,11
"Nicholas think of the people that have gone before us. My father had a heart transplant, developed Parkinson’s and leukemia. Still he could smile and joke even when his health was declining. What I’m saying is draw from the strength of others who’ve walked in the valley before us",11
"Almost 5k views on 'Leukemia- Not Just a Disease!' Thanks everyone who has watched the film; if you haven't do watch it. Do share it if you like it. The 14 year old's story might add a little inspiration in someone's life. Also, Happy Children's Day! :) …",11
"""...boosting the risk of developing leukemia by more than 10 times..."" …",11
Returns to the ice and scores....battling leukemia like a star!,11
"Happy 4th year anniversary to my day of diagnosis of Acute Myeloid Leukemia or AML, It was a…",11
Dasatinib Approved to Treat Chronic Myeloid Leukemia in Pediatric Patients #Leukemia #Cancerpic.twitter.com/f88ftJ4R8e,11
Promyelocytic Leukemia (PML) Nuclear Bodies (NBs) Induce Latent/Quiescent HSV-1 Genomes Chromatinization Through a PML-NB/Histone H3.3/H3.3 Chaperone Axis …,11
Leukemia is a type of cancer in blood and bone marrow. It is caused by the rapid production of abnormal white...,11
Leukemia is a type of cancer in blood and bone marrow. It is caused by the rapid production of abnormal white blood cells.Abnormal white blood cells are not able to fight infection and impair the ability of the bone marrow to produce red blood cells and platelets.,11
"Blood cancer is caused by malignancy that attacks the blood,lymphatic system or bone marrow.there are three types leukemia,lymphoma, and multiple myeloma.",11
Mighty Max is a third grader in Merrimack who has leukemia. He has been fighting for over two years now. Friends...,11
"At the age of 7, Sadie Keller was diagnosed with Acute Lymphoblastic Leukemia. For the last 2…",11
Fat people are vegans,11
"At the age of 7, Sadie Keller was diagnosed with Acute Lymphoblastic Leukemia. For the last 2…",11
You Make the Call: How would you treat an otherwise fit 92-year-old with pancytopenia diagnosed with Ph-negative B-cell acute lymphocytic #leukemia?,11
Fukushima Cover-Up: “Keep cancers a secret” say doctors — “We’re getting leukemia and cataracts and we die…,11
If only people knew how I feel and know the pain I’m in. Jesse thinks it’s a smart idea to become a smoker :) like excuse me are you stupid? Your sister has leukemia and your over there huffing and puffing. Are you dense bud?,11
Top moments of the night: FINALLY winning over Gloria and getting her to join the party and giving her all the can tops for Leukemia!,11
Fukushima Cover-Up: “Keep cancers a secret” say doctors — “We’re getting leukemia and cataracts and we die suddenly” — “Students having sudden heart attacks” — Officials “actively ignoring” reports of illness and death …,11
Fukushima Cover-Up: 'Keep cancers a secret' say doctors — 'We’re getting leukemia and cataracts and we die sudden... …,11
"Guess who needs a new kidney, this girl as if Leukemia isn’t enough. Ugh #cancerLife #SickOfBeingsSick",11
"Kidney bean, the Whole Food in Reduced Risk and Treatment of Leukemia …",11
Fukushima Cover-Up: “Keep cancers a secret” say doctors — “We’re getting leukemia and cataracts and we die suddenly” — “Students having sudden heart attacks” — Officials “actively ignoring” reports of illness and death « – Energy News,11
"Why wasn’t I the one taken, I’m the one with cancer, I’m the one who wanted to die! Why did I have to have Leukemia? Anna is innocent, reckless drivers everywhere. She left way too soon, she’s still a child!",11
Save My Daughter Rida Fathima to Fight Blood Cancer (a.l.leukemia),11
He said sorry for insulting leukemia and for harassing the VA’s and yet turns around and sends them death threats. He doesn’t deserve justice,11
