tweet_text,month_of_tweet"F.D.A. Approves First Gene-Altering Leukemia Treatment, Costing $475,000",9
FDA Approves First Gene Therapy For Leukemia,9
FDA advisory committee recommends Novartis' CAR-T therapy for young leukemia patients,9
My sister-in-law Lorilei was just diagnosed two weeks ago with leukemia. Please send extra…,9
Some positive news. US clears first 'living drug' for tough childhood leukemia … #ChildhoodCancerAwarenessMonth,9
Check out Treatment guidelines for acute myeloid leukemia … via #Leukemia,9
. approves first 'living drug' for tough #childhood #leukemia. #CancerCare,9
I liked a video FDA approves 'gene therapy' leukemia treatment,9
Katie's Story: Surviving Acute Lymphocytic #Leukemia #fightingleukaemia,9
"ICYMI: FDA approves ""a brand new way of treating cancer"" -- first gene therapy for childhood leukemia",9
"You're a skinhead, you BITCH. no dad, it's leukemia! leuk-what? Stop speaking german you fucking nazi!",9
I hope that I can. If you ever do anything for Leukemia let me know. I had 2 kinds of leukemia and a bone marrow transplant,9
. Please 18yrs old diagnosed with Leukemia that needs our help,9
successful treatments adult chronic myelomonocytic leukemia,9
"F.D.A. Approves First Gene-Altering Leukemia Treatment, Costing $475,000",9
Modified T cells that attack leukemia become first gene therapy approved in the United States …,9
Stem Cell Agency Invests in #ClinicalTrial that Uses a One-Two Punch to Confuse & Kill #Leukemia Cells pic.twitter.com/sKqJFGkfN0,9
Special story about special student-athlete who overcame leukemia & is back playing soccer.,9
FDA OKs Return of Once-Withdrawn Leukemia Drug #Health #Medicine,9
Madie's Story: Longest-Living Survivor of Chronic Neutrophilic Leukemia (CNL) …pic.twitter.com/dTxRU6QK67,9
charity event for leukemia and lymphoma research pic.twitter.com/myfqdmmWTy,9
"Acute lymphoblastic leukemia? ""CAR-T(for Chimeric Antigen Receptor T-Cell, a technical description of the...",9
"Bc when someone said ""oh leukemia, they cure that now"" I thought ""not her kind"" RIP Au'janae & Sarah. #ChildhoodCancerAwarenessMonth",9
Drug Safety Alerts • Kymriah- A 'historic' new type of leukemia treatment: The U.S. Food…,9
#Childhood #Leukemia may finally have an answer with the first the #FDA approving the first ever #genetherapy …,9
"F.D.A. Approves First Gene-Altering Leukemia Treatment, Costing $475,000",9
Gene therapy approved by FDA for leukemia treatment,9
#Leukemia: Mushroom protein could be used in future treatments. #Hematology pic.twitter.com/KjSqeLhq8a,9
US clears breakthrough gene therapy for childhood leukemia - ABC News …,9
"ARRS GoldMiner featured images: ""Chronic Myeloid Leukemia"" …",9
Sweroside eradicated leukemia cells and attenuated pathogenic processes in mice by inducing apoptosis.,9
Modified T cells that attack leukemia become first gene therapy approved in the United States …,9
"Worth more than 4% #gogold #childhoodcancerawareness #leukemia #cancersucks My son, my heart is…",9
"Wolves fans have raised £1,000s since Ikeme was diagnosed with leukemia because of the connection between the player & fans",9
"Just heard that former X4 member SJ has been diagnosed with acute myeloid leukemia, cancer. Please stay strong, you can do this.",9
She died because of Leukemia in LFA and Half-hearted.. And Throat cancer in Why Her..,9
Leukemia : first gene therapy in the United States pic.twitter.com/5uK0myrVNw,9
The average bill for lymphoma and non-acute leukemia in Connecticut was 35 iPhone 6S Pluses (a 12 lb pile of phones) #trumpcare,9
"FDA approves breakthrough ‘living drug’ for childhood leukemia with $475,000 price ta… … ➜ …pic.twitter.com/MSh8Df0c47",9
8. FDA Approves First Gene Therapy For Leukemia #SundayReads …,9
Deputy battling leukemia has history of helping others including reviving someone with #CPR #AED Act of #Kindness …,9
Symptoms Of Feline Leukemia Virus That You Should Be Aware Of Feline Leukemia Test KitsCats are inquisitive creatu,9
US clears first gene therapy for aggressive childhood leukemia … #hot,9
GARDASIL VACCINE KILLS DAUGHTER OF A CALIFORNIA NURSE SUFFERING FROM LEUKEMIA …,9
"F.D.A. Approves First Gene-Altering Leukemia Treatment, Costing $475,000",9
Gene analysis and sequencing in treatment of leukemia pic.twitter.com/gGOircDQv7,9
A pioneering gene therapy for leukemia has arrived in the U.S. - via …,9
FDA approves first 'living drug' for tough childhood leukemia,9
He's put on a lot of weight since being on chemo and steroids. He lost a bit from the leukemia pic.twitter.com/XmWykhIC7r,9
"F.D.A. Approves First Gene-Altering Leukemia Treatment, Costing $475,000",9
"Saying ""you want to be a 7 year old with leukemia, just so you can meet famous people"" is a really inconsiderate joke #justsayng",9
"""So do you just catch leukemia from being outside in the cold"" -- , 2017",9
Comedian Charlie Murphy Dead at 57 After Leukemia Battle …,4
I had NO idea he was battling leukemia...#ripcharliemurphy …,4
Leukemia is one harsh type of cancer .. cancer period is the devil .. why tf are so many ppl developing cancer?!,4
"Rest In Peace to a great one, Charlie Murphy. I had no idea he was battling Leukemia. #FvckCancer",4
Comedy flag flying at half staff... RIP Charlie Murphy. #leukemia sucks pic.twitter.com/IFBT7CAvYX,4
"Yeah man. Leukemia got him. Hell, I didn't even know he was sick..",4
Comedian Charlie Murphy Dead at 57 After Leukemia Battle … via,4
"Eddie Murphys older brother. Funny guy, sadly he's gone to leukemia. You may enjoy his comedy. Look him up! #RIPCharlieMurphy …",4
Comedian Charlie Murphy Dead at 57 After Leukemia Battle,4
Comedian Charlie Murphy dies following leukemia battle by #lenayada via,4
Comedian Charlie Murphy Dead at Age 57 From Leukemia … via,4
Comedian Charlie Murphy Dead at 57 After Leukemia Battle - …pic.twitter.com/MvBZrzEvwk,4
Welcome to Armzyville's Blog: US comedian Charlie Murphy dies of Leukemia at 57 …,4
#BREAKING Comedian Charlie Murphy Dead at 57 After Leukemia Battle by #EdwardAshton30 via,4
Comedian Charlie Murphy Dead at 57 After Leukemia Battle … via,4
I just saw this! I can't believe it. I had no idea he had leukemia,4
#DAMN I was unaware that was battling leukemia. I am shocked and saddened to learn of his passing. #RIPCharlieMurphy.,4
RIP Charlie Murphy: Comedian Dead At 57 After Battle With Leukemia pic.twitter.com/zyX9OpolQV,4
Comedian Charlie Murphy Dead at 57 After Leukemia Battle | … Found out about this late. RIP!,4
I've just posted a new blog: US comedian Charlie Murphy dies of Leukemia at 57,4
Comedian Charlie Murphy dies at 57 following battle with leukemia … via,4
We all lost a great entertainer and a great guy! Charlie Murphy passed away today from leukemia. Eddie 's brother will definitely be missed.,4
"Comedian charliemurphy, brother of Eddie Murphy and Chapelle's Show star has passed away at 57 from Leukemia. RIP pic.twitter.com/dR3Q7FYN6i",4
TMZ: Charlie Murphy dead at 57 after leukemia battle pic.twitter.com/GQyLSOrnAV,4
Comedian Charlie Murphy Dead at 57 After Leukemia Battle … via,4
Comedian Charlie Murphy dies following leukemia battle #PNGpic.twitter.com/JVr1uD1BiC,4
RIP Charlie Murphy!! Why didn't you tell anyone you had leukemia??? #fuckcancer I'm going to miss you man! I wish...,4
Charlie Murphy Passes Away From Leukemia …pic.twitter.com/PWbavAApXi,4
Comedian Charlie Murphy dies following leukemia battle …,4
Comedian Charlie Murphy Dead at 57 After Leukemia Battle … via,4
We recycle cell phones #iphones #ipads to support the Leukemia & Lymphoma Society #Leukemia #fightcancer,4
We recycle cell phones #iphones #ipads to support the Leukemia & Lymphoma Society #Leukemia #fightcancer,4
I didn't cry but I had no idea he had leukemia,4
"Eddie Murphy’s Older Brother, Charlie Murphy Loses Leukemia Battle",4
TRENDING- (Comedian Charlie Murphy Dead at 57 After Leukemia Battle | TMZ Chatter) MUST SEE hiphothollywood - …pic.twitter.com/nNHAmkwCK7,4
Comedian Charlie Murphy Dead at 57 After Leukemia Battle,4
Comedian Charlie Murphy dies following leukemia battle …,4
This morning.. He had leukemia,4
Still reading about #luekemia the deadly #disease. #disabled #disadvantaged #seniors Leukemia is a cancer of blood cells pic.twitter.com/lzVLjytQ1K,4
#BREAKING Comedian Charlie Murphy Dead at 57 After Leukemia Battle by #TMZ via,4
Comedian Charlie Murphy Dead at 57 after Leukemia Battle - …pic.twitter.com/VA6ehSf2rH,4
What??? I didn't even know Charlie Murphy had leukemia. This is terrible. Rest in peace. …,4
US comedian Charlie Murphy dies of Leukemia at 57,4
3 of My family members died of cancer and still one living with leukemia and one of my good young internet friends has it to,4
More Aussie and NZ kids surviving leukemia: study …pic.twitter.com/VdtIMaNBt5,4
Charlie Murphy kept his battle with leukemia extremely private.,4
"Charlie Murphy lost a battle with leukemia today. RIP. In his honor, here's one of his... by #jaketapper",4
US comedian Charlie Murphy dies of Leukemia at 57,4
US Comedian Charlie Murphy Dies Of Leukemia At Age Of 57 …pic.twitter.com/XykWYsqrHJ,4
US Comedian Charlie Murphy Dies Of Leukemia At Age Of 57 …pic.twitter.com/NnkkYVBxfJ,4
US Comedian Charlie Murphy Dies Of Leukemia At Age Of 57 …pic.twitter.com/VMacngfl4l,4
US comedian Charlie Murphy dies of Leukemia at 57,4
US comedian Charlie Murphy dies of Leukemia at 57,4
US comedian Charlie Murphy dies of Leukemia at 57,4
US Comedian Charlie Murphy Dies Of Leukemia At Age Of 57 …pic.twitter.com/XHkWAaE9zH,4
Charlie Murphy died battling leukemia and his wife died in 2009 battling cancer ..... they left behind 2 beautiful children,4
#BREAKING Comedian Charlie Murphy Dead at 57 After Leukemia Battle by #FOX5Atlanta via,4
Charlie Murphy Passes Away From Leukemia …pic.twitter.com/OkAh4GgbeD,4
Fuck leukemia rip tristian too.,4
Yea from leukemia,4
"Comedian Charlie Murphy died Wednesday after a battle with leukemia, according to his…",4
The world is a little less funny today. #RIPCharlieMurphy (I had no idea he had leukemia.) pic.twitter.com/4lepr78jHM,4
Comedian Charlie Murphy Dead at 57 After Leukemia Battle | … #SmartNews,4
Charlie Murphy DIES At 57 - Secretly Had Leukemia (Pics),4
Comedian Charlie Murphy Dead at 57 After Leukemia Battle … via,4
Comedian Charlie Murphy dies following leukemia battle RIH We lost a good one today #CharlieMurphy,4
"i wanted to donate my hair to my aunt with leukemia, but she passed before i could. so im cutting it the 23 to donate in her name.",4
#RIP Comedian Charlie Murphy Dead at 57 After Leukemia Battle … via,4
Comedian Charlie Murphy Dead at 57 After Leukemia Battle,4
I didn't know he had leukemia so it's a bummer.,4
Comedian brother of Eddie Murphy and Chapelle's Show star has passed away at 57 from Leukemia. RIP pic.twitter.com/rJh3sg2Fxo,4
Charlie Murphy has passed away after losing his battle with leukemia. I'm sure you & Prince are enjoying some basketball & pancakes #RIP,4
#BREAKING Comedian Charlie Murphy Dead at 57 After Leukemia Battle by #FOX10Phoenix via,4
Comedian Charlie Murphy Dead at 57 After Leukemia Battle … via,4
US Comedian Charlie Murphy Dies of Leukemia at 57,4
TMZ: Comedian Charlie Murphy dies after battle with leukemia,4
Comedian Charlie Murphy Dead at 57 After Leukemia Battle | …,4
In Loving Memory of Charlie Murphy 7/12/59 - 4/12/17 Charlie Murphy lost his battle with leukemia today. He was 57 years old. R.I.P pic.twitter.com/m28zkPuyTM,4
Leukemia Symptoms: What To Know After Comedian Charlie Murphy's Death From…,4
Comedian Charlie Murphy dies following leukemia battle …,4
Comedian Charlie Murphy Dead at 57 After Leukemia Battle | RIP …,4
"Health damage caused by radioactivity by Fukushima explosion came out in Japan. Thyroid cancer, such as leukemia.",4
Comedian Charlie Murphy Dead at 57 After Leukemia Battle …,4
"Comedian Charlie Murphy, Eddie Murphy’s Brother, Dies at 57 Following Leukemia Battle …pic.twitter.com/sosRym39DH",4
"Eddie Murphy’s brother Charlie Murphy dies of Leukemia, aged 57 …pic.twitter.com/cnL5yVGPcp",4
Charlie Murphy Dead at 57 After Battle with Leukemia …,4
"Okay, Charlie Murphy has passed, wow, he was battling Leukemia. He never released anything about his condition,...",4
Took Clementine to the vet today and had her tested and vaccinated. She's negative for Feline HIV and Leukemia! So happy!,4
It's real. Leukemia got him,4
R.I.P Charlie Murphy. Fuck leukemia srsly.,4
Comedian Charlie Murphy Dead at 57 After Leukemia Battle … via,4
Still pissed Leukemia took Charlie Murphy. Thank you for making us laugh Charlie Murphy!! pic.twitter.com/WbxIrSmEwo,4
Lost his battle with Leukemia.. …,4
Let's find a cure! I'm raising money for the Leukemia &a Lymphoma Society! Donate at #boxoutcancer …,4
Didnt even know charlie had leukemia a lot of the real ones keep quiet and suffer in silence,4
"My Warrior Crush Wednesday, Charlie Murphy passed away due to complications from Leukemia.…",4
Comedian Charlie Murphy Dead at Age 57 From Leukemia … via,4
Comedian Charlie Murphy Dead at Age 57 From Leukemia … via,4
He had leukemia Terry tf you think he gon look like,4
Comedian Charlie Murphy Dead at Age 57 From Leukemia … via,4
"So sad about Charlie Murphy. He always made me laugh, and seemed like a really cool guy. #RIPCharlieMurphey #charliemurphy #Leukemia pic.twitter.com/Kn8xSBgk3I",4
EJ: Charlie Murphy Dead At 57 After Leukemia Battle,4
Comedian Charlie Murphy dies at 57 after battle with leukemia,4
#NEW Charlie's Angel: Comedian Charlie Murphy Has Died at the Age of 57 After a Battle With Leukemia,4
Video: R.I.P: Charlie Murphy Dead At 57 After Leukemia Battle! Rest In Peace brother. …,4
Comedian Charlie Murphy Dies At 57 Following Battle With Leukemia,4
In some shocking news actor and comedian Charlie Murphy has sadly passed way at the age of 57 after a hard battle with leukemia he can now pic.twitter.com/bDkriWFbSd,4
Yeah :( he was fighting leukemia,4
hella sad that charlie murphy died from leukemia,4
RIP another one gone from leukemia...,4
"One funny dude, great story teller. It's a sad day. Never knew he had leukemia. RIP #charliemurphy …",4
Comedian Charlie Murphy Dead at 57 After Leukemia Battle …,4
Had no idea he was battling Leukemia. Another funny man gone.. pic.twitter.com/VPpSeQMc0T,4
Comedian Charlie Murphy Dead at 57 After Leukemia Battle …,4
I liked a video Charlie Murphy| Dead at 57 From Leukemia,4
Comedian Charlie Murphy Dead at 57 After Leukemia Battle,4
Feelin loopy. Like..creative. Leukemia man....Fuck.,4
#BREAKING Comedian Charlie Murphy Dead at 57 After Leukemia Battle by #godkth via,4
Comedian Charlie Murphy Dead at 57 After Leukemia Battle …,4
So shocked & saddened! He made me laugh so much! Comedian Charlie Murphy Dead at 57 After Leukemia Battle … via,4
Ed Murphy’s older brother Charlie Murphy died The 57-year-old actor lost the battle against leukemia...,4
#BREAKING Comedian Charlie Murphy Dead at 57 After Leukemia Battle by #FOX5Atlanta via,4
Comedian Charlie Murphy Dead at 57 After Leukemia Battle,4
"Comedian Charlie Murphy, Eddie Murphy’s Brother, Dies at 57 Following Leukemia Battle | Tim Conway Jr | KFI AM 640",4
US comedian Charlie Murphy dies of Leukemia at 57 #Beauty …,4
Comedian Charlie Murphy Dead at 57 After Leukemia Battle,4
Comedian Charlie Murphy Dead at 57 After Leukemia Battle,4
"Charlie Murphy news is hella sad, I never knew he had Leukemia. Legend. God bless him!",4
#BREAKING Comedian Charlie Murphy Dead at 57 After Leukemia Battle by #VuduFans via,4
#BREAKING Comedian Charlie Murphy Dead at 57 After Leukemia Battle by #TMZ via,4
Comedian Charlie Murphy dies following leukemia battle …pic.twitter.com/RzYq8UmxV4,4
CHARLIE MURPHY DEAD AT 57 After Leukemia Battle …pic.twitter.com/SGtKWhntvY,4
He died from leukemia according to his manager.,4
Charlie Murphy Dead at 57 from #Leukemia #charliemurphy #cancer #commedy #rip #chappelleshow #showbiz …,4
Comedian Charlie Murphy dies following leukemia battle pic.twitter.com/xHi0noDq6P … #CNN,4
US comedian Charlie Murphy dies of Leukemia at 57 READ MORE,4
Comedian Charlie Murphy Dead At 57 After Leukemia Battle,4
Comedian Charlie Murphy Dies At 57 Following Battle With Leukemia …,4
Comedian Charlie Murphy Dead at 57 After Leukemia Battle …,4
Comedian Charlie Murphy dead at 57 following leukemia battle,4
Comedian Charlie Murphy dies following leukemia battle RIP Charlie Murphy pic.twitter.com/espXaAhbMa,4
NEWS: We say goodbye to Charlie Murphy who died today after battling Leukemia. Our condolence to the Murphy Family....R.I.P Brother!! pic.twitter.com/17z9kgBIqj,4
New: What is the optimal dose of imatinib in newly diagnosed chronic myeloid leukemia? … via #Leukemia,4
Comedian Charlie Murphy dies following leukemia battle Oh my goodness! This is so unexpected! He was hilarious!,4
Comedian Charlie Murphy Dead at 57 After Leukemia Battle,4
Comedian Charlie Murphy Dead at 57 After Leukemia Battle,4
"Charlie Murphy, the older brother of Eddie Murphy, died Wednesday of leukemia at age 57 #RIP #RIPCharlieMurphey",4
Comedian Charlie Murphy Dies at 57 - The 'Chappelle's Show' star died from leukemia on Wednesday. ...,4
Comedy legend Charlie Murphy has died at 57 years old after a battle with Leukemia. … by #DakotaAdkins04,4
"Charlie Murphy Loses Battle With Leukemia, Dead at 57",4
"Wait, Charlie Murphy passed? I didn't even know he had leukemia. #FuckCancer",4
Comedian Charlie Murphy Dead at 57 After Leukemia Battle,4
R.I.P Charlie Comedian Charlie Murphy dies at 57 following battle with leukemia … # via,4
Comedian Charlie Murphy dies following leukemia battle …,4
Charlie Murphy Dead at 57 After Leukemia Struggle via,4
Comedian Charlie Murphy dies following leukemia battle. …,4
Comedian Charlie Murphy Dies At 57 Following Battle With Leukemia …,4
Sad to hear Charlie Murphy has passed. Only 57 yrs old. Battle with leukemia. #bet #betremembers #rippic.twitter.com/gsjepDJh6Z,4
"RIP, Charlie Murphy … #leukemia pic.twitter.com/8rUqbRU8gh",4
Charlie Murphy Dead at 57 Following Battle with Leukemia | B. Scott |,4
Rest his soul Comedian Charlie Murphy Dead at 57 After Leukemia Battle … via,4
Comedian Charlie Murphy dies following leukemia battle: Comedian Charlie Mu.. via #celebrity,4
Comedian Charlie Murphy dies following leukemia battle …,4
Comedian Charlie Murphy Dead at 57 After Leukemia Battle … via,4
Comedian Charlie Murphy Dead at 57 After Leukemia Battle … via,4
US comedian Charlie Murphy dies of Leukemia at 57,4
#famousdex pays respect to #CharlieMurphy #RipCharlieMurphy #Leukemia #EddieMurphy,4
See? Being funny is dangerous. This time by mutating the deadly cell causing leukemia. Be serious! …,4
He died from leukemia,4
Comedian Charlie Murphy Dead at 57 After Leukemia Battle | … #RIP,4
Leukemia isn't something to joke about. Very serious stuff. Unfortunate that Charlie Murphy had to suffer with that.,4
R.I.P. Charlie Murphy has lost his battle to leukemia at the age of 57. Sending condolences to…,4
"""This cat could ball"" - Comedian Charlie Murphy Dead at 57 After Leukemia Battle … via",4
"Folks dont know that Leukemia is a form of cancer. Folks saying RIP Charlie Murphy and #Fcancer, and others are commenting ""he had Leukemia""",4
#BREAKING Comedian Charlie Murphy Dead at 57 After Leukemia Battle by #FOX2now via,4
"Rise in Power King, #CharlieMurphy DEAD AT 57 AFTER LEUKEMIA BATTLE. Charles Quinton Murphy…",4
Comedian Charlie Murphy Dead at 57 After Leukemia Battle,4
He died from leukemia according to his manager.,4
Comedian Charlie Murphy Dead at 57 After Leukemia Battle …,4
Dang did not know Charlie Murphy had Leukemia,4
Charlie Murphy Loses Battle Against Leukemia,4
"Hearing Charlie Murphy had leukemia really sucks, lost a friend to that shit a year ago.",4
Comedian Charlie Murphy dies following leukemia battle … he was just always cool,4
idk how it never got out that he had leukemia.,4
Comedian Charlie Murphy Dead at 57 After Leukemia Battle … via,4
"I didn't even know Charlie Murphy had leukemia, now he's dead.",4
#BREAKING Comedian Charlie Murphy Dead at 57 After Leukemia Battle by #19_johnjohn via,4
Comedian Charlie Murphy Dies From Battle With Leukemia,4
Comedian Charlie Murphy Dead at 57 After Leukemia Battle | TMZ Chatter …,4
Comedian Charlie Murphy Dead at 57 After Leukemia Battle | TMZ Chatter …,4
Comedian Charlie Murphy Dead at 57 After Leukemia Battle | TMZ Chatter …,4
Never knew leukemia had 2 e's,4
You late bro he died this morning of leukemia,4
Comedian Charlie Murphy Dead at 57 After Leukemia Battle,4
Rest In Peace Comedian Charlie Murphy 57 has passed after a lengthy bout with leukemia ..,4
Comedian Charlie Murphy Dead at Age 57 From Leukemia … via,4
Charlie Murphy DIES At 57 - Secretly Had Leukemia (Pics) - …,4
Comedian Charlie Murphy Dead at 57 After Leukemia Battle … via One of the greatest stories ever told. RIP Sweet.,4
Comedian Charlie Murphy dies following leukemia battle by #digjazz via,4
What saddens me the most is how this resonates with my mother who's also battling Leukemia and is 53 …,4
Charlie Murphy Dies At 57 After Leukemia Battle,4
Comedian Charlie Murphy Dead at 57 After Leukemia Battle … via,4
Charlie Murphy kept his battle with leukemia extremely private.,4
Comedian Charlie Murphy Dead at 57 After Leukemia Battle via …,4
Comedian Charlie Murphy Dead at 57 After Leukemia Battle | TMZ Chatter …,4
Comedian Charlie Murphy Dead at 57 After Leukemia Battle … via,4
Comedian Charlie Murphy dies following leukemia battle by #CNN via,4
Charlie Murphy Reportedly Dead At 57 After Battle With Leukemia,4
He died from leukemia according to his manager.,4
Fuck you leukemia,4
The comic made famous by The Chapelle Show lost his battle with Leukemia Wednesday.,4
Comedian Charlie Murphy dies at 57 following battle with leukemia … via,4
Comedian Charlie Murphy Dead at 57 After Leukemia Battle via …,4
Comedian Charlie Murphy dies at 57 following battle with leukemia … via,4
Comedian Charlie Murphy dies following leukemia battle …,4
Comedian #CharlieMurphy has passed away at the age of 57 after a long battle with leukemia.…,4
BREAKING: Comedian Charlie Murphy Dead At 57 After Battle With Leukemia ...,4
I had no idea he had leukemia. He helped pave the way for many more black comedians. I pray he rest in peace and his family is comforted.,4
BREAKING: Comedian Charlie Murphy Dead At 57 After Battle With Leukemia ...,4
Comedian Charlie Murphy Dead at 57 After Leukemia Battle …,4
Comedian Charlie Murphy Dead at 57 After Leukemia Battle,4
Comedian Charlie Murphy Dies From Battle With Leukemia,4
Charlie Muphy Dead at 57 from Leukemia …,4
Damn.. Charlie Murphy died of Leukemia. He helped create some of the most iconic moments from The Chappelle Show. Thanks for the laughs..,4
BREAKING: Comedian Charlie Murphy Dead At 57 After Battle With Leukemia ...,4
BREAKING: Comedian Charlie Murphy Dead At 57 After Battle With Leukemia,4
I liked a video Charlie Muphy Dead at 57 from Leukemia,4
"Comedian, actor Charlie Murphy dies at age 57 after battling leukemia …",4
Comedian Charlie Murphy dies at 57 following battle with leukemia … via,4
"Eddie Murphy’s Brother, Charlie Murphy dead at 57 after battle with leukemia …pic.twitter.com/rYkTXVe9dR",4
"Comedian #CharlieMurphy, Eddie Murphy’s Brother, dies at 57 After #Leukemia Battle #RIP",4
May he R.I.P - Comedian Charlie Murphy Dead at 57 After Leukemia Battle …,4
"RIP Charlie Murphy, wow way to young #charliemurphy #Leukemia pic.twitter.com/KqCziFvZej",4
"Eddie Murphy’s Brother, Charlie Murphy dead at 57 after battle with leukemia - … Mur...pic.twitter.com/f1mTUJsYg2",4
R.I.P: Charlie Murphy Dead At 57 After Leukemia Battle! | New Video … #WSHH via,4
Many people didn't know that Charlie Murphy was a U.S. Navy Veteran. He recently lost his battle with Leukemia at...,4
BREAKING: Comedian Charlie Murphy Dead At 57 After Battle With Leukemia,4
#BREAKING: Comedian Charlie Murphy dies after battle with Leukemia … #CharlieMurphypic.twitter.com/chTCb6DqAS,4
Damn RIP Charlie Murphy. Didn't even know he was battling leukemia. Hope he's resting well and having some pancakes with Prince,4
BREAKING: Comedian Charlie Murphy Dead At 57 After Battle With Leukemia,4
"Charlie Murphy Dies of Leukemia, 57: via",4
Didn't know he had Leukemia. RIP.,4
Comedian Charlie Murphy Dead at 57 After Leukemia Battle,4
R.I.P. Charlie Murphy #charliemurphy #rip #restinpeace #leukemia #davechappelleshow #eddiemurphybrother #comedypic.twitter.com/2MKR90yWeB,4
Comedy legend Charlie Murphy has passed away after battling Leukemia pic.twitter.com/alMsossJ7O,4
Charlie Murphy Dead at 57 After Battle With Leukemia,4
Comedian Charlie Murphy dies following leukemia battle by #CNN via,4
Comedian Charlie Murphy dies following leukemia battle by #CNN via,4
Comedian Charlie Murphy Dead at 57 After Leukemia Battle … #RIP #ComedyLegend,4
Comedian Charlie Murphy Dead at 57 After Leukemia Battle,4
Very sad news. Charlie Murphy passed away today. A battle with leukemia. We always had such a great time with him. So sad. RIP.,4
Comedian Charlie Murphy Dead at 57 After Leukemia Battle,4
Comedian Charlie Murphy Dead at 57 After Leukemia Battle …pic.twitter.com/j3csjoK2Xf,4
