tweet_text,month_of_tweet
Beauty queen fights breast cancer among Anambra women pic.twitter.com/kojMk4Fy0u,9
Donation for CANCER Charity. Very small thing we can do for people who battling every single…,9
I hate childhood cancer...it sucks!!! #30GoldenDaysChildCancerCampaign…,9
Run For A Cure Breast Cancer Awareness Annual 5k Run/Walk is at 6:30 am on 30th September 2017…,9
We did it cut our Hair 30cm. It will be donated to Cancer Charity. @ Narybu Hair & Beauty…,9
It's double jeopardy for patients with #cancer. Many can't afford treatment. But the few who can…,9
"This is CHILDHOOD CANCER...unexplained fever that persists, lumps on some parts of the body,…",9
THIS IS HOW BREASTFEEDING PREVENTS CANCERS! (One Minute Health - Episode 10) . TAG SOMEONE TO…,9
Inner Wheel to increase awareness on breast cancer,9
"""When we let sleeping dogs lie, we give room for societal cancers to take space and fallow."" -…",9
Sad Story Of How Nigerian Couple Died Of Cancer In UK Cancer Leaving 5 Sons Orphaned #Naijapals #Gistmaniapic.twitter.com/GrKy0Ps9LS,9
Sad Story Of How Nigerian Couple Died Of Cancer In UK Cancer Leaving 5 Sons Orphaned #Naijapals #Gistmaniapic.twitter.com/7TVG0TQipd,9
Sad Story Of How Nigerian Couple Died Of Cancer In UK Cancer Leaving 5 Sons Orphaned #Naijapals #Gistmaniapic.twitter.com/bJ6gXh2Kff,9
"FYI: ‘I Cut Off One Of My Bosom s To Survive’ – Ondo Governor's Wife, Betty Recounts Battle With Cancer #Naijapals #Gistmaniapic.twitter.com/MtW7hQdjSU",11
"Diabetes is equally dangerous as HIV/AIDS, Cancer, Hypertension, etc. Prevention is better than…",11
Free Hen Foundation Cancer Screening Report. Click on Nigeria top Newspaper…,11
"#ICYMI: ‘I Cut Off One Of My Bosom s To Survive’ – Ondo Governor's Wife, Betty Recounts Battle With Cancer #Naijapals #Gistmaniapic.twitter.com/WLiIzivE3S",11
"‘I Cut Off One Of My Bosom s To Survive’ – Ondo Governor's Wife, Betty Recounts Battle With Cancer #Naijapals #Gistmaniapic.twitter.com/2PncUzpCSt",11
"There's no cancer for the new creation Christian, if you kneel before God, everything prostrates to you. …",11
"Our Breast massage oil for firmness, fuller breast which also prevents cancer. Kindly Follow…",11
I chose to remove my breast to survive cancer –Akeredolu pic.twitter.com/ZZyOIzyHSF,11
I chose to remove my breast to survive cancer –Akeredolu pic.twitter.com/e1ZAM0nk1m,11
Through the valley of death: Hidden scars of breast cancer survivors pic.twitter.com/8MrRzQQvco,11
Cervical Cancer Cases To Hit 15m By 2020 –Expert via,11
Cervical cancer cases hit 15m by 2020 – expert via,11
Cervical cancer cases hit 15m by 2020 – expert pic.twitter.com/qbMBsH1W1F,11
We did it #saharatrip #saharadesert #morocco #dunes #cancer… …,11
"Lagos govt seeks private sector partnership in cancer, HIV/AIDS awareness via",11
"Lagos govt seeks private sector partnership in cancer, HIV/AIDS awareness pic.twitter.com/rIBkH439PL",11
Natural Cancer Treatments (II) via,11
Cervical cancer cases hit 15m by 2020 – expert via,11
Cervical cancer cases hit 15m by 2020 – expert pic.twitter.com/c8LtamWYb1,11
I’m Finally Back On My Feet After Fighting Skin Cancer – Banky W pic.twitter.com/09jtGc48LQ,11
I’m Finally Back On My Feet After Fighting Skin Cancer – Banky W pic.twitter.com/jQ2n4KU2EB,11
Post-Surgical Scar on the back of after a 3rd episode of skin cancer. Thank God for…,11
Banky W survives skin cancer surgery pic.twitter.com/rPG4Md2Ly1,11
"Lagos govt seeks private sector partnership in cancer, HIV/AIDS awareness via",11
"Lagos govt seeks private sector partnership in cancer, HIV/AIDS awareness pic.twitter.com/1IfHlbjS50",11
How I survived skin cancer tumour surgery — Banky W pic.twitter.com/FqhlJwx2Pt,11
How I survived skin cancer tumour surgery — Banky W pic.twitter.com/lXEL6bZEPM,11
FYI: Banky W Reveals That He Is Suffering From A Very Rare Cancer Of The Skin - Share His Surgery Photos #Naijapals #Gistmaniapic.twitter.com/pxuXpAw015,11
Skin Cancer Surgery: Banky W Narrates Ordeal via,11
‘Nurses are critical to cancer care in Nigeria’,11
‘Nurses are critical to cancer care in Nigeria’ pic.twitter.com/lKeXpt3gbY,11
Banky W survives skin cancer surgery pic.twitter.com/Gz97tMZzCH,11
Banky W survives skin cancer surgery pic.twitter.com/cHipJRBXLC,11
‘Nurses are critical to cancer care in Nigeria’ pic.twitter.com/UtdhypmSU3,11
‘Nurses are critical to cancer care in Nigeria’ pic.twitter.com/v8xKpO1SdA,11
‘Nurses are critical to cancer care in Nigeria’ pic.twitter.com/hOlsDTFdhm,11
Banky W survives skin cancer surgery pic.twitter.com/IenZILwRsM,11
"RnB singer, Banky W reveals how he survived skin cancer tumour surgery …",11
#ICYMI: Banky W Reveals That He Is Suffering From A Very Rare Cancer Of The Skin - Share His Surgery Photos #Naijapals #Gistmaniapic.twitter.com/hzAnWuIuU4,11
Photos: Banky W Shows off Scars as he Chronicles His Inspiration Fight Against Cancer via,11
Photos: Banky W Shows off Scars as he Chronicles His Inspiration Fight Against Cancer via,11
Banky W Reveals That He Is Suffering From A Very Rare Cancer Of The Skin - Share His Surgery Photos #Naijapals #Gistmaniapic.twitter.com/DXiz2j6w9f,11
"Legendary Film And Televison Star Sadiq Daba Needs $25,000 For Leukaemia And Prostate Cancer…",11
"TOTAL, NNPC support BRICON Foundation on cancer diagnosis and treatment pic.twitter.com/3NrfCDDN56",11
breast cancer awareness. #sketch #nakedbody #nakedboobs #nudeboobs… …,11
REPOST Partners commit to raise N3.6m to support cancer patients pic.twitter.com/wRwDwtmboR,11
"Prostate Cancer: Veteran, Sadiq Daba Cries out- “I don’t want to be Castrated” via",11
Partners commit to raise N3.6m to support cancer patients pic.twitter.com/OrwI0fV5PH,11
"WHO twisted research to suggest coffee, cell phones cause cancer –Report pic.twitter.com/hBe5nZB7Gy",11
"WHO twisted research to suggest coffee, cell phones cause cancer –Report pic.twitter.com/bScRz3SPpk",11
Pretty Lady shares bare-chested photos to celebrate last cancer treatment via,11
Pretty Lady shares bare-chested photos to celebrate last cancer treatment via,11
Bobrisky Denies Being Gay After Death Of Arduad Who Died Of Anal Cancer via,11
FYI: AMAZING! 24yrs Old Pretty Cancer Survivor Shares Story Of Her Battle And Victory With… #Naijapals #Gistmaniapic.twitter.com/qwQLFVF23z,11
#ICYMI: AMAZING! 24yrs Old Pretty Cancer Survivor Shares Story Of Her Battle And Victory With… #Naijapals #Gistmaniapic.twitter.com/EXaZq9CChF,11
AMAZING! 24yrs Old Pretty Cancer Survivor Shares Story Of Her Battle And Victory With Pictures #Naijapals #Gistmaniapic.twitter.com/87NDcXtNIo,11
"Can't believe it's been a week since I had the opportunity to sing at the ""World Breast Cancer…",11
Pink October Vibe Breast Cancer Awareness month! . . . #potd #pinkoctober #agameoftones #pink…,10
detected and treated a lady with Stage 0(pre cancer stage) cervical…,10
"Save Nigerians from cancer, Dolapo Osinbajo tasks doctors pic.twitter.com/mIND1xsgZ6",10
Congolese Gay Man Dies Of Anal Cancer via,10
FYI: Popular Gay Man Paul Arduad Is Reportedly Dead After A Long battle With Anal Cancer (See… #Naijapals #Gistmaniapic.twitter.com/eXzGQsiu2U,10
#ICYMI: Popular Gay Man Paul Arduad Is Reportedly Dead After A Long battle With Anal Cancer… #Naijapals #Gistmaniapic.twitter.com/DDCZkprUJT,10
"Congolese gay man Paul Arduad, reportedly dies of anal cancer. ____ Paul Arduad, a very…",10
"Popular Gay man, Paul Arduad allegedly dies of Anal Cancer via",10
Popular Gay Man Paul Arduad Is Reportedly Dead After A Long battle With Anal Cancer (See… #Naijapals #Gistmaniapic.twitter.com/cjzoeVJkmj,10
Walker city against cancer #aecc #aeccenmarcha #valladolid #megustapucela #instadolid…,10
Valladolid Against Cancer #aecc #valladolid #megustapucela #instadolid #instadaily #igerspucela…,10
Valladolid Against Cancer #aecc #valladolid #megustapucela #solidaridad #solidarity #strive…,10
Breast cancer: Exercise gives longevity – survivors via,10
Breast cancer: Exercise gives longevity – survivors,10
Researchers Don’t Need to Swing for the Fences in Stand Up to Cancer’s World Series PSA pic.twitter.com/8cMnC4ALtm,10
"Breast cancer: Exercise gives longevity, says Survivors",10
Breast cancer: Exercise gives longevity – survivors via,10
Breast cancer: Exercise gives longevity – survivors,10
BREAST CANCER AWARENESSBetter late than Never. This is my little contribution to…,10
SLIDE-BACK SATURDAY. deloittenigeria Breast Cancer Awareness Walk with in…,10
‘Eating eggs reduce your risk of breast cancer by 44 per cent’ pic.twitter.com/6kyADmkBiD,10
"We thank God for one who has rescued herself, her beauty, and her health from Bleaching and Skin Cancer. I hope… pic.twitter.com/WfK6NGn18b",10
CAN THE COSMETIC PRODUCTS LADIES USE FOR MAKEUP CAUSE CANCER? (One Minute Health - Episode…,10
GastroIntestinal Cancers remain the most difficult to treat and are usually discovered late.…,10
‘Eating eggs reduce your risk of breast cancer by 44 per cent’ pic.twitter.com/Mz8GdGH2WX,10
"Happening live tomorrow at the Park, it's the WajoLagos Dance Special Event ""Dance For Cancer…",10
That time #WomanCrush painted her bananas pink to create awareness for Breast Cancer. With the…,10
"from - ""Breast Cancer Awareness Giveaway. I am awaiting more…",10
"Red meat increasing cancer risk, doctor warns pic.twitter.com/eUNTM4kf95",10
"Red meat increasing cancer risk, doctor warns pic.twitter.com/Hn2WhwaNDE",10
"Red meat increasing cancer risk, doctor warns pic.twitter.com/a29zAyZkH9",10
"Red meat increasing cancer risk, doctor warns pic.twitter.com/fHeToafAod",10
Breast Cancer Awareness: Studies suggest that exercise reduces both breast cancer risk and the…,10
Stay woke! . New editorial for Poke Africa Magazine (pokeafrica ) in honour of Cancer…,10
Don’t Take Breast Cancer for Granted pic.twitter.com/6r7TMcR85z,10
Don’t Take Breast Cancer for Granted pic.twitter.com/S0hB6fVFNU,10
Don’t Take Breast Cancer for Granted pic.twitter.com/0fkBYgPnDh,10
Don’t Take Breast Cancer for Granted pic.twitter.com/CVH88gcfh5,10
Yesterday evening I was on discussing breast cancer. Thanks… …,10
"250,000 Nigerian women die of cancer annually – Zainab Bagudu",10
"250,000 Nigerian women die of cancer annually – Zainab Bagudu via",10
"250,000 Nigerian women die of cancer annually – Zainab Bagudu via",10
"250,000 Nigerian women die of cancer annually – Zainab Bagudu",10
Buhari is a tyrant and cancer that must be cut down – FFK via,10
Lady dies of alcohol poisoning after surviving cancer via,10
"Because its cancer awareness month and pink is the color... please make sure you get tested,…",10
Nigeria's notable #cancer advocate and his team also…,10
Happening right now Medic Aid Foundation Walk Against Cancer Early Detection Saves…,10
"Woman survives Cancer, dies after drinking all day pic.twitter.com/qJtmLQ81Cx",10
Ondo set to build cancer treatment centre,10
New study reveals #breast #cancer cells recycle their own ammonia waste as fuel:…,10
Femi Fani-Kayode: Buhari is a cancer that keeps growing; he must be cut out via,10
Ondo set to build cancer treatment centre,10
Ondo set to build cancer treatment centre #AkwaIbom,10
Ondo set to build cancer treatment centre,10
"Woman survives Cancer, dies after drinking all day pic.twitter.com/R64DD5Uo3L",10
#breastcancerawarenessmonth Cancer Sucks! But I'm so proud of all the women who wake up every…,10
#Alert from waffeventz - It's time we gave awareness on this deadly disease called #CANCER.…,10
Breast cancer warriors are an inspiration to all of us and a wonderful example of courage and…,10
"TOMORROW, we Walk and Kick Away Cancer with the Medicaid Cancer Foundation. Tell a…",10
October is Cancer Awareness month. Have you checked yourself today? Early detection is key…,10
"FYI: Ouch! Popular Cancer Patient, Sarah Loses Battle To Cancer - Died Yesterday (Photos) #Naijapals #Gistmaniapic.twitter.com/h4inU3Kqin",10
Málaga town hall pink for breast cancer awareness #bracawareness #breastcancer…,10
Pink has always been present in our lives. Today is pink as it's Breast Cancer Awareness Month.…,10
"Cancer kills over 72,000 Nigerians yearly – Health Minister, Adewole pic.twitter.com/3TfUu48SCW",10
"Do you know someone giving CANCER a TOUGH TIME? At The DreamHome Shop, We celebrate Bravery…",10
"#ICYMI: Ouch! Popular Cancer Patient, Sarah Loses Battle To Cancer - Died Yesterday (Photos) #Naijapals #Gistmaniapic.twitter.com/qEUehlHLDv",10
"19 / Oct / 2017 *International Day Against Cancer: ""Any force that is within the interior can…",10
"Ambode urges women to seek early diagnosis, treatment for cancer pic.twitter.com/q4D82TAEof",10
International day of breast cancer #pink #punk #pop Works glamour.es photo styling…,10
"Cancer kills over 72,000 Nigerians yearly – Health Minister, Adewole pic.twitter.com/GfGo2W6FvD",10
"Ouch! Popular Cancer Patient, Sarah Loses Battle To Cancer - Died Yesterday (Photos) #Naijapals #Gistmaniapic.twitter.com/upVztD1BpZ",10
"72,000 Nigerians die of cancer annually —FG pic.twitter.com/wJD8fXbQcs",10
Study Links Liver Cancer To Herbal Remedies pic.twitter.com/lNxTWcyP1D,10
Study Links Liver Cancer To Herbal Remedies pic.twitter.com/zCAFwTVGMF,10
FG to establish cancer wards in federal tertiary institutions pic.twitter.com/gcXAn3sCiU,10
FG to establish cancer wards in federal tertiary institutions pic.twitter.com/CWxHsXnOrs,10
#Breast #Cervical #CANCER Awareness Ride #FBi (Female Bikers Initiative) 2017 #GINITV…,10
"I've got tumor its like cancer @ Lagos, Nigeria",10
Ongoing #film project Love & Cancer #themovie Directed by realsobe #actorslife…,10
Sick and fresh like cancer. en Palacio Vistalegre,10
Madrid recycling containers do Breast Cancer Awareness Month.… …,10
Fighting against Brest Cancer. Early diagnostic and new medical treatments. Proudly representing…,10
Kerry not only changed his physical appearance but he did so battling cancer. A truly remarkable…,10
One of the lucky dip winners during the just concluded PH City Breast Cancer Awareness Walk…,10
A dip in the pool for cancer??? Go pink! It's the month of October and it's tagged breast cancer…,10
#Repost (get_repost) ・・・ I believe in victory over cancer .. Early detection…,10
Unity Bank supports breast cancer campaign,10
"This really got me in awe of God's power. As a medical doctor, I know how debilitating cancers…",10
Living with cancer is not death sentence,10
"Shared by Breast Cancer is the most common cancer in women worldwide, with…",10
Its another one #newproject #newmoviealert Love&Cancer #themovie #actor #actorslife…,10
"Issa #newproject #alert #love&cancer #themovie #actor #actorslife #october to remember @ VGC, Lekki",10
October is Breast Cancer Awareness month. I rep and they have a clinic in LUTH. It's…,10
Aiite! Let's Do it for cancer #freethenipple… …,10
#Repost (get_repost) ・・・ #PinkOctober breast cancer awareness at iMovo #Pink…,10
"SHM! Actress, Christina Applegate Removes Her Bosom, Ovaries & Fallopian Tubes To Avoid Cancer #Naijapals #Gistmaniapic.twitter.com/tBhc8JcJOc",10
"If #NoBraDay was REALLY about breast cancer awareness, every IG post would have a pic like this,…",10
I strongly support the fight against breast cancer in our society @ Yusuf Maitama Sule…,10
Breast Cancer awareness month. #PinkOctober #GetScreened Early detection saves lives. KO breast…,10
Kebbi’s First Lady’s Foundation treats 600 cancer patients pic.twitter.com/PJW5KX6o2F,10
Still on breast cancer awareness!!! 1 in 8 women are diagnosed with breast cancer. Create…,10
Lack of funding frustrating research on cancer –Hussaini pic.twitter.com/LgvSc89ITu,10
Lack of funding frustrating research on cancer –Hussaini pic.twitter.com/bI8zfCYo0C,10
"Rise and Grind!!! It's the month of October, breast cancer awareness month. Let's do it…",10
"It's the month of October, breast cancer awareness month. Let's do it for the women in our…",10
"October is the month of Breast Cancer Awareness, a month where we all need to stay positive and…",10
#browlutionbrows created by the genius #Repost artistrybyzee ・・・ BREAST CANCER AWARENESS MONTH…,10
Be part of the Campaign awarness to reduce CANCER... societal_healthcare_org @ Command Guest Inn,10
"And I ask again... What if two days after your wedding, your partner is diagnosed with cancer?…",10
Breast Cancer. Early Detection saves Lives. @ Magodo Phase 2,10
The Medicaid Cancer Foundation presents 'The Fight' A stage play on Cancer awareness with…,10
Wow! So good a thing....Big ups for the awareness on breast cancer.......,10
!! Cancer survivor goes topless (PICs),10
Cancer: US breast cancer deaths drop; rate among white women falls most,10
Prevent breast cancer & other types of cancer today. Drink Splina Liquid Chlorophyll. #NoBraDaypic.twitter.com/NnD4MzVlGw,10
"Chelsea player, Willian loses mother to cancer",10
"Placing money inside brassiere can cause breast cancer, expert warns women",10
It's all about Eve : An art exhibition and auction for breast cancer,10
Aisha speaks about #NoBraDay in support of breast cancer awareness and how seemingly silly…,10
'Breast Cancer' just started trending with 65971 tweets. More trends at … #trndnl,10
"Experts Warn Women Against Putting Money In Bra, Can Cause Bosom Cancer pic.twitter.com/E98u5PMIjp",10
Placing money inside brassiere can cause breast cancer – Expert warns women,10
Willian: Chelsea midfielder loses mum to cancer,10
Putting money in brassiere causes breast cancer : expert,10
"Cancer: Money inside bra can cause breast cancer, expert warns women",10
"#NoBraDay is not an open day for sharing nude photos. The purpose is to raise awareness about breast cancer.""",10
Breast cancer awareness....... set em tatas free! . • • #ghananiephotography #accra #nikon…,10
""" To all our mothers, friends, sisters we have lost to Cancer """,10
'Cancer' just started trending with 273962 tweets. More trends at … #trndnl,10
Group urges support for cancer patients,10
it's a day for creating awareness on breast cancer,10
Reduces cancer risks with antioxidant protection.,10
"It’s chest Cancer Awareness Month, Here Are 10 Mind blowing b00b Facts",10
Friends with good hearts hillary_sarah 2016 Run For A Cure Africa - Ghana Breast Cancer…,10
"Causes Of Breast Cancer: How Did This Happen? When you’re told that you have breast cancer,…",10
"Sign Up for the Truppr 5KM #PinkOctober Run to Raise Awareness for Breast Cancer | Saturday, October 22nd",10
ENTER TO #WIN A PLUSH KIDS TOYS—YOUR PERCEPTIONS ARE MORE IMPRESSIONISTIC TODAY THAN PRECISE MORE FOR CANCER—#NOWPLAYING ON THE LINK TO THE,10
"Because It’s Breast Cancer Awareness Month, Here Are 6 Mind blowing Boob Facts",10
Reps call for National action plan on cancer,10
"Because It’s Breast Cancer Awareness Month, Here Are 6 Mind blowing Boob Facts",10
Truppr Raises Awareness For Breast Cancer With #PinkOctober Run,10
"'100,000 New Cases of Cancer Yearly in Nigeria'",10
Breakthrough cancer drug would clear tumours,10
"2016 Run For A Cure Africa - Ghana Breast Cancer Awareness Event For 5 years running, we have…",10
"2016 Run For A Cure Africa - Ghana Breast Cancer Awareness Event For 5 years running, we have…",10
What Is Breast Cancer? Breast cancer is a disease in which malignant (cancer) cells form in the…,10
Wizkid Loses In-Law After Battling Cancer In The US,10
Breast Cancer Month Activities and dpr #cancertalk to staff members #lcc…,10
Wizkid loses inlaw to cancer,10
"2016 Run For A Cure Africa - Ghana Breast Cancer Awareness Event For 5 years running, we have…",10
"Breast cancer is the second leading cause of cancer death among women. For 5 years running, we…",10
"Oh NO!! Wizkid's Elder Sister, Yetunde Awoniyi Just Lost Her Husband To Deadly Cancer pic.twitter.com/Axqme4ICdr",10
Tributes pour in for Wizkid’s In-law who died of cancer,10
NET Exclusive: Wizkid’s in-law dies of cancer in US,10
"""There is life after cancer diagnosis"" Nigerian woman marks 10 years of being a breast cancer survivor",10
"According to the WHO, in Nigeria, about 10,000 cancer deaths are recorded annually while 250,000…",10
Thanks to for supporting the Fight against Cancer. Bili Sule receives…,10
"""No Woman should fight Breast Cancer alone, hence, I lend my support to all women battling with…",10
"signing her SIGNATURE against #cancer at the Pink October Walk, Race & Cycle…",10
"The alarm over cancer, other NCDs",10
#rp with ・・・ Breast Cancer Awareness Program is supported by Ivy…,10
"Establish More Cancer Centres, Abdusalami Tells FG",10
Holla pink October Walk against Cancer!!!We finally join the movement!!! @ Federal Capital…,10
More than two million Nigerians have cancer – AMLSN,10
More than two million Nigerians have cancer,10
Hello Saturday!!!October Walk against Cancer!!!Project Pink Blue!!!LAGOS!!!Younger people…,10
Paris Jackson spends time with her cancer stricken mum,10
"#supportadmirehonor Breast Cancer Awareness @ Welfare Quarters Makurdi, Benue State",10
#TMSnapChatChronicles of today's Breast Cancer Awareness Run For A Cure #ThinkMahoganySnaps…,10
Repost hillary_sarah Happening live! Cancer sucks!! Run for cure Africa- Ghana Foundation. A…,10
Paris Jackson shares heartwarming photo with Cancer-stricken mum Debbie Rowe,10
Prayers that she will feel better and the horrid cancer will be totally eradicated from her body....,10
"KARATE AGAINST CANCER For the FIRST TIME in Nigeria. Join Us. Pink October Walk, Race &…",10
"Join me Debbie Collins to Walk, Race & Cycle against cancer…",10
"Embattled Kannywood actress puts her troubles aside, participates in Cancer awareness week activities",10
"Silence is deadly! Ignorance is bad! Don't miss the 'Cervical Cancer Awareness', an important…",10
"People don’t expect men to get breast cancer, but about 2,100 men are diagnosed with it each…",10
"Let's join the world and STAND UP FOR CANCER,,KICK OF HOPE,,ERADICATE CANCER,,WALK FOR…",10
Nigeria to Establish Agency for Cancer Control,10
"It's like there's cancer in my blood, It's like there's water in my… …",10
See the Youngest Girl Ever Diagnosed With chest Cancer,10
"Ogun First Lady, Funsho Amosun, Hosts Nollywood Stars To The Biggest Cancer Rally - Photos pic.twitter.com/0JKc6SRa6W",10
Nollywood Stars Join Ogun State First Family For Think Pink Cancer Project,10
FG to establish national agency for cancer control,10
FG to establish national agency for cancer control,10
Nigeria to establish agency for cancer control,10
5% of breast cancer cases occur in men – Expert,10
"Agents are ‘cancer’ of football – Napoli owner, Aurelio De Laurentiis",10
"Cancer: 5% of breast cancer cases occur in men, says Expert",10
Make out time to be part of #DCCFGoldchallenge2016 and help children who are battling cancer.…,10
"NOW AVAILABLE: PANDORA have teamed up with the 'Sandra Ibarra Foundation: Let's fight Cancer',…",10
"Join me Esther Audu to Walk, Race & Cycle against #cancer #pinkoctober2016 Date:…",10
WHO warns of new cancer cases,10
"5% Of chest Cancer Cases Occur In Men, Says Expert",10
Aisha Buhari's Future Assured partners with Medicaid Cancer Foundation in Kebbi State,10
Earlier Today! Cancer Awareness Walk With The First Lady Of Ogun State Mrs Olufunsho Amos…,10
American actor Ben Stiller reveals prostate cancer diagnosis,10
"What is Breast Cancer Awareness Month? October is Breast Cancer Awareness Month, a worldwide…",10
Mom With No Chill Shaves Daughter’s Hair After She Bullied Cancer Patient In School (Photo/Video),10
"With SHAKE OFF Phyto Fiber, chances of coprostasis and or colon cancer are reduced to the barest minimum.",10
The good bacteria in SHAKE OFF Phyto Fiber can help eliminate and prevent coprostasis & colon cancer.,10
"As colon cancer is predicted to overtake heart diseases as the No. 1 killer in the 21st Century,...",10
"Obesity leads to major health risks including diabetes, certain cancers, and cardio-vascular diseases.",10
I have received my registration pack for this Saturday's Breast Cancer Awareness and Support…,10
"SERIOUSLY?! ""Drinking Fresh Cow Urine Can Cure All Disease Including Cancer?"" (Photos) pic.twitter.com/CQBJkpjKSi",10
"Kebbi state stand up for a moment of truth, and be a part of history, it's the #kebbi cancer…",10
"Kebbi state stand up for a moment of truth, and be a part of history, it's the #kebbi cancer…",10
"Kebbi state stand up for a moment of truth, and be a part of history, it's the #kebbi cancer…",10
"Kebbi state stand up for a moment of truth, and be a part of history, it's the #kebbi cancer…",10
The Story of Comfort Oyayi Daniel 6: She is STRONG & WINNING....CANCER For being with…,10
"""Cancer can take away all my physical abilities. It CANNOT touch my MIND, it CANNOT touch my…",10
"“I heard ‘Cancer’ and ‘Chemo,’ and I just kind of went into shock,” cancer patient Lindsay…",10
The Story of Comfort Oyayi Daniel 6: She is STRONG & WINNING....CANCER For being with…,10
Heartbreaking: Dad fights Cancer for three weeks to welcome son [Video/Photos],10
"Corruption is a cancer, which must be fought. - President #NigeriaAt56",10
Ex-Sky Sports Presenter Divorcing Cancer-Stricken Wife After She Cheating On Her,10
ALSO MY—KEEPING THINGS SIMPLE IS AN UPHILL BATTLE NOW AS YOUR MIND IS MORE IMPOANT THAN EVER WHILE MORE FOR CANCER—THE WAY YOUR—WHEN WOMEN,9
Fatto!!! Hecho!!! #drluiscampos #principessaclinic #sharingthoughts #breas #cancer…,9
Growth in life is generally planned or worked at. Not accidental. Accidental growth is cancer.…,9
We are taking part in the biggest coffee morning in aid Macmillan Cancer #charity…,9
Shoprite: Promoting CSR through breast cancer awareness,9
There are more than 100 types of cancers; any part of the body can be affected .About 70% of all…,9
