tweet_text,month_of_tweet"Kiss the Pig benefits the Leukemia and Lymphoma Society. Every 3 minutes, someone in the United…",4
"My older brother, Denny, succumbed to leukemia one day before his 9th birthday. He was the 8th…",4
Raising money for The Leukemia and Lymphoma Society. Come and join us. @ The Casual Pint -…,4
Please help me in my journey to rise money to help researchers find a cure for #leukemia…,4
Te..te...te...Terry and the #Mets. #WelcomeHomeDinner #charity #Awareness #Leukemia #Lymphona…,4
"""Leukemia & Lymphoma Society FUNdraising Event! #paintpartymiami #paintpartystudio…",4
"""Leukemia & Lymphoma Society FUNdraising Event""! #paintpartymiami #paintpartystudio…",4
#studying #leukemia on a Friday night. #nursingschool @ Crouse Hospital School of Nursing,4
Amazing #RunwayHouston benefiting the #Leukemia&lymphomasociety and #houstonchildrengiveback .…,4
Texas Men of Excellence's 3rd annual Lights out for Leukemia Gala… …,4
Support my Bro seanhieter to be the Man of the Year for the Leukemia Lymphoma Society as he…,4
"With 12-year-old Boy of the Year, Connor Pavlista, getting ready to kick off the Leukemia…",4
We're all winners when we band together to beat lymphoma and leukemia. (But this risedtwndurham…,4
"With Todd Zavorskas, 2016 Leukemia & Lymphoma Society Man of the Year Candidate. To donate or…",4
#TBT in lieu of today's Runway Houston event benefiting the Leukemia and Lymphoma Society and…,4
Thank you to everyone that attended our philanthropy event tonight for Leukemia and Lymphoma…,4
at Midtown Comics Times Square for The Leukemia & Lymphoma Society CT…,4
Brotherly Love: Leukemia Patient's Wish Is Granted After Meeting Ukee Washington,4
Stuntman Stu in remission less than two months after leukemia diagnosis,4
Stu Schwartz's leukemia in remission ottnews StuStrong …,4
Stuntman Stu in remission less than two months after leukemia diagnosis ottnews,4
MISD Teacher Shares His Battle with Leukemia,4
4/4/16 Sound Tigers The Leukemia & Lymphoma Society CT Westchester Chapter Team Zombie Leader…,4
He's excited to take a selfie; I'm excited to help him beat Leukemia. Please join me in…,4
It's our Leukemia and Lymphoma society fundraiser at Mimi's Cafe. So far we've raised $170!,4
"Presenting my research on feline leukemia virus at the Undergraduate Symposium, check",4
The silent auction for Leukemia & Lymphoma Society @ Hops & Fire Craft Tap House,4
Let's get this started! Tonight was the kick-off to the Leukemia &… …,4
Another fabulous fundraiser for Leukemia and Lymphoma Society Man of… …,3
Hops and Fire hosting Beer & Bourbon Dinner tonight for the Leukemia & Lymphoma Society. @ Hops…,3
Please join me in supporting the leukemia & Lymphoma society by making a donation to my…,3
A great event at Cycle Hub for Team and Training Leukemia and Lymphoma society. Thanks for those…,3
This Popovich and Craig Sager Lapel Pin Supports Leukemia Research,3
I'm at MD Anderson Cancer Center Hospital Wing Leukemia Unit,3
Restaurant donating 20 percent of Monday's proceeds to boy fighting leukemia KSATnews,3
"Proceeds of pin featuring Craig Sager, Coach Popovich to benefit leukemia research mySA …",3
she is coming back to the #hospital #OLOL #thanksGod #leukemia #chemotherapy @ Our Lady of the…,3
Even the hospitals in Florida have goofy socks. #leukemia @ Sacred Heart Hospital of Pensacola,3
Join us for this FUNdraising event on Thursday 4/7 at 8:00 pm to benefit the Leukemia & Lymphoma…,3
"Came home to support those diagnosed with leukemia in this 4 mile race. Great cause, great…",3
Just ran (OK mostly walked) the #boltrun 5k with benefiting the Leukemia and…,3
Join us in helping Tyler Sieswerda fight Leukemia and Lymphoma here …,3
I love his drive and determination to beat Leukemia at the age of three... He loves my purple…,3
Boy battling leukemia sworn in as police officer,3
Raising awareness for Leukemia and Lymphoma. @ Tennova Healthcare/Hospital,3
FOX 29 at Locks of Love event at Blair Mill Elementary for a 2nd grader battling Leukemia.Hatboro …,3
"TNT reporter Craig Sager says leukemia no longer in remission, doctors give him 3-6 months",3
""" Leukemia has returned. Craig Sager in big battle for his life...Prayers Please …""Always!",3
7-year-old boy battling leukemia becomes honorary police officer. …,3
Boy battling leukemia sworn in as Gloucester Township police officer,3
Matt Skube reports on a blood donor clinic to help Stuntman Stu who was diagnosed with leukemia. …,3
Glo For A Cure Tournament benefiting Lymphoma & Leukemia @ Intuit… …,3
They think he may have cancer. Possibly leukemia. We won't know till next week,3
Biden's Cancer Moonshot Will Be Led By Leukemia Survivor Greg Simon …,3
We are thrilled to be a part of this event to help raise funds for the Leukemia Lymphoma Society…,3
#tbt Remembering my #dad when I was 1 years old after passing away from #leukemia a…,3
Read on about the leukemia outbreak in Serbia. Really laughable!,3
Inspirational Quote 8: Let's all cheer Cory Cohen up with his battle against leukemia.…,3
"#throwback to last night at the 2016 Leukemia Ball with the WTOP crew. What a great night, for a…",3
"#health #wellness #leukemia Splenda ingredient, sucralose, linked to leukemia. pic.twitter.com/GJUIP5Rzl7",3
We took over fitness yesterday For the Leukemia and Lymphoma Society #getcycd…,3
"Splenda ingredient, sucralose, linked to leukemia.",3
My 15th Leukemia Ball with awesome Redskins LB Ryan Kerrigan and the blonde squad so…,3
#leukemia Fundraiser! Raising money for a good cause! Great time down here in Hammock Beach,6
Taking in the sights on a harbour cruise for charity #leukemia #charityevent #nyc #salesforce…,6
At the Executive Luncheon for the Leukemia & Lymphoma Society diacussing the impact of cancer in…,6
Our mission. #LLSMSLA #leukemialymphomasociety @ The Leukemia & Lymphoma Society…,6
Beautiful evening supporting the Leukemia & Lymphoma Society and their Man & Woman of the Year!!…,6
"Coach Val, Justine and me. Father's Day 5K to benefit the Leukemia and Lymphoma Society #5k…",6
Last Saturday you may remember we partnered with the Leukemia Lymphoma Society ... We…,6
The Leukemia and Lymphoma Society …,6
It's a full house today. #prayfornana #teamnana #leukemia @ Johnson City Medical Center,6
My mom and I run this race every year to help raise money for leukemia and blood cancer…,6
3rd annual Macquarie 5k fun run for Leukemia @ Riverside Park… …,6
Pray for my friend Diego. Such a cool kid and an awesome fighter against leukemia. Asking…,6
"Same view, different day. Bone marrow biopsy today. #leukemia #hospital #prayfornana #teamnana",6
Amazing event to benefit the Leukemia and Lymphoma Society of NJ presented by the Mayor and the…,6
Hurry up and wait! #waiting #mymomisasurvivor #leukemia can #kickrocks #transplantlife @ VCU…,6
Cannabis phytochemicals found to be effective in destroying leukemia cells … via,6
"When I was barely six, I lost a good friend to #leukemia. Back in the 70s bone marrow donation…",6
I'll take this as a positive sign. #teamnana #prayfornana #leukemia @ Dunkin' Donuts,6
OUR WOMAN OF THE YEAR !!!! Tonight we are supporting our as the The Leukemia &…,6
OUR WOMAN OF THE YEAR !!!! Tonight we are supporting our as the The Leukemia &…,6
OUR WOMAN OF THE YEAR !!!! Tonight we are supporting our as the The Leukemia &…,6
Leukemia and Lymphoma Society Gala #blacktie #blacktieaffair #wecleanupnicely @ Talking Stick…,6
Here for mom's Leukemia & Lymphoma Society Woman of the Year Grand Finale Gala Night #openbar…,6
Adam West died Friday night after “a short but brave battle with leukemia” …,6
"Adam West, iconic 1960s 'Batman' dies at 88 after a short battle with leukemia.",6
Window decal going up for and who so graciously donated to the Leukemia…,6
#Repost OMG I LOVED Makenna's answer when I asked her if Leukemia made her feel…,6
OMG I LOVED Makenna's answer when I asked her if Leukemia made her feel different then the other…,6
#Repost (get_repost) ・・・ Makenna who is 9 years old and been diagnosed with leukemia…,6
"Makenna who is 9 years old and been diagnosed with leukemia but she is still in ""CHARGE OF THIS…",6
Atlanta Wedding Photographers Support - The Leukemia & Lymphoma Society (LLS) …,6
#RIP #CathyJackson My favorite cousin/second mom #leukemia #Findacure #Christmas 2004…,6
These beauties along some brooches are off to charity benefit for Leukemia and Lymphoma patients…,6
We're happy to be bringing our Beauty & the Blowout event to benefit The Leukemia & Lymphoma…,6
"A01354 [Engross] Provides a program to promote leukemia, lymphoma and myeloma research, education and treatment a...",6
What is Light The Night ? #lightthenight #LLSMSLA #somedayistoday @ The Leukemia & Lymphoma…,6
This is what leukemia looks like. Still hanging in there on day five of chemo. Two more to go.…,6
I've wanted to do this since he told me I have leukemia… …,6
We are crushing Leukemia and blood cancers at our Grande Finale Gala for LLS…,6
"LAST CALL TO HELP US OUT ""Sher the Love"" and push us to the finish line with our Leukemia &…",6
Congrats to #eliteathlete David Gonia for winning our Leukemia and Lymphoma Charity FitBit…,6
I'm at MD Anderson Cancer Center Hospital Wing Leukemia Unit,6
BE SWEET YALL AND SHER THE LOVE! Supporting the Leukemia & Lymphoma Society at AT&T Best of…,6
Throwback Thursday to when I did head shots for the Leukemia and Lymphoma Society of Birmingham.…,6
Beer bust TONIGHT for The Leukemia & Lymphoma Society! Legends Bar and Grill in NE. $20 for all…,6
What is Leukemia Cup Regatta? You can also follow them mslaleukemiacupregatta #LLSMSLA…,6
Eat at TODAY to help raise money for the Leukemia & Lymphoma Society! Show this…,6
DONATE @ TODAY to help us fight blood cancers through The Leukemia &…,6
My Aunt Linda came to Indy to help support the leukemia lymphoma society MWOY in memory of her…,5
Only 3 DAYS LEFT until my Leukemia & Lymphoma Society Campaign ends! DONATE BY JUNE 2,5
Picking up lanterns for our charity work got for the leukemia &… …,5
Texas teen graduates high school after beating leukemia twice 10TV …,5
Kicking off #memorialdayweekend #Leukemia & #Lymphoma Society's Toast to Summer,5
Donate your empties. Proud to help my friend Billy K & team and #leukemia #bottledrive…,5
Today is the day! Our annual bottle drive for The Leukemia Lymphoma Society here at The Beer…,5
Family and friends I'm trying to raise money for another campaign. It's the leukemia lymphoma…,5
"Gave this original 48 x 48 painting to the Leukemia and Lymphoma Society. @ Austin, Texas",5
"del and beth ran laps for leukemia at preschool this morning. ""it's… …",5
What is Team In Training ? #goteam #LLSMSLA #teamintraining @ The Leukemia & Lymphoma Society…,5
#DMU alumni in the house tonight at the #MWOY Leukemia & Lymphoma Society dinner & fundraiser!,5
#PAY to benefit Leukemia and Lymphoma 4-7 PM Music by NBC The… …,5
Today is having a fashion show and 100% of proceeds will go to the Leukemia Lymphoma…,5
Auctioning a bottle of Pappy Van Winkle to raise money for the Leukemia & Lymphoma Society!…,5
Little date night at the 6th Annual Man & Woman of the Year Grand Finale Gala for the Leukemia &…,5
HERE With the Amazing LLS Girl of the Year and Leukemia survivor Susanna and her entire…,5
Team up for Leukemia Day and my class showed out! Just today we raised $134.04! Mind…,5
"Gettin ready for this charity event benefiting the Leukemia and Lymphoma Society at Cities, hope…",5
What is #StudentSeries ? #LLSMSLA @ The Leukemia & Lymphoma Society Mississippi/Louisiana…,5
This date 8 years ago my best friend passed away from leukemia. This… …,5
SHOP FOR A CAUSE @ ATHLETA!Thank you GAP ATHLETA in Tyson's Corner for supporting our Leukemia &…,5
Come support the LEukemia & Lymphoma Society and network with locals… …,5
THU MAY 18 Fight for Lily! Benefit for The Leukemia & Lymphoma Society! DC PRIME STEAKS - PAY…,5
#Repost (get_repost) ・・・ Support the Leukemia and Lymphoma Society at the For A…,5
The Leukemia & Lymphoma Society (LLS) applauds the approval of Keytruda as an important step…,5
THU MAY 18 BENEFIT FOR The Leukemia & Lymphoma Society! DC PRIME STEAKS - PAY WITH A…,5
"The Leukemia & Lymphoma Society (LLS) and the SAGERSTRONG Foundation announced on 2nd May 2017,…",5
A Night of Fashion with Passion and hands on people! #celestino #lymphoma #leukemia…,5
THU MAY 18 BENEFIT FOR LEUKEMIA & LYMPHOMA SOCIETY! DC PRIME - PAY WITH A PURPOSE! My fellow…,5
We are proud supporters the Leukemia & Lymphoma Society! Here we are presenting a check to Frank…,5
"Join the crowd, please give generously and support The Leukemia & Lymphoma Society! @ The Casual…",5
Amazing time with amazing friends at last night's Leukemia & Lymphoma Society gala! @ Orlando…,5
"Harlem Coffee Tour this rainy morning to benefit the Leukemia and Lymphoma Society, and support…",5
Had an awesome time at the Man and Woman of the Year Gala. To support the Leukemia and Lymphoma…,5
Please join us at 6pm for our fundraiser for the Leukemia & Lymphoma Society with Frank Murphy…,5
"FYI #Donors. #StJudes marked this month's rounds ""Urgent & Rush"". #Leukemia. #Cancer is... pic.twitter.com/E7Fii8SVr4",5
"Over the past 10 weeks $700,000 was raised for the The Leukemia & Lymphoma Society! Proud to…",5
"Hi! The Leukemia Cup Poker Run is only 9 days away on Saturday, May… …",5
Thanks to everyone that attended the Passport Happy Hour to benefit The Leukemia & Lymphoma…,5
What is Man & Woman of the Year? #MWOY #LLSMSLA @ The Leukemia & Lymphoma Society…,5
Dot social for the leukemia foundation! #rockthedot #polkadotpowerhouse #dotdude #dotglow…,5
Family and friends I'm trying to raise money for another campaign. It's the leukemia lymphoma…,5
At a #fancy #gala for the Leukemia & Lymphoma Society with these #classy folks! #mwoy #mwoycle17…,5
Great night at the MWOY event for Leukemia and Lymphoma Society. Jared Emmerson nailed it! @ Zen…,5
Couple more weeks before the 45K skate to support The leukemia & lymphoma society. Another 20K…,5
"I had leukemia. Now I don't. So you should come to this. Tuesday,… …",5
Ceramics students at FHS recently dedicated a week to create over 200 Leukemia awareness ribbons…,5
Come out tomorrow to support a great cause and charity for the Leukemia and Lymphoma Society. I…,5
"Joshua, leukemia survivor, says to donate to … #MidlandsGivespic.twitter.com/14BxwOZmCv",5
Love for Life: Date for the Cure Leukemia & Lymphoma Society Date Auction,5
Every $ counts ! #LLSMSLA #leukemialymphomasociety #ThankYou @ The Leukemia & Lymphoma…,5
Had a great day yesterday raising money for the Leukemia and Lymphoma Society! Just a reminder…,4
Heffelfinger: 1 Leukemia: 0 So proud of you for kicking ass this… …,4
Having such a great time #greatgasby fundraiser for leukemia! #yelpelite #yelpva…,4
Listening to a song you used to listen to all the time > having your cat die of feline leukemia,4
"Join us on the WET Deck on Friday, 4/28 for the Black Swan Masquerade Benefit, a Leukemia &…",4
"Carol Holt Elementary raises over 3,000 for Leukemia & Lymphoma Society",4
Creating a #world without #cancer . #LLSMSLA #beataml #somedayistoday @ The Leukemia &…,4
Hey Instagram Friends. As most of you heard Kelsey was diagnosed with leukemia recently and it…,4
Just a few beautiful Texas angels who came out to support our Leukemia & Lymphoma Society MWOY…,4
Then THIS happened!! lfcchurch member Alisa Washington has been battle Leukemia. After being…,4
"In 1984, before my oldest brother died of #leukemia, stopped by and busted with…",4
Enjoyed the evening supporting The Leukemia and Lymphoma Society! …,4
2 months ago my little sister Jada was diagnosed with Leukemia. You never know your whole world…,4
"Support the Leukemia Lymphoma Society today by giving back ! All sizes, different color ways,…",4
Just finished working the #leukemia and #lymphoma charity event.… …,4
Catching up with Stu Schwartz to talk about his very public and very courageous battle with leukemia StuStrong… …,4
"When she was 42, she was diagnosed with Leukemia. Doctors said she'd live another 12 years.…",4
BankSouth Mortgage is a proud supporter of the The Leukemia &… …,4
tiny tribute for his best friend who passed away from leukemia a year ago today #allthefeels,4
"As many of you know, I have been nominated for the Man & Woman of the year for The Leukemia &…",4
Working #together towards a #cure #LLSMSLA #somedayistoday @ The Leukemia & Lymphoma…,4
This Thursday is our annual Crawfish Boil benefiting the Leukemia… …,4
Every $ counts ! #LLSMSLA #somedayistoday @ The Leukemia & Lymphoma Society…,4
"PREVENT Parvo, Distemper, Feline Leukemia, and many other viruses by having your pet fully…",4
"9-year-old battles leukemia, continues to attend class ... virtually. …",4
Come support me as I raise money and awareness for the Leukemia & Lymphoma Society in honor of…,4
"Helping to fight blood cancers through fashion, supporting the Leukemia and Lymphoma Society.…",4
"Headed Out to The ""Keep Calm and Tropics on Charity Happy Hour"" benefitting the Leukemia and…",4
Comedian Charlie Murphy dead at 57 following leukemia battle …,4
"Raising money for Leukemia and Lymphoma research!!!!' @ Channelside Bay Plaza, Tampa",11
Dropping by to thank Burlington for their efforts on behalf of the Leukemia and Lymphoma... pic.twitter.com/KNnhQUCshN,11
I wrote my MPH thesis about AE reporting in peds leukemia trials!,11
"#Repost with repostapp ・・・ Join the Leukemia & Lymphoma Society on Friday, November…",11
Make someone smile today #colorturkey #leukemia @ Turkish Philanthropy Funds,11
A student army school was recently diagnosed with leukemia... all… …,11
"Batkid, diagnosed with leukemia at just 18 months, now in remission",11
Working towards a cancer-free world. #lls #llsmsla #tbit #talkaboutittuesday @ Leukemia &…,11
"ONLY 3 DAYS LEFT TO JOIN SMOOTHIE WHIRL'DS TEAM in the ""Light the Night Walk"" for the Leukemia &…",11
Benefit for Leukemia & Lymphoma Society bronxbackyardsundays at McGoo's 2pm - 7pm.…,11
Outchea ! Who not involved with the community? Walk for leukemia &… …,11
"Robert Vaughn died Friday morning after a brief battle with acute leukemia, according to his manager.",11
All finished!! We support the Leukemia & Lymphoma Society!! Come in today and donate a…,11
Our warrior of the week is Gracie Atwood #warriorwednesday #LLS #LLSMSLA @ Leukemia and…,11
Every dollar counts ... #tbit #lls #llsmsla @ Leukemia & Lymphoma Society,11
The Leukemia and Lymphoma Society is going on the offensive against acute myeloid leukemia (AML)…,11
"Last night, we lit up the night with jjs_handz, and The Leukemia & Lymphoma Society to…",11
Light the Night Leukemia Walk 2016. #lovinglife… …,11
"In 2014, my friend Meghan's little girl Carly, was diagnosed with a rare form of Leukemia. She…",11
Leukemia & Lymphoma Night Walk,11
We are also supporting the #Leukemia/Lymphoma Society by launching medalions pic.twitter.com/lryMj7mojj,11
Community hosts blood drive for 6-year-old fighting Leukemia.,11
"dude had leukemia too, like come on",11
"""Light the Night Walk"" raising money with my girls for Leukemia and… …",11
Supporting the Leukemia & Lymphoma's Light the Night Walk! …,11
Superheroes and Survivors at #lightthenight #leukemia #lls …,11
"This is the face of a six year old battling leukemia, undergoing… …",11
Working towards a cancer-free world. #lls #llsmsla #tbit #talkaboutittuesday @ Leukemia and…,11
Happy Halloween! The Leukemia & Lymphoma Society will be benefiting from every guest who dares…,10
I'm feeling a little mischievous tonight. Ps. all parking proceeds go to Leukemia Research.…,10
Leukemia and Lymphoma Society Light the Night @ Little Rock River Market,10
Our warrior of the week is Davis Spicer ! #warriorwednesday @ Leukemia and Lymphoma…,10
Celtics stand in solidarity with sideline reporter Craig Sager as he battles Leukemia,10
Perfect night for the Leukemia & Lymphoma Society's Light the Night… …,10
13-year-old girl with leukemia running Hot Chocolate 5K to support charity that helped her...,10
Our #research aims towards one goal: ending #bloodcancer . #LLS #LLSMSLA #beatcancer @ Leukemia…,10
"Fortville toddler raises over $1,100 for friend with leukemia",10
Awesome #LightTheNight walk last night to support the Leukemia and Lymphoma Society with my…,10
So glad frank & I were able to do the light the night walk again for lymphoma and leukemia in…,10
#thejorgemichaelshow showing support to the beautiful at the Leukemia and Lymphoma…,10
Thank you to the Leukemia and Lymphoma Society for inviting me back to emcee my 2nd New Haven…,10
My moms care team #lightthenightwalk @ The Leukemia & Lymphoma… …,10
Had a great time singing for the Leukemia &a Lymphoma Society's Light the Night Walk! A splendid…,10
Was at the Light The Night: Leukemia and Lymphoma Society walk last night with amazing people!…,10
Great event tonight for the Leukemia & Lymphoma Society!! Such a great cause with wonderful…,10
"Bernie Sanders demands info after price of leukemia drug is hiked to nearly $200,000 a year",10
This ones for you Nana. You may have lost your battle with Leukemia… …,10
At MD Anderson Leukemia Center for my follow up with my Oncologist Dr. Kantarjian. #LeukemiaAwareness #CancerSucks – at Leukemia Center,10
Red lanterns showing support for lymphoma and leukemia patients & survivors #LightTheNight…,10
Light the Night Leukemia walk laser show this past Saturday. #garvomusic @ Wilson Farm Park,10
Light the Night Leukemia walk on Saturday 10/15/2016. Such a wonderful cause and I'm grateful to…,10
Someday is today ... #tbit #lls #llsmsla @ Leukemia and Lymphoma Society La,10
7-year-old boy with leukemia runs for touchdown in League City,10
The Leukemia & Lymphoma Society's Light The Night Walk funds research to find cures and ensure…,10
The Leukemia & Lymphoma Society's Light The Night Walk funds research to find cures and ensure…,10
Wonderful fundraiser for the Leukemia and Lymphoma Society. Amazing… …,10
Photographing the Leukemia & Lymphoma Society Light the Night event (@ The Depot) pic.twitter.com/4zuR2zicuY,10
Leukemia and Lymphoma Society- Light The Night Walk 2016… …,10
The Leukemia and Lymphoma Society #lightthenight #support @ Ronald Reagan…,10
Going out for a walk to end leukemia and lymphoma. #somedayistoday #lightthenight @ Garrison…,10
Stem cell donor meets Leukemia survivor at Celebration of Life event in Phoenix,10
Leukemia and Lymphoma Society 10th Anniversary - Man/Woman of the Year reception (@ Lambert's Downtown BBQ),11
Staunton's Aaron Childs fights rare form of leukemia pic.twitter.com/vjwA8KzQZP,11
"My mother passed away last night after a short struggle with leukemia. Thankfully, my sister…",11
Tonight marks the 5th consecutive Light the Night event I've shot for the Leukemia and Lymphoma…,11
My dear childhood friend emmily.tarchokov 's daughter was diagnosed with leukemia awhile back.…,11
Obstacles are being built as we speak! So stoked to help out the Leukemia and Lymphoma Society…,11
Did you know ? 9:22 9/22 #talkaboutittuesday #LLSMSLA #Somedayistoday @ The Leukemia &…,11
"Bruce is a 7 year old boy, diagnosed with acute lymphocytic leukemia around his 5th birthday. He…",11
We hit our Goal for the Leukemia & Lymphoma Society! So proud of all… …,11
Had a great time with all my friends today at the Leukemia & Lymphoma Society’s Light the Night…,11
Light the Night Leukemia Lymphoma Walk #thankful4life… …,11
Light the night Leukemia walk @ Kingsland Point County Park …,11
Light the Night #leukemia #leukemiaawareness This is for my Mom who lost her battle with…,11
"So impressed with the turnout at the “Light the Night” walk to fight leukemia and lymphoma,…",11
Great turnout for “Light the Night” walk to fight leukemia and lymphoma. Especially proud of the…,11
Excited is an understatement as we prepare for the Leukemia Lymphoma Society’s “Light The Night”…,11
Our Honored Hero of the week is Angel Gordon! #studentseries #squad #LLSMSLA @ The Leukemia…,11
Halloween has come to New Market Bank! Come help support Costume for a Cure through the Leukemia…,10
Working #together towards a free of #bloodcancers ! #beatcancer #LLSMSLA @ The Leukemia &…,10
Today marks what would have been my mom’s 95th Birthday!! As we approach the Leukemia Lymphoma…,10
A few snaps before the Leukemia fundraiser last night. Proud to be able to share my home with…,10
I’d like to thank everyone that donated to our fundraising efforts for Leukemia and Lymphomas…,10
"#lightthenight against #leukemia @ Stamford, Connecticut …",10
Leukemia & Lymphoma Society event starts at 7pm check in is at 4pm for the walk. Fireworks…,10
Lemonade stand today to help fight leukemia for one of Josh’s dad’s coworkers battling the…,10
Thank You Gary Jobson! 25 Years at the helm Leukemia and Lymphoma… …,10
Finished #OhioChalkArtGuild work for the Leukemia & Lymphoma Society Light the Night Walk,10
