tweet_text,month_of_tweetIn honor of National Lymphoma Awareness day Six months cancer… …,9
"Photographing the Leukemia & Lymphoma Society Lifeblood Awards (@ Woman's Club of Minneapolis in Minneapolis, MN)",9
supporting Lymphoma awareness day #VioletStrong @ Central Michigan… …,9
Hey everyone! Wear purple and green today in honor of Lymphoma! Today is World Lymphoma…,9
"#StandUpToCancer For my dad,who passed away from Non Hodgkins Lymphoma at 51 &my brother in law,who succumbed to a brain tumor at 36",9
September is Hodgkin's lymphoma Awareness Month @ Abramson Cancer Center at the University of…,9
Benefit Brings Broadway to Southlake Teen with Lymphoma pic.twitter.com/DVzGGsaYi8,9
"Gettin ready for this charity event benefiting the Leukemia and Lymphoma Society at Cities, hope…",5
Cut-a-thon to benefit Brandon Federico and his fight against Lymphoma. @ Shine Bright Like a…,5
What is #StudentSeries ? #LLSMSLA @ The Leukemia & Lymphoma Society Mississippi/Louisiana…,5
Come support the LEukemia & Lymphoma Society and network with locals… …,5
THU MAY 18 Fight for Lily! Benefit for The Leukemia & Lymphoma Society! DC PRIME STEAKS - PAY…,5
#Repost (get_repost) ・・・ Support the Leukemia and Lymphoma Society at the For A…,5
The Leukemia & Lymphoma Society (LLS) applauds the approval of Keytruda as an important step…,5
THU MAY 18 BENEFIT FOR The Leukemia & Lymphoma Society! DC PRIME STEAKS - PAY WITH A…,5
"The Leukemia & Lymphoma Society (LLS) and the SAGERSTRONG Foundation announced on 2nd May 2017,…",5
A Night of Fashion with Passion and hands on people! #celestino #lymphoma #leukemia…,5
THU MAY 18 BENEFIT FOR LEUKEMIA & LYMPHOMA SOCIETY! DC PRIME - PAY WITH A PURPOSE! My fellow…,5
We are proud supporters the Leukemia & Lymphoma Society! Here we are presenting a check to Frank…,5
"Join the crowd, please give generously and support The Leukemia & Lymphoma Society! @ The Casual…",5
Amazing time with amazing friends at last night's Leukemia & Lymphoma Society gala! @ Orlando…,5
"Harlem Coffee Tour this rainy morning to benefit the Leukemia and Lymphoma Society, and support…",5
Had an awesome time at the Man and Woman of the Year Gala. To support the Leukemia and Lymphoma…,5
Please join us at 6pm for our fundraiser for the Leukemia & Lymphoma Society with Frank Murphy…,5
"Over the past 10 weeks $700,000 was raised for the The Leukemia & Lymphoma Society! Proud to…",5
Thanks to everyone that attended the Passport Happy Hour to benefit The Leukemia & Lymphoma…,5
What is Man & Woman of the Year? #MWOY #LLSMSLA @ The Leukemia &amp; Lymphoma Society…,5
A girl who said her uncle died from #lymphoma he contracted from #agentorange during the war in…,5
Family and friends I'm trying to raise money for another campaign. It's the leukemia lymphoma…,5
At a #fancy #gala for the Leukemia & Lymphoma Society with these #classy folks! #mwoy #mwoycle17…,5
Great night at the MWOY event for Leukemia and Lymphoma Society. Jared Emmerson nailed it! @ Zen…,5
Couple more weeks before the 45K skate to support The leukemia & lymphoma society. Another 20K…,5
Come out tomorrow to support a great cause and charity for the Leukemia and Lymphoma Society. I…,5
Love for Life: Date for the Cure Leukemia & Lymphoma Society Date Auction,5
Every $ counts ! #LLSMSLA #leukemialymphomasociety #ThankYou @ The Leukemia & Lymphoma…,5
Meet Alanah! Alanah is currently in the process of BEATING Hodgkin's Lymphoma. Before she…,5
Had a great day yesterday raising money for the Leukemia and Lymphoma Society! Just a reminder…,4
Wednesday Views brought to you by @ Wall Street,4
"Carol Holt Elementary raises over 3,000 for Leukemia & Lymphoma Society",4
Hodgkins Lymphoma can leave the building • @ New Jersey,4
Just a few beautiful Texas angels who came out to support our Leukemia & Lymphoma Society MWOY…,4
7 years ago today I started my chemotherapy treatment for Hodgkin's Lymphoma ~ Over 6 Years…,4
Enjoyed the evening supporting The Leukemia and Lymphoma Society! …,4
"Support the Leukemia Lymphoma Society today by giving back ! All sizes, different color ways,…",4
Just finished working the #leukemia and #lymphoma charity event.… …,4
LAST BAG IN THE LAST ROUND OF ABVD CHEMO#hodgkinslymphoma #hodgkinsdisease #lymphoma #abvd…,4
I am ready to WIN! Defeating Lymphoma Starts Today.... @ Phoenix VA… …,4
Working #together towards a #cure #LLSMSLA #somedayistoday @ The Leukemia & Lymphoma…,4
Every $ counts ! #LLSMSLA #somedayistoday @ The Leukemia & Lymphoma Society…,4
We lost Joey Ramone to lymphoma just like my bf Jamie. Donate in honor/memory of someone today…,4
Come support me as I raise money and awareness for the Leukemia & Lymphoma Society in honor of…,4
"Helping to fight blood cancers through fashion, supporting the Leukemia and Lymphoma Society.…",4
#tbt To that day Uptown Mortgage Group sponsored a Hole for Lymphoma at the Creighton Classic,4
