tweet_text,month_of_tweet"SJR96 [NEW] Designates April 19th as ""Acute Myeloid Leukemia Awareness Day.""",1
"Mile post 23. Yea it's cold, 40°. #rundisney #hollywoodstudiosdisney #leukemia # lymphoma…",1
"S00970 [NEW] Provides a program to promote leukemia, lymphoma and myeloma research, education and treatment and e...",1
I made this custom order for a customer for Leukemia awareness. @ Lotus Blossom Boutiques,1
Houston Congressman Ted Poe in remission from leukemia khou hounews,1
Volunteering for Leukemia & Lymphoma Society 5k @ #Epcot #rundisney @ Epcot - Walt Disney World,1
"My little 12.5 lbs shelter baby got neutered, tested negative for Feline leukemia & FIV and…",1
"Mesa student denied graduation by leukemia finally graduates, meets donor",1
Florida family wins fight to bring son to Philadelphia for experimental leukemia treatment,12
The key to early detection of childhood leukemia might be found in thousands of tiny fish.,12
HEAWARMING: Child with leukemia fulfills dream of conducting orchestra,12
Child with leukemia fulfills dream of conducting orchestra,12
Wayne State zebrafish might hold key to fighting leukemia,12
A 7-year-old boy battling leukemia had his dream come true last week when he conducted an orchestra. ABC13… …,12
The child leukemia survival rate has increased from 6% to 94% since St. Jude Children's research…,10
Craigsville Elementary rallies around leukemia victim pic.twitter.com/I17Bj4a8QM,10
Craigsville Elementary rallies around leukemia victim pic.twitter.com/RY7glLlgk1,10
In Jehovah God we trust hello my blessed framily Please donate for my Leukemia Night Walk in San Antonio #ellenshowpic.twitter.com/VWD8rvRWVM,10
Every white light is a Leukemia or Lymphoma survivor! @ Rumsey Playfield,10
"Light the Night NYC, Supporting the Leukemia Lymphoma Society @ Central Park",10
"Turning in donations, picking up shirts and being inspired to #domoregood @ The Leukemia &…",10
Local peeps....we are collecting pennies for the Leukemia&Lymphoma Society. Drop off your…,10
Dozens of Irish cancer patients testing new leukemia treatment #cancer…,10
Sweets & Meats BBQ will be donating a portion of our sales to the Leukemia & Lymphoma society…,10
Honored to have been accepted into the Leukemia & Lymphoma Society National Capital Chapter…,10
"#MagicalMonday 14 year-old Colton from Marshall, VA is battling leukemia & wished to have a camper #WishGrantedpic.twitter.com/NFKZDmhwFm",10
Spoke at one last event for the Leukemia and Lymphoma Society a… …,9
Tonight at the Leukemia Texas event at The Rustic with …,9
#EatChipotle for #LLS today. Let them know you are eating for Leukemia and Lymphoma and they…,9
Come on down for Happy Hour to Salon Restaurant by Sucré to Sip for a Cure for the Leukemia &…,9
National Leukemia Awareness Month #PrayForACure @ Town Lake at… …,9
What causes severe bone cancer lymphoma and leukemia,9
Check up time with my favorite oncologist! #cancerspecialistsofok #leukemia #cml #hardcoeur…,9
Rooting for that “win” against blood cancers ! #LLSMSLA #somedayistoday #bcam @ The Leukemia…,9
Light the Night for Leukemia and Lymphoma @ St Louis - Forest Park …,9
"Thank you to our neighbors, The Leukemia and Lymphoma Society, for finding treatments and cures…",9
I'm at MD Anderson Cancer Center Hospital Wing Leukemia Unit,9
"More than 6,000 school-age children are affected by leukemia and lymphoma each year. These blood…",9
Charity mini golf for Leukemia & Lymphoma society. Turtle back zoo / Essex county safari mini…,9
Working together towards a cure ! #LLSMSLA #somedayistoday @ The Leukemia & Lymphoma Society…,9
You can help change this ! #LLSMSLA #somedayistoday #beatcancer @ The Leukemia & Lymphoma…,9
"Hadlee was diagnosed with Leukemia and is currently in treatment. Please send her your support,…",9
who was healed of #leukemia as a child praying for our Titus! Thanks…,9
"Come see us at the Rec Center on the 3rd floor, 12pm-4pm to help find a cure for Leukemia and…",9
"""Someday is today"" We're proud to support Towne Properties' efforts to raise money for Leukemia…",9
"Leukemia and Lymphoma Society leadership committee meeting (@ Jackson Walker L.L.P in Austin, TX)",9
Working towards a world free of cancers . #somedayistoday #LLSMSLA #bcam @ The Leukemia &…,9
We can #BeatCancer ! #MissionMonday #LLSMSLA @ The Leukemia & Lymphoma Society…,9
Leukemia Feather Ribbon tattoo on stonerrichie by NeedleZ FOLLOW: tattoo by…,9
"13 years ago, the Lord set me free from leukemia. 13 years later and… …",9
Sticking his tongue out at Leukemia!! Today he is getting blood and platelets. His platelet…,9
Smiling Stu Schwartz joined MAJIC 100 co-host Angie Poirier this a.m. after returning from battle w/ leukemia… …,9
Stuntman Stu makes radio return after leukemia battle …,9
"Back to grind this morning with Dr. Pemmaraju, leukemia doc mdandersoncancercenter! Follow his…",5
I said I wasn't going to do it but I had to get some crawfish in suport of Leukemia…,5
Me and my beautiful wife last night at the Leukemia Lymphoma society Man/Woman of the year…,5
Let's beat cancer together! To make a donation to the Leukemia and Lymphoma Society for cancer…,5
#flashbackfriday #friday My maternal #grandmother who passed from #leukemia when my #mom was 5.…,5
"Celebrity Guest Bartender! Jason and I raised close to $1,000 for the leukemia/lymphoma society…",5
How a Catonsville school is helping a 7-year-old student battle leukemia,5
This beautiful Model survived Leukemia. What a blessing! #divadynastymagazine #chubiiline…,5
Memorial Day Weekend FUNdraiser benefiting the Leukemia & Lymphoma… …,5
"A thing of beauty and purpose! #Repost of Team Dave, this month's beer benefiting the Leukemia &…",5
"A few months ago, Nathaniel was in bad shape, battling Leukemia. We were all VERY worried about…",5
The new anatomy of #cancer #leukemia #medtech,5
"Ryan Kerrigan kicking off today's Leukemia Charity Golf Tournament. Great cause, great…",5
All proceeds from this event benefit the Austin Leukemia and Lymphoma Society via Dr. Walden's…,5
"""Leukemia sucks. Donate today."" #whathesaid #LLS #fundraiser #fightingbloodcancer pic.twitter.com/eXP27YegYZ",5
Young boy who survived Leukemia meets bone marrow donor,5
Amazing end to an epic 10 week campaign for the Leukemia & Lymphoma… …,5
Come out today to Alamo Beer Co. and support my Leukemia & Lymphoma Society fundraiser! Check out the silent… …,5
"Leukemia and Lymphoma fundraiser, tonight at Mac a Doos in Hilliard!… …",5
The GNA crew at the Leukemia and Lymphoma Society gala for the LLS Man and Woman of the Year.…,5
8-Year-Old Battling Leukemia Gets Disney World Wish Granted,5
"Chronic illnesses, such as diabetes or leukemia, may interfere with healing after surgery.…",5
Congrats to ZCHS for raising so much money for Leukemia society.collstagram annieleonardd12,5
Leukemia and Lymphoma Society Fundraiser in MKE with Marcus and Crystal! Thank you! @ Mo's Irish…,5
Out at a charity event for a little girl fighting leukemia <3 @ TGI Fridays Cross Lanes,5
N.H. girl battling leukemia gets her wish to meet Justin Bieber …,5
Radiant Title and Cindy Ibson care abiut The Leukemia and Lymphoma Society. ! @ TALBOTS,5
Come on out until 7:00. Big sale for The Leukemia and Lymphoma Society. @ TALBOTS,5
Leukemia & Lymphoma Society: Man & Woman of The Year 2016 Gala (at pic.twitter.com/OtZ7M7vCF5,5
Leukemia & Lymphoma Society Benefit: Man & Woman of the Year 2016 (@ Renaissance Cleveland Hotel -,5
Superfan w/leukemia who met her idol at the is beating the odds again,5
Men's basketball | Capital's Damon Goodwin back on job after season lost to leukemia,5
Just spent hours at a call-a-thon for the Woman of the Year campaign for the Leukemia and…,5
Once again it's time for the Leukemia & Lymphoma Society's (LLS) Man & Woman of the Year…,5
Bourbon Dinner for Leukemia & Lymphoma Society @ Hops & Fire Craft Tap House,5
"I'm at The Leukemia and Lymphoma Society of Indianapolis in Indianapolis, IN",5
Ontario promises to expand access to stem cell transplants for leukemia patients …,5
Come on out and support The Leukemia and Lymphoma Society! @ Oak Ridge Bowling Center,5
Attending the Leukemia and Lymphoma Society's Man and Woman of the Year Gala this evening. It's…,5
"Figures. Kid with leukemia announces Denver is taking Lynch, who made his name in the city that helped find a cure.",4
"Help us fight Leukemia next Saturday, May 7th! Fight Club charity workout - all proceeds go to…",4
"Heavy Ride today. I ride for my friends with BREAST CANCER, PROSTATE CANCER, LEUKEMIA, MULTIPLE…",4
Great time w/ a good group!!Golfing for Leukemia & Lymphoma society. Good work putting it all…,4
Come out and support the Leukemia and Lymphoma Society while having fun shaving a skull! #ΦΚΣ,4
If you can't make it out tonight to Tutys to support he The Leukemia… …,4
My work view #bigclimbphilly #leukemia&lymphomasociety @ Comcast Corporate Office Headquarters,4
My work detail today. #bigclimbphilly #leukemia&lymphomasociety @ Comcast Corporate Office…,4
"Beautiful aircraft, sad they have to sit on the flight line outside. #leukemia #lymphoma #lls…",4
Yesterday and today have been spent touring local airports to promote the #leukemia #lymphoma…,4
Yesterday and today have been spent touring local airports to promote the #leukemia #lymphoma…,4
Yesterday and today have been spent touring local airports to promote the #leukemia #lymphoma…,4
Who wants to hear some AWESOME news?!? Young Moises has had Leukemia in a head lock...fighting…,4
Yesterday and today have been spent touring local airports to promote the #leukemia #lymphoma…,4
My girl is one tough cookie. Learning she has Leukemia wasn't good… …,4
"#soccer 3v3 tournament to benefit Leukemia &Lymphoma Society Sunday, May 1st 8am -1pm now…",4
Report: 500 kids sick with lymphoma and leukemia at Chinese school built on toxic soil,4
"This Day In History 1996 - Michele Carew, daughter of baseball great Rod Carew, dies of Leukemia at age 18",4
DJing a fundraiser for LLS tonight (Leukemia & Lymphoma Society). I can imagine worse ways to…,6
Honky Tonk Fest! So much fun! Come out and help raise money for the leukemia and lymphoma society. (@ Grumpy's Bar),6
#fbf Back to fundraising for the Leukemia & Lymphoma Society at World of Beer in Downtown…,6
At Leukemia & Lymphoma Society #mwoy2016 gala awesome fun and great cause! @ 583 PARK AVENUE,6
Army vet diagnosed with leukemia unable to get VA to cover treatment at hospital of his choice. WPLG Local 10 News… …,6
Chris and I donated to Leukemia and Lymphoma Society and were the lucky ones who got to…,6
Congrats to my ace for winning the 2016 Man of the year award. The Leukemia & Lymphoma…,6
Father's Day 5K to Benefit the Leukemia and Lymphoma Society. It's gonna be a slow run!…,6
"I run to end leukemia, what do you run for? #9.3forgrandaddy… …",6
"We've left the Leukemia gala, but the party continues. #ElephantCastle #centrepieces @ Elephant…",6
Team D's 4th annual Jim Gibbons 5k for leukemia! Really something… …,6
Smiling because this little angel is leukemia free!! What a great… …,6
Had a great time at the Leukemia and Lymphoma Society Grand Finale Gala. My friend we a…,6
A beautiful day to be at the Carl Inserra Leukemia Fund Golf Outing #golf #golfouting…,6
"""Don't worry, Just play! "" - Words of advice from 5 year old Leukemia survivor, Adam Mouhsine.…",6
Beyond excited to for our finale event for the leukemia lymphoma society!!! Hope a ton of money…,6
#leukemia #lymphoma #foundation with this #doll check out #fitmethod @ BLK LIVE,6
#leukemia #lymphoma #foundation #charity event with some great people. #bethedifference #support…,6
Anyone anywhere can bid using their cell phone on cool items to help support the Leukemia &…,6
Hi guys! Neil and I want to thank everyone who came to support our happy hour for the Leukemia…,6
Our awesome friends and at the Leukemia & Lymphoma Society fundraiser last…,6
"My hubby and I at the Leukemia & Lymphoma Society fundraiser last night. $77,000 was raised…",6
Leukemia & Lymphoma Society raises record $1 million with annual event,6
York/Lancaster Leukemia and Lymphoma Man and Woman of the yearGrand Finale! Congrats to... pic.twitter.com/iPNQ4nZij6,6
Muhammad Ali granted the very first wish by visiting a Michigan teenager battling with Leukemia in 1985. Rainbow...,6
chos3nimm0rtal serenades Lillie at her BBQ! #leukemiaawareness #leukemia #locals #localrapper…,6
We have already thrown over 4000 punches for the Leukemia & Lymphoma Society at #9roundbaltimore…,6
Sister receives diploma in honor a student who died from Leukemia,6
Rooms here at are pretty nice! Ready to party and play at the Leukemia and…,6
This girl. Diagnosed with Leukemia 10 years ago. Today is her survivors picnic. Her Celebration…,6
Man and Woman of the Year Gala benefiting the Leukemia & Lymphoma Society. Thank you…,6
Check out my blog post! Link in the bio! @ North Carolina Chapter of The Leukemia & Lymphoma…,6
Big silent auction win tonight at the Leukemia and Lymphoma Society Man and Woman of the Year…,6
Annapolis Leukemia Cup celebrationw / John Dodge et al.... …,6
Playing great so far @ LOS 5th Annual Leukemia and Lymphoma Society Golf Outing,6
"Michael is a brave, Baytown teen who was recently diagnosed with leukemia. Hear his story on KPRC 2 Houston… …",6
"Still battling leukemia, Craig Sager threw out the first pitch at tonight's #VoteCubs game",6
Throwback to April! This pretty planting was donated to the Leukemia & Lymphoma Society for the…,6
Annara is 4 and has leukemia and this ia her favorite little buddy and she wanted mommy to draw…,5
"Returns For Leukemia #bottledrive2016 (@ The Beer Store in Scarborough, ON)",5
"Valley HS senior with leukemia denied cap, gown wants policy change",5
Dobson High sr walks w/ grads but forced 2sit in stands after coming up 2.5credits short because leukemia treatment… …,5
Student body president with leukemia not allowed to walk at Dobson High graduation in Mesa,5
Student body president with leukemia not allowed to walk at Dobson High graduation in Mesa,5
"The Leukemia & Lymphoma Society {BLOOD • SWEAT • CURE • #BOOTCAMP} SATURDAY, JUNE 4TH",5
"Robert Downey, Jr., joined Chris Evans to visit a teen with leukemia in California 7News",5
Cheerleader with leukemia honored by football team,9
Football team pays touching tribute to cheerleader with leukemia: abc13,9
High school football team greets cheerleader battling leukemia with roses,9
HEAWARMING: Football team pays touching tribute to cheerleader with leukemia,9
Football team rallys around cheerleader with leukemia,9
Football team pays touching tribute to cheerleader with Leukemia,9
High school football team honors cheerleader battling leukemia with roses.,9
First day at my awesome new job! (@ The Leukemia & Lymphoma Society),9
Football players honor cheerleader diagnosed with Leukemia,9
Wedding vendors surprise groom with leukemia and bride with free wedding KHOU,9
"She is 3.1 pound, and got her kitty Leukemia test, and second round of baby shots. #Shmaltzy",9
"Thieves return stolen flamingos displayed for leukemia awareness, donate to charity",9
Craig Sager is hanging tough in his leukemia battle; he's unfazed by the odds,9
"So happy to help this young girl, who's battling leukemia, get her free wig thru the American…",9
"Are you a bone marrow match for baby Alex, son of a Miami-Dade Police officer battling Leukemia. Today till 4:30P…",9
"Craig Sager hangs tough in leukemia battle: ""Fight until the end. Fight as hard as you can.""",9
TNT's Craig Sager hangs tough in leukemia battle,9
TNT's Craig Sager hangs tough in leukemia battle …,9
Cubs' Anthony Rizzo makes extremely kind gesture to 1-year-old battling leukemia,8
"Local brewery stepping up to help family fight daughter's leukemia, Amy Lange reports.",8
99-year-old man will serve as skipper in Leukemia Cup regatta tomorrow,8
Help Wyatt get his wheels back! Therapy bike stolen from 5-year-old with leukemia …,8
"Tonya Carder helped make #WishKidWednesday special for Dolores, 9 year old with Leukemia #CoreValues in actionpic.twitter.com/kJNxXxdGKv",8
Successful night for Leukemia & Lymphoma Society!!! #LLS #cancersucks #womanoftheyear2015…,8
Days of Our Lives' Kassie DePaiva Reveals Leukemia Battle | Comcast … via God Bless you.Sending prayers !,8
"The Men of Phi Kappa Sigma present Concert For A Cure, benefiting the Leukemia Lymphoma Society.…",8
Let's #talkaboutittuesday ! #LLS #LLSMSLA . ....... @ The Leukemia & Lymphoma…,8
Today's #lyfestory #highlights #journey as a young #iceskater with #leukemia to…,8
TONIGHT AT 8PM! FLIPSIDE will be performing at Kobi's Bar in Bonner Springs for the Leukemia and…,8
Just a little snap shot of the Leukemia Cup Regatta #forthecure… …,8
"#jacksonville #jobs Fundraising Campaign Specialist - Leukemia & Lymphoma Society - Jacksonville, FL",8
"#jacksonville #jobs Fundraising Campaign Specialist - Leukemia & Lymphoma Society - Jacksonville, FL",8
Firefighters make Leukemia pediatric patient's dream come true …,8
AIDS N : Heterogeneous loss of HIV transcription and proviral DNA from 8E5/LAV lymphoblastic leukemia ...,8
AIDS N : Heterogeneous loss of HIV transcription and proviral DNA from 8E5/LAV lymphoblastic leukemia ...: 8E5/LAV…,8
AIDS N : Heterogeneous loss of HIV transcription and proviral DNA from 8E5/LAV lymphoblastic leukemia ...,8
This 4-year-old cop is fighting crime and leukemia,8
treatments of leukemia in hospital will be change....new menu will be introduce,8
"good news""way to fight leukemia"" eat healthy,liver in combination with natural starch to retain build up on bone marrow for rep/white cells",8
"Liam and his friend, Ross (who has T-cell Acute Lymphoblastic Leukemia) presented a check to…",8
One of my best friends 3 yr old son was diagnosed with #leukemia we are #TeamJuJu we support…,8
6-year-old fighting Leukemia becomes CHiPs officer for a day 10TV,8
Ready for our bake sale to raise funds to find a cure for cancer! Leukemia Lymphoma Society #lls…,8
6-year-old fighting Leukemia becomes CHiPs officer for a day 10TV,8
"Boy with leukemia, 6, pulls over a 'suspect' after becoming highway cop for a day.",8
"The Leukemia & Lymphoma Society and Subaru Jacksonville partnered for the ""Subaru Loves to Care""…",8
It's Monday and Its Official in September it's Me against you Leukemia and I know for sure I'm…,8
I worked on a story today for a girl who has leukemia and the community did a fundraiser for her…,8
Opening cocktail for the Leukemia and Lymphoma Society Beer Dinner! Peach and rosemary bourbon…,8
An elated 6-year-old leukemia patient got to become a highway patrolman for a day.,8
Announcing: East by East Lansing music festival Mark your calendar for 9/10 to fight leukemia…,8
WATCH: Child with leukemia becomes California Highway Patrol Officer for the day,8
6-year-old with leukemia becomes highway patrolman for a day,8
North Carolina boy with leukemia dreams of becoming a police officer,8
Let's all arrive early tomorrow to support this sweet little girl in her battle with #leukemia…,10
"Here supporting a wonderful cause, The Leukemia & Lymphoma Society's Light the Night Walk, on a…",10
"Keeping up the fight to stop #bloodcancer (@ The Leukemia and Lymphoma Society of Indianapolis in Indianapolis, IN)",10
"RIP Dylan Rieder. A true skateboard legend. Cancer and Leukemia sucks. No one deserves that,…",10
Beefsteak Dinner Fundraiser for Team SHISEIDO Group Team in Training benefiting Leukemia &…,10
"Leukemia Beefsteak fundraiser (@ Le Neve's Restaurant And Banquet in Haledon, NJ)",10
I am so happy and feel so blessed every time I get a good doctors report on my leukemia! All's…,10
Boy with leukemia and lymphoma scores touchdown of his dreams,10
"Superheroes, survivors of Leukemia Lymphoma Society at the LLS Light The Night 2016 Walk at…",10
#education #jobs Telephone Outreach Assistant - Part-time/Temporary - The Leukemia & Lymphoma Society - Harri...,10
"#sales #jobs Telephone Outreach Assistant - Part-time/Temporary - The Leukemia & Lymphoma Society - Harrisburg, PA",10
#customerservice Telephone Outreach Assistant - Part-time/Temporary - The Leukemia & Lymphoma Society - Harri...,10
"My survivor, her supporters #lightthenight #lymphoma #leukemia @ Wade Oval",10
So proud to work for The Leukemia & Lymphoma Society in memory of my mom. What an inspiring and…,10
So thankful for all that the Leukemia and Lymphoma Society do on a… …,10
"I have some bad news. Today, I was diagnosed with Acute Myeloid Leukemia (AML.) On Monday, I…",10
We are so honored to be a part of tomorrow's #Leukemia and #Lymphoma Society's #LightTheNight…,10
When our 11yr old niece finishes chemo and has no new leukemia cells...you take funny selfies.…,10
"The Ambassadors did their part to ""Light the Night"" for Lymphoma and Leukemia…",10
Final event at SummerStage. The Light the Night Leukemia Fundraiser. Perfect way to end the…,10
#tbt to when #Nashville star #charlesesten and #leukemia #survivor daughter Addie joined Light…,10
Lost my Grandmomma yesterday to leukemia. She was my last living grandparent...Wow. I absolutely…,10
Multi Vendor Garage Sale Benefitting The Leukemia & Lymphoma Soc... …,10
Meet our #Warrior of the week : Camille Reynolds ! #wednesdaywarriors @ Leukemia & Lymphoma…,10
I have leukemia. Join with me to help end this and other blood cancers. Consider donating via…,10
We were kissing cancer goodbye this afternoon! thank you to the Childhood Leukemia…,10
Our#existence ... end #bloodcancer . #LLSMSLA #LLS @ The Leukemia & Lymphoma Society…,10
#lightthenightwalk2016 #leukemia &lymphomasociety #sanantonio #sanantoniotexas #walking,10
The Leukemia and Lymphoma Society 18th Annual Light the Night Walk!… …,10
"OUTREACH ASSISTANT - TEMPORARY/PA-TIME - The Leukemia & Lymphoma Society - West Des Moines, IA: Proficientl...",9
. rants against socialized medicine and then in the next call tries to help someone not to go bankrupt from leukemia bills.,9
Come out to tonight at 7pm to support the Leukemia and Lymphoma society!!,9
We raised $186 last night for The Leukemia and Lymphoma Society! Thank you again to everyone who…,9
Meet our #warrior of the week : Reese! #warriorwednesday #LLSMSLA @ The Leukemia & Lymphoma…,9
"Such a harmwarming story, Thanks for sharing: Remission Possible: Malaki’s Recovery from Leukemia - …",9
#Imagine a #world without #cancer . @ The Leukemia & Lymphoma Society Mississippi/Louisiana Chapter,9
Come in and help us support the Leukemia Lymphoma Society! $20 gets you a chance see the tigers…,9
Sending lots of love and prayers to Nicole DeFeo and her baby boy Nate as he battles leukemia…,9
Award Winner! #thankyou #blessed #leukemia WOW! #teamratliff @ Pulaski County Courthouse,9
Light The Night walk in support of The Leukemia and Lymphoma Society… …,9
Help support Leukemia & Lymphoma patients by purchasing a tshirt… …,9
Why does LLS exist? #talkaboutittuesday #lls#llsmsla @ The Leukemia & Lymphoma Society…,9
Cuban flag with leukemia ribbon! Had a blast with this one! @ Boss Frog Tattoo's,9
"Fundraiser for Leukemia & Lymphoma, party on the poolside with Posh, ItWorks and Scentsy.…",9
Brain cancer replaces leukemia as the deadliest cancer for kids -,9
Brain cancer replaces leukemia as the deadliest cance for kids. -,9
"Brain cancer replaces leukemia as deadliest cancer for kids, study shows",9
Ted Poe on fight against leukemia: Attitude as important as treatment,9
Welcome to our new community partner Barbara Gordon Leukemia Bone Marrow Awareness! So excited…,9
Congressman Ted Poe on Fight Against Leukemia: Attitude as Important as Treatment,9
"Photographing the Leukemia & Lymphoma Society Lifeblood Awards (@ Woman's Club of Minneapolis in Minneapolis, MN)",9
Lakewood police replace stolen bag belonging to girl battling leukemia,9
"Fab wine, shoes and women (and men) winewomenandshoes benefitting leukemia and women's cancer…",9
"Out supporting Wine,Women and Shoes benefitting Leukemia and Women's Cancer Program @ Northside…",9
For Ernice #dctri #leukemia… …,9
Cheerleader with leukemia brought to tears by football players' kind act 10TV,9
Leukemia & Lyphoma APO Bake Sale! #service #alphaphiomega @ University of the Incarnate Word,9
2017 Leukemia Cup Planning Committee @ Southern Yacht Club …,9
Our sisters competed in Eric Berry's football tournament to help support the Leukemia and…,4
"Way to show up in smooth support of the Leukemia & Lymphoma Society last night, Indy! You've got…",4
"Kickin Leukemia's butt @ Allentown, Pennsylvania …",4
Professional Communication classes-making wishes real for child leukemia patients.…,4
Twitter peeps! Please check out why I'm running for the Leukemia/Lymphoma Woman of the Year! …,4
"Landry is stronger than any mortal man, but leukemia is his kryptonite. Let's help make him (and…",4
5 years ago today my beautiful cousin was diagnosed with leukemia. 5 years later she's still the…,4
Getting ready for the AFRMC #Broadway Benefit for AML #leukemia research at #Israel's…,4
Thank you to all. @ Chalet Brannan Leukemia Foundation,4
