tweet_text,month_of_tweetLight The Night Leukemia Walk #godcomesfirst #cancersucks… …,10
Churchville's McKenzie Woods battles leukemia pic.twitter.com/VoVDJQfLwb,10
Churchville's McKenzie Woods battles leukemia pic.twitter.com/5FSoLoA1Tn,10
Our Honored Hero of the week is Alli Mathis! #studentseries #squad #LLSMSLA @ The Leukemia &…,10
This is 6-year-old Bobbie. He has Downs Syndrome and Leukemia and because of his larger than…,10
Know the math of Myeloma . #somedayistoday #LLSMSLA #MYELOMA @ The Leukemia & Lymphoma…,10
Leukemia and Lymphoma Society Light the Night Walk 2017 We we’re… …,10
Youth football jersey numbers retired for boys with leukemia,10
The Leukemia & Lymphoma Society's LIGHT THE NIGHT DC 2017! So many amazing events over the…,10
Light The Night DC 2017 at the National Mall with the Leukemia & Lymphoma Society was…,10
We're walking for the CassieJames Foundation Inc at the Leukemia and… …,10
Light the night walk #LLS #leukemia #lymphoma Someday is today @ Light the Night Eisenhower Park,10
Raise awareness and give for the cure #lightthenighthalifax #lightupthenight #lymphoma #leukemia…,10
Met my g Jake yesterday told me he overcame leukemia and dropped his first project - Drove 3…,10
Light The Night #leukemiaandlymphomasociety @ Leukemia &… …,10
Can’t make it to the Leukemia & Lymphoma Society of Canada’s “Light The Night” event tonight?…,10
Leukemia and Lymphoma Society Walk #boston #lightthenight @ Boston Common,10
Met my g Jake yesterday told me he overcame leukemia and dropped his first project - Drove 3…,10
"In God we trust didn't raise any money da Leukemia night walk.Thanks anyways. Thank U Jesus Buster,Cindy, Niecie RIP pic.twitter.com/KyJOCzPVyD",10
Light the night Leukemia Lymphoma Society Celebrating my courageous Sister in…,10
Getting ready to emcee the annual #lightthenightwalk at Hemisfair Park to benefit the Leukemia &…,10
#LighttheNight events for the Leukemia & Lymphoma Society is about saving the lives of patients…,10
Light the night Leukemia Lymphoma Society Celebrating my courageous Sister in…,10
Celebrating my courageous Sister in law Light the night Leukemia Lymphoma Society Cooper River…,10
Working the phone bank for the Leukemia and Lymphoma Society! Help us raise money to fight blood…,10
Five Essential facts you should know about leukemia: 1) Leukemia is a cancer of the blood and…,10
#LighttheNight events for the Leukemia & Lymphoma Society is about saving the lives of patients…,10
Leukemia and Lymphoma walk about to kick off! #mpscancerfighters #cancersucks @ Mississippi Braves,10
"Leukemia Lymphoma Society Support Group Meeting (@ Florida Cancer Specialists & Research Institute in Lady Lake, FL)",10
Fight BLOOD CANCERS October 19 with us at the ltnontario walk supporting The Leukemia & Lymphoma…,10
My Mama. Is a G. She's been fighting her leukemia for 15 years strong and she still has smiles…,10
A cure to blood cancers is all we need ... #LLSMSLA #somedayistoday @ The Leukemia &…,10
"On this day 7 years ago I was diagnosed with Leukemia.... Hey cancer, This day is not a…",10
Light the night walk for Leukemia and Lymphoma. My granddaughter …,10
Leukemia and Lymphoma Society partnership night (10% of proceeds go to cancer research) (@ Hat Creek Burger Co.),4
"I loved Charlie Murphy. ""Ladies and gentlemen, make some noise!"" 57 tho, Jesus. Leukemia.…",4
#PhatGyrlSnoop #CharlieMurphy lost his long time battle with #leukemia today at the age of 57…,4
I've seen first hand what #leukemia does to an individual | #ripcharliemurphy | #fuckcancer,4
"Comedian Charlie Murphy, brother of Eddie, dies at 57 after battle with leukemia …",4
"#charliemurphy #comedian dies at 57 from #leukemia #Thank you for the #laughs RIP @ Boston,…",4
CHARLIE MURPHY DIES AT AGE 57 FROM LEUKEMIA. @ United States,4
Charlie Murphy Passes Away After Battle With Leukemia,4
Comedian Charlie Murphy dies at 57 after leukemia battle. …,4
"Comedian Charlie Murphy dies at 57 after battle with leukemia, TMZ reports",4
"Charlie Murphy, brother of Eddie Murphy has passed away today from Leukemia at the age of 57.…",4
Comedian Charlie Murphy died after losing his battle with leukemia. He was 57. #RIP @ Gotham…,4
"This sucks. charliemurphyig has left this world due to the battle of leukemia, but you've left…",4
TMZ: Charlie Murphy dead at 57 after leukemia battle …,4
"Comedian Charlie Murphy dies at 57 after battle with leukemia, TMZ reports. …",4
#HIPROFILEMAGAZINENEWS: Comedian Charlie Murphy Dead at 57 From Leukemia #RIPMURPHY #SIPCGARLIE… …,4
R.I.P. Buck Nasty. #charliemurphy #rip #april #leukemia #comedian #eddiemurphy #bucknasty…,4
#RIP He had a direct line to my funny bone. #leukemia is no joke though. @ The…,4
BREAKING Comedian Charlie Murphy Dead at 57 After Leukemia Battle tmz. RIP Charlie @ WPGC 95.5,4
"RIP Charlie Murphy...reports indicate he died from Leukemia! @ Houston, Texas",4
Standup comedian Charlie Murphy has died at the age of 57 from leukemia. The actor was also…,4
Comedian Charlie Murphy has died after leukemia battle. He was 57. …,4
"Oh Wow... #RIP Eddie Murphy's brother Charlie dead aged 57 ~ #leukemia #gonetoosoon @ Canton,…",4
Comedian Charlie Murphy Dead at 57 After Leukemia Battle....... GO TO for your…,4
#RIPCharlieMurphy Gone at 57 due to lost battle of Leukemia… …,4
""" #BREAKING Comedian Charlie Murphy Dead at 57 After Leukemia Battle """,4
Great to see the hard work for Phi Kappa Sigmas bike-a-thon for leukemia and lymphoma society.…,4
I'm honored to be a Leukemia & Lymphoma Society Woman of the Year candidate for #mobilealabama…,4
Sign up for the Laps for Leukemia or Home Run Derby! See Ms. Purcell in room 112 for details!,4
We had a great time tonight cycling for a cause and raising money for the Leukemia & Lymphoma…,4
"Ten months earlier, Naomi found out she had leukemia. Tests revealed she faced a rare battle.…",4
"Naomi Wilke, 8, has battled two kinds of cancer for the past 10 months. An 8-year-old leukemia…",4
Leukemia and Lymphoma Society enent!!!! AMAZING!!! #mangia #foodie #wine #bloodcancerawareness #…,4
ShertheLove Night of Fashion with Passion benefiting the Leukemia & Lymphoma Society MWOY…,4
"ShertheLove Night of Fashion with Passion benefiting the Leukemia, lymphoma Society. Please join…",4
"The day I go to a Leukemia & lymphoma society benefit, dinner fundraiser.. And run into Scott…",4
Leukemia Cup Poker Run Planning Committee Meeting #PokerRun #May20 …,4
"Help MHC end the deadly cycle of parvo, distemper, and feline leukemia! Get your pets…",4
Sharp-eyed school nurse saves boy after noticing signs of deadly leukemia,4
New Jersey school nurse spots boy's leukemia just in time »,4
regrann from - Dj raising money for Leukemia & Lymphomia Society in the…,4
The Leukemia & Lymphoma Society's Mississippi/Louisiana Chapter would like to congratulate and…,4
Soccer team rallied around teammate battling leukemia …,4
Soccer team rallies around teammate battling leukemia …,4
CC wearing her blueOcean orange bracelet in support of Leukemia. #childhoodleukemia…,4
Cocktail for a cause $1 from every drink sold will be donated to the leukemia and lymphoma…,4
Guess who won 2017 #IBERIABANK Leukemia Cup? #GoTeam #Zephyr …,4
Proud to be a part of this noble cause. Today we rocked it out in the name of The Leukemia &…,4
#SandVolleyball #TeamKimPossibleStl #Leukemia&LymphomaSociety #CharityEvent #CancerSucks…,4
"9 year old Angelika, battling leukemia and stealing the show at #curerock2017 These kids are…",3
Hello friends! I have the honor of teaching a ride benefiting the Leukemia & Lymphoma Society…,3
GOOD NEWS! St. Johns firefighter Pete Accorti rings bell after final leukemia treatment,3
Elijah I have feline leukemia but it doesn't stop me from being awesomesauce!!! @ Austin Humane…,3
St. Johns firefighter rings bell after final leukemia treatment,3
"Tuesday, 3/28 •Ft. Walton Beach Medical Center benefiting the Leukemia and Lymphoma Society 1000…",3
"One of my favorite clients, the Leukemia Lymphoma Society Houston Man and Woman of the…",3
"WBNS-TV chief meteorologist Chris Bradley has been diagnosed with acute myeloid leukemia, Bradley announced Monday.",3
Last week's Leukemia & Lymphoma Society MWOY Kickoff for team was an…,3
Good morning Monday my friends!! Last week's Leukemia & Lymphoma Society MWOY Kickoff for team…,3
"Curling for a Cure #Leukemia (@ Madison Curling Club in Mc Farland, WI)",3
F**K CANCER is right. Sporting my new F**K Leukemia lid from fuckcancerllc #leukemia…,3
"If you're at the Crest-Burns games, please donate to the Lymphoma and Leukemia Society! @ Burns… …",3
SOMEDAY JUST BECAME TODAY! The Leukemia & Lymphoma Society Man & Woman of the Year 2017 Campaign…,3
#TBT The wonderful and talented Jennifer sings for Music Cures Benefit Concert For Leukemia &…,3
Leukemia disguised as strep throat kills 10-year-old girl in days,3
Leukemia & Lymphoma Society Man & Woman of the Year kick-off event!,3
"Tuesday, 3/21 •Ft. Walton Beach Medical Center benefiting the Leukemia and Lymphoma…",3
8-year-old with leukemia fulfills professional lacrosse dream,3
"Fantastic effort by Molly Behan and Natalia Richards in raising over $27,000 for the Leukemia & Lymphoma Soc. & named students of the year.",3
8-year-old with leukemia fulfills professional lacrosse dream,3
So proud to say that I raised $1000 with my bff for the Leukemia &… …,3
So proud to share that I raised with my bff $1000 for The Leukemia &… …,3
I shaved my head to support a student fighting Leukemia! Please donate to the go fund me page in…,3
Today is the last day to donate to the link in my bio for the Leukemia & Lymphoma Society - help…,3
These wonderful retailers have partnered with the Leukemia Cup Regatta Campaign for the month of…,3
So honored to be nominated as a National All Star in the 2017 Leukemia & Lymphoma Society’s Man…,3
Attending the Leukemia and Lymphoma Society's Red and White Ball with this babe angieg033 who…,3
We are devastated to share the news that after a long battle with Leukemia our dearest friend…,3
What an honor to have David Hogan rebuke the assignment of #Leukemia from our family today! The…,3
Celebrating 30 years of the Leukemia Ball with my wonderful friend… …,3
The leukemia ball in Washington DC produced by Hargrove and others at the convention center –…,3
Leukemia Ball @ Walter E. Washington Convention Center,3
"Whenever I found out I had leukemia, I kind of expected some people… …",3
Tonight is the night!!! #LLS #Leukemia #Lymphoma #Society…,3
"Distemper, parvo, feline leukemia, and rabies are real threats to pets in this area, are costly…",3
