tweet_text,month_of_tweetLight the night Leukemia Lymphoma Society Celebrating my courageous Sister in…,10
Celebrating my courageous Sister in law Light the night Leukemia Lymphoma Society Cooper River…,10
Working the phone bank for the Leukemia and Lymphoma Society! Help us raise money to fight blood…,10
Five Essential facts you should know about leukemia: 1) Leukemia is a cancer of the blood and…,10
Leukemia and Lymphoma walk about to kick off! #mpscancerfighters #cancersucks @ Mississippi Braves,10
"Leukemia Lymphoma Society Support Group Meeting (@ Florida Cancer Specialists & Research Institute in Lady Lake, FL)",10
My Mama. Is a G. She's been fighting her leukemia for 15 years strong and she still has smiles…,10
A cure to blood cancers is all we need ... #LLSMSLA #somedayistoday @ The Leukemia &…,10
Light the night walk for Leukemia and Lymphoma. My granddaughter …,10
"Gettin ready for this charity event benefiting the Leukemia and Lymphoma Society at Cities, hope…",5
What is #StudentSeries ? #LLSMSLA @ The Leukemia & Lymphoma Society Mississippi/Louisiana…,5
This date 8 years ago my best friend passed away from leukemia. This… …,5
SHOP FOR A CAUSE @ ATHLETA!Thank you GAP ATHLETA in Tyson's Corner for supporting our Leukemia &…,5
Come support the LEukemia & Lymphoma Society and network with locals… …,5
THU MAY 18 Fight for Lily! Benefit for The Leukemia & Lymphoma Society! DC PRIME STEAKS - PAY…,5
#Repost (get_repost) ・・・ Support the Leukemia and Lymphoma Society at the For A…,5
The Leukemia & Lymphoma Society (LLS) applauds the approval of Keytruda as an important step…,5
THU MAY 18 BENEFIT FOR The Leukemia & Lymphoma Society! DC PRIME STEAKS - PAY WITH A…,5
We represented well for Chloe at Friday nights Leukemia and Lymphoma Gala. Our crew was 20…,5
"The Leukemia & Lymphoma Society (LLS) and the SAGERSTRONG Foundation announced on 2nd May 2017,…",5
A Night of Fashion with Passion and hands on people! #celestino #lymphoma #leukemia…,5
THU MAY 18 BENEFIT FOR LEUKEMIA & LYMPHOMA SOCIETY! DC PRIME - PAY WITH A PURPOSE! My fellow…,5
Celebrating our little warrior at the Leukemia and Lymphoma Society Man and Woman of the Year…,5
We are proud supporters the Leukemia & Lymphoma Society! Here we are presenting a check to Frank…,5
"Join the crowd, please give generously and support The Leukemia & Lymphoma Society! @ The Casual…",5
Amazing time with amazing friends at last night's Leukemia & Lymphoma Society gala! @ Orlando…,5
Had an awesome time at the Man and Woman of the Year Gala. To support the Leukemia and Lymphoma…,5
Please join us at 6pm for our fundraiser for the Leukemia & Lymphoma Society with Frank Murphy…,5
"FYI #Donors. #StJudes marked this month's rounds ""Urgent & Rush"". #Leukemia. #Cancer is... pic.twitter.com/E7Fii8SVr4",5
Next #Saturday Im hosting a #leukemia & #lymphoma #charity #happyhour!!! Come thru cuz…,5
"Over the past 10 weeks $700,000 was raised for the The Leukemia & Lymphoma Society! Proud to…",5
"Hi! The Leukemia Cup Poker Run is only 9 days away on Saturday, May… …",5
Thanks to everyone that attended the Passport Happy Hour to benefit The Leukemia & Lymphoma…,5
What is Man & Woman of the Year? #MWOY #LLSMSLA @ The Leukemia & Lymphoma Society…,5
At a #fancy #gala for the Leukemia & Lymphoma Society with these #classy folks! #mwoy #mwoycle17…,5
"Join us tomorrow for a great cause! #leukemia #lymphoma #kidscancer @ Hermosa Beach, California",5
Great night at the MWOY event for Leukemia and Lymphoma Society. Jared Emmerson nailed it! @ Zen…,5
Couple more weeks before the 45K skate to support The leukemia & lymphoma society. Another 20K…,5
"I had leukemia. Now I don't. So you should come to this. Tuesday,… …",5
Ceramics students at FHS recently dedicated a week to create over 200 Leukemia awareness ribbons…,5
Had a great live show today with my nephew who shared his story on how he overcame leukemia!!…,5
Come out tomorrow to support a great cause and charity for the Leukemia and Lymphoma Society. I…,5
"Joshua, leukemia survivor, says to donate to … #MidlandsGivespic.twitter.com/14BxwOZmCv",5
Love for Life: Date for the Cure Leukemia & Lymphoma Society Date Auction,5
Every $ counts ! #LLSMSLA #leukemialymphomasociety #ThankYou @ The Leukemia & Lymphoma…,5
Had a great day yesterday raising money for the Leukemia and Lymphoma Society! Just a reminder…,4
Having such a great time #greatgasby fundraiser for leukemia! #yelpelite #yelpva…,4
Listening to a song you used to listen to all the time > having your cat die of feline leukemia,4
"Join us on the WET Deck on Friday, 4/28 for the Black Swan Masquerade Benefit, a Leukemia &…",4
"Carol Holt Elementary raises over 3,000 for Leukemia & Lymphoma Society",4
Creating a #world without #cancer . #LLSMSLA #beataml #somedayistoday @ The Leukemia &…,4
"Lucia, 6 with leukemia, loves camels, dragons, Aladdin, and all things mystical and enchanting.…",4
Hey Instagram Friends. As most of you heard Kelsey was diagnosed with leukemia recently and it…,4
Just a few beautiful Texas angels who came out to support our Leukemia & Lymphoma Society MWOY…,4
Then THIS happened!! lfcchurch member Alisa Washington has been battle Leukemia. After being…,4
"In 1984, before my oldest brother died of #leukemia, stopped by and busted with…",4
Enjoyed the evening supporting The Leukemia and Lymphoma Society! …,4
2 months ago my little sister Jada was diagnosed with Leukemia. You never know your whole world…,4
"Support the Leukemia Lymphoma Society today by giving back ! All sizes, different color ways,…",4
Just finished working the #leukemia and #lymphoma charity event.… …,4
"When she was 42, she was diagnosed with Leukemia. Doctors said she'd live another 12 years.…",4
BankSouth Mortgage is a proud supporter of the The Leukemia &… …,4
Mata-Match! For the thousands diagnosed every year with blood cancers like leukemia and…,4
"As many of you know, I have been nominated for the Man & Woman of the year for The Leukemia &…",4
Working #together towards a #cure #LLSMSLA #somedayistoday @ The Leukemia & Lymphoma…,4
This Thursday is our annual Crawfish Boil benefiting the Leukemia… …,4
Every $ counts ! #LLSMSLA #somedayistoday @ The Leukemia & Lymphoma Society…,4
"PREVENT Parvo, Distemper, Feline Leukemia, and many other viruses by having your pet fully…",4
"#xx coachella L = #Lupus #LGL #leukemia representing & still going, never give up #livelovedance…",4
"9-year-old battles leukemia, continues to attend class ... virtually. …",4
Come support me as I raise money and awareness for the Leukemia & Lymphoma Society in honor of…,4
"Helping to fight blood cancers through fashion, supporting the Leukemia and Lymphoma Society.…",4
"Headed Out to The ""Keep Calm and Tropics on Charity Happy Hour"" benefitting the Leukemia and…",4
Comedian Charlie Murphy dead at 57 following leukemia battle …,4
"So sad to hear about Charlie Murphy passing, due to losing his battle with Leukemia..A very…",4
Our sisters competed in Eric Berry's football tournament to help support the Leukemia and…,4
"Way to show up in smooth support of the Leukemia & Lymphoma Society last night, Indy! You've got…",4
"17 years ago today, I was diagnosed w Leukemia. I endured 2.5 years of chemotherapy and never…",4
The Diamond Girls presents an Evening of Brilliance. This lovely man donated to the Leukemia &…,4
Professional Communication classes-making wishes real for child leukemia patients.…,4
Twitter peeps! Please check out why I'm running for the Leukemia/Lymphoma Woman of the Year! …,4
Oakland student taking friend battling Leukemia to Warriors game w/ tix from Draymond Green.,4
"Landry is stronger than any mortal man, but leukemia is his kryptonite. Let's help make him (and…",4
5 years ago today my beautiful cousin was diagnosed with leukemia. 5 years later she's still the…,4
Thank you to all. @ Chalet Brannan Leukemia Foundation,4
"Kiss the Pig benefits the Leukemia and Lymphoma Society. Every 3 minutes, someone in the United…",4
"My older brother, Denny, succumbed to leukemia one day before his 9th birthday. He was the 8th…",4
Raising money for The Leukemia and Lymphoma Society. Come and join us. @ The Casual Pint -…,4
Please help me in my journey to rise money to help researchers find a cure for #leukemia…,4
"""Leukemia & Lymphoma Society FUNdraising Event! #paintpartymiami #paintpartystudio…",4
"""Leukemia & Lymphoma Society FUNdraising Event""! #paintpartymiami #paintpartystudio…",4
Amazing #RunwayHouston benefiting the #Leukemia&lymphomasociety and #houstonchildrengiveback .…,4
Orange flowers from my students at They didn't even know orange is the color of #leukemia…,4
Texas Men of Excellence's 3rd annual Lights out for Leukemia Gala… …,4
"With 12-year-old Boy of the Year, Connor Pavlista, getting ready to kick off the Leukemia…",4
We're all winners when we band together to beat lymphoma and leukemia. (But this risedtwndurham…,4
Sound Soirée presents A beautiful night of music benefiting The Leukemia Lymphoma Society with…,4
#TBT in lieu of today's Runway Houston event benefiting the Leukemia and Lymphoma Society and…,4
Thank you to everyone that attended our philanthropy event tonight for Leukemia and Lymphoma…,4
Brotherly Love: Leukemia Patient's Wish Is Granted After Meeting Ukee Washington,4
MISD Teacher Shares His Battle with Leukemia,4
He's excited to take a selfie; I'm excited to help him beat Leukemia. Please join me in…,4
San Diego girl with Leukemia inspires bone marrow drive.,4
Poway girl with Leukemia inspires bone marrow drive,4
Poway girl with Leukemia inspires bone marrow drive,4
It's our Leukemia and Lymphoma society fundraiser at Mimi's Cafe. So far we've raised $170!,4
"Presenting my research on feline leukemia virus at the Undergraduate Symposium, check",4
The silent auction for Leukemia & Lymphoma Society @ Hops & Fire Craft Tap House,4
Let's get this started! Tonight was the kick-off to the Leukemia &… …,4
Another fabulous fundraiser for Leukemia and Lymphoma Society Man of… …,3
Hops and Fire hosting Beer & Bourbon Dinner tonight for the Leukemia & Lymphoma Society. @ Hops…,3
Please join me in supporting the leukemia & Lymphoma society by making a donation to my…,3
A great event at Cycle Hub for Team and Training Leukemia and Lymphoma society. Thanks for those…,3
This Popovich and Craig Sager Lapel Pin Supports Leukemia Research,3
I'm at MD Anderson Cancer Center Hospital Wing Leukemia Unit,3
Restaurant donating 20 percent of Monday's proceeds to boy fighting leukemia KSATnews,3
"Proceeds of pin featuring Craig Sager, Coach Popovich to benefit leukemia research mySA …",3
she is coming back to the #hospital #OLOL #thanksGod #leukemia #chemotherapy @ Our Lady of the…,3
Even the hospitals in Florida have goofy socks. #leukemia @ Sacred Heart Hospital of Pensacola,3
Join us for this FUNdraising event on Thursday 4/7 at 8:00 pm to benefit the Leukemia & Lymphoma…,3
Just ran (OK mostly walked) the #boltrun 5k with benefiting the Leukemia and…,3
Join us in helping Tyler Sieswerda fight Leukemia and Lymphoma here …,3
I love his drive and determination to beat Leukemia at the age of three... He loves my purple…,3
Boy battling leukemia sworn in as police officer,3
Raising awareness for Leukemia and Lymphoma. @ Tennova Healthcare/Hospital,3
FOX 29 at Locks of Love event at Blair Mill Elementary for a 2nd grader battling Leukemia.Hatboro …,3
#drjaycalvert Ace is kicking off the fund raising campaign tonight for the Leukemia & Lymphoma…,3
#drjaycalvert so proud of Ace for beating the pants off of his Leukemia. He's boy of the year…,3
""" Leukemia has returned. Craig Sager in big battle for his life...Prayers Please …""Always!",3
7-year-old boy battling leukemia becomes honorary police officer. …,3
Boy battling leukemia sworn in as Gloucester Township police officer,3
Yay! My little #warrior #princess that was #battling #leukemia for two #years is now #healthy…,3
Leukemia and Lymphoma Society's 2016 Blood Cancers Conference with… …,3
Glo For A Cure Tournament benefiting Lymphoma & Leukemia @ Intuit… …,3
They think he may have cancer. Possibly leukemia. We won't know till next week,3
Biden's Cancer Moonshot Will Be Led By Leukemia Survivor Greg Simon …,3
Read on about the leukemia outbreak in Serbia. Really laughable!,3
I met this little #warrior #princess #fighting #leukemia about two #years ago and I and beyond…,3
"Fingers crossed My Leukemia hasn't gotten worse. (@ Hematology And Oncology in Murrieta, CA)",3
Inspirational Quote 8: Let's all cheer Cory Cohen up with his battle against leukemia.…,3
"#throwback to last night at the 2016 Leukemia Ball with the WTOP crew. What a great night, for a…",3
"#health #wellness #leukemia Splenda ingredient, sucralose, linked to leukemia. pic.twitter.com/GJUIP5Rzl7",3
"Splenda ingredient, sucralose, linked to leukemia.",3
My 15th Leukemia Ball with awesome Redskins LB Ryan Kerrigan and the blonde squad so…,3
"Raising money for Leukemia and Lymphoma research!!!!' @ Channelside Bay Plaza, Tampa",11
Dropping by to thank Burlington for their efforts on behalf of the Leukemia and Lymphoma... pic.twitter.com/KNnhQUCshN,11
I wrote my MPH thesis about AE reporting in peds leukemia trials!,11
"#Repost with repostapp ・・・ Join the Leukemia & Lymphoma Society on Friday, November…",11
A student army school was recently diagnosed with leukemia... all… …,11
"Batkid, diagnosed with leukemia at just 18 months, now in remission",11
Working towards a cancer-free world. #lls #llsmsla #tbit #talkaboutittuesday @ Leukemia &…,11
"ONLY 3 DAYS LEFT TO JOIN SMOOTHIE WHIRL'DS TEAM in the ""Light the Night Walk"" for the Leukemia &…",11
Outchea ! Who not involved with the community? Walk for leukemia &… …,11
"Robert Vaughn died Friday morning after a brief battle with acute leukemia, according to his manager.",11
All finished!! We support the Leukemia & Lymphoma Society!! Come in today and donate a…,11
Our warrior of the week is Gracie Atwood #warriorwednesday #LLS #LLSMSLA @ Leukemia and…,11
Every dollar counts ... #tbit #lls #llsmsla @ Leukemia & Lymphoma Society,11
The Leukemia and Lymphoma Society is going on the offensive against acute myeloid leukemia (AML)…,11
It's lit this Sunday come show support for this child's leukemia at the car show event where all…,11
Light the Night walk for Leukemia! This is our second year the… …,11
On the mic tonight for the Light the Night walk raising money for the Leukemia & Lymphoma…,11
Light the Night Leukemia Walk 2016. #lovinglife… …,11
We are also supporting the #Leukemia/Lymphoma Society by launching medalions pic.twitter.com/lryMj7mojj,11
Community hosts blood drive for 6-year-old fighting Leukemia.,11
"dude had leukemia too, like come on",11
"""Light the Night Walk"" raising money with my girls for Leukemia and… …",11
Supporting the Leukemia & Lymphoma's Light the Night Walk! …,11
Superheroes and Survivors at #lightthenight #leukemia #lls …,11
"This December, I'll be competing in The Spartan Race to help raise funds for The Leukemia &…",11
"This is the face of a six year old battling leukemia, undergoing… …",11
Working towards a cancer-free world. #lls #llsmsla #tbit #talkaboutittuesday @ Leukemia and…,11
Brendan is almost 2 years old and unfortunately he has been diagnosed with leukemia. It was a…,10
Happy Halloween! The Leukemia & Lymphoma Society will be benefiting from every guest who dares…,10
I'm feeling a little mischievous tonight. Ps. all parking proceeds go to Leukemia Research.…,10
Light the Night walk for Leukemia and Lymphoma. White lanterns for… …,10
Leukemia and Lymphoma Society Light the Night @ Little Rock River Market,10
Our warrior of the week is Davis Spicer ! #warriorwednesday @ Leukemia and Lymphoma…,10
Perfect night for the Leukemia & Lymphoma Society's Light the Night… …,10
13-year-old girl with leukemia running Hot Chocolate 5K to support charity that helped her...,10
Our #research aims towards one goal: ending #bloodcancer . #LLS #LLSMSLA #beatcancer @ Leukemia…,10
"Fortville toddler raises over $1,100 for friend with leukemia",10
Awesome #LightTheNight walk last night to support the Leukemia and Lymphoma Society with my…,10
So glad frank & I were able to do the light the night walk again for lymphoma and leukemia in…,10
Working the Leukemia & Lymphoma Society’s (LLS) 2016 Light The Night Walk #LightTheNight…,10
itsguerin lighting the white survivor lanterns at the leukemia lymphoma society Light the Night…,10
Here at the Light the Night Leukemia &a Lymphoma Society… …,10
Thank you to everyone who came out to support our happy hour fundraiser for the Leukemia and…,10
#thejorgemichaelshow showing support to the beautiful at the Leukemia and Lymphoma…,10
My moms care team #lightthenightwalk @ The Leukemia & Lymphoma… …,10
Had a great time singing for the Leukemia &a Lymphoma Society's Light the Night Walk! A splendid…,10
Was at the Light The Night: Leukemia and Lymphoma Society walk last night with amazing people!…,10
Looking good! Our guy is not letting leukemia get the better of him. He's a…,10
Great event tonight for the Leukemia & Lymphoma Society!! Such a great cause with wonderful…,10
We'll be hosting a fundraiser for the Leukemia & Lymphoma Society in honor of evanlessler as…,10
Happy Hour + Fundraiser tomorrow 6pm to 9pm at Somar. Percentage of bar going to the Leukemia &…,10
Happy Hour + Fundraiser tomorrow 6pm to 9pm at Somar. Percentage of bar going to the Leukemia &…,10
At MD Anderson Leukemia Center for my follow up with my Oncologist Dr. Kantarjian. #LeukemiaAwareness #CancerSucks – at Leukemia Center,10
Light the Night Leukemia walk laser show this past Saturday. #garvomusic @ Wilson Farm Park,10
Light the Night Leukemia walk on Saturday 10/15/2016. Such a wonderful cause and I'm grateful to…,10
Someday is today ... #tbit #lls #llsmsla @ Leukemia and Lymphoma Society La,10
7-year-old boy with leukemia runs for touchdown in League City,10
The Leukemia & Lymphoma Society's Light The Night Walk funds research to find cures and ensure…,10
The Leukemia & Lymphoma Society's Light The Night Walk funds research to find cures and ensure…,10
Proud sponsor of Leukemia Society fundraiser in Downtown Sacramento! #LoveWhatWeDo #88TEQUILA…,10
The Leukemia and Lymphoma Society #lightthenight #support @ Ronald Reagan…,10
Stem cell donor meets Leukemia survivor at Celebration of Life event in Phoenix,10
Let's all arrive early tomorrow to support this sweet little girl in her battle with #leukemia…,10
"Here supporting a wonderful cause, The Leukemia & Lymphoma Society's Light the Night Walk, on a…",10
"Keeping up the fight to stop #bloodcancer (@ The Leukemia and Lymphoma Society of Indianapolis in Indianapolis, IN)",10
Rest In Power ... One of my all time favorite skaters passed away from leukemia today. My heart…,10
I am so happy and feel so blessed every time I get a good doctors report on my leukemia! All's…,10
Boy with leukemia and lymphoma scores touchdown of his dreams,10
"Superheroes, survivors of Leukemia Lymphoma Society at the LLS Light The Night 2016 Walk at…",10
#education #jobs Telephone Outreach Assistant - Part-time/Temporary - The Leukemia & Lymphoma Society - Harri...,10
"#sales #jobs Telephone Outreach Assistant - Part-time/Temporary - The Leukemia & Lymphoma Society - Harrisburg, PA",10
#customerservice Telephone Outreach Assistant - Part-time/Temporary - The Leukemia & Lymphoma Society - Harri...,10
"My survivor, her supporters #lightthenight #lymphoma #leukemia @ Wade Oval",10
So proud to work for The Leukemia & Lymphoma Society in memory of my mom. What an inspiring and…,10
Supporting leukemia & lymphoma society tonight in the Lite the Nite walk! @ Warner Center Park,10
So thankful for all that the Leukemia and Lymphoma Society do on a… …,10
"I have some bad news. Today, I was diagnosed with Acute Myeloid Leukemia (AML.) On Monday, I…",10
We are so honored to be a part of tomorrow's #Leukemia and #Lymphoma Society's #LightTheNight…,10
When our 11yr old niece finishes chemo and has no new leukemia cells...you take funny selfies.…,10
"The Ambassadors did their part to ""Light the Night"" for Lymphoma and Leukemia…",10
#tbt to when #Nashville star #charlesesten and #leukemia #survivor daughter Addie joined Light…,10
Lost my Grandmomma yesterday to leukemia. She was my last living grandparent...Wow. I absolutely…,10
Multi Vendor Garage Sale Benefitting The Leukemia & Lymphoma Soc... …,10
Meet our #Warrior of the week : Camille Reynolds ! #wednesdaywarriors @ Leukemia & Lymphoma…,10
I have leukemia. Join with me to help end this and other blood cancers. Consider donating via…,10
We were kissing cancer goodbye this afternoon! thank you to the Childhood Leukemia…,10
Our#existence ... end #bloodcancer . #LLSMSLA #LLS @ The Leukemia & Lymphoma Society…,10
#lightthenightwalk2016 #leukemia &lymphomasociety #sanantonio #sanantoniotexas #walking,10
The Leukemia and Lymphoma Society 18th Annual Light the Night Walk!… …,10
Please keep Danielle in your prayers... She has Leukemia and we are believing she is healed!…,10
"OUTREACH ASSISTANT - TEMPORARY/PA-TIME - The Leukemia & Lymphoma Society - West Des Moines, IA: Proficientl...",9
Come out to tonight at 7pm to support the Leukemia and Lymphoma society!!,9
We raised $186 last night for The Leukemia and Lymphoma Society! Thank you again to everyone who…,9
Meet our #warrior of the week : Reese! #warriorwednesday #LLSMSLA @ The Leukemia & Lymphoma…,9
#Imagine a #world without #cancer . @ The Leukemia & Lymphoma Society Mississippi/Louisiana Chapter,9
Come in and help us support the Leukemia Lymphoma Society! $20 gets you a chance see the tigers…,9
Sending lots of love and prayers to Nicole DeFeo and her baby boy Nate as he battles leukemia…,9
9.24.16 Leukemia & Lymphoma Society's Light The Night Walk Stadium with my Irvine…,9
Award Winner! #thankyou #blessed #leukemia WOW! #teamratliff @ Pulaski County Courthouse,9
Light The Night Walk for Leukemia and Lymphoma Society. #lls #lightthenightwalk #angelsstadium,9
September is Blood Cancer Awareness Month and is fundraising for the Leukemia and…,9
"As some of you know, Amellia is high risk to develop leukemia until she's 3 and we have to do…",9
Help support Leukemia & Lymphoma patients by purchasing a tshirt… …,9
Why does LLS exist? #talkaboutittuesday #lls#llsmsla @ The Leukemia & Lymphoma Society…,9
"Young Rocklin Girl Diagnosed with Leukemia on a Mission to Bring Awareness to Childhood Cancer, Raise Money…",9
Cuban flag with leukemia ribbon! Had a blast with this one! @ Boss Frog Tattoo's,9
"Fundraiser for Leukemia & Lymphoma, party on the poolside with Posh, ItWorks and Scentsy.…",9
Today's Childhood Cancer Awareness Education is about the second most common form of leukemia…,9
Brain cancer replaces leukemia as the deadliest cancer for kids -,9
Brain cancer replaces leukemia as the deadliest cance for kids. -,9
"Brain cancer replaces leukemia as deadliest cancer for kids, study shows",9
Ted Poe on fight against leukemia: Attitude as important as treatment,9
Welcome to our new community partner Barbara Gordon Leukemia Bone Marrow Awareness! So excited…,9
Congressman Ted Poe on Fight Against Leukemia: Attitude as Important as Treatment,9
Media/Reporters HRC has pneumonia NOT leukemia~Most men~NOT all~are Sissys If it were up to men having children There would be NO babies!,9
"Baby #SamarStrong after sharing candy, the #Maulino clan are now her favorites #Leukemia…",9
Lakewood police replace stolen bag belonging to girl battling leukemia,9
"Fab wine, shoes and women (and men) winewomenandshoes benefitting leukemia and women's cancer…",9
"Out supporting Wine,Women and Shoes benefitting Leukemia and Women's Cancer Program @ Northside…",9
"#gogold #MLB #Repost with repostapp ・・・ Jayden, a young boy with leukemia, met Bob…",9
For Ernice #dctri #leukemia… …,9
Cheerleader with leukemia brought to tears by football players' kind act 10TV,9
Leukemia & Lyphoma APO Bake Sale! #service #alphaphiomega @ University of the Incarnate Word,9
2017 Leukemia Cup Planning Committee @ Southern Yacht Club …,9
#leukemia Fundraiser! Raising money for a good cause! Great time down here in Hammock Beach,6
"After battling and defeating Acute Myeloid Leukemia for the second time, all CFC scholar Vivian…",6
"Mayah, 8 with leukemia, went to #Disneyland for her wish! @ Disneyland",6
At the Executive Luncheon for the Leukemia & Lymphoma Society diacussing the impact of cancer in…,6
Our mission. #LLSMSLA #leukemialymphomasociety @ The Leukemia & Lymphoma Society…,6
"Olive, 4 with leukemia, wished to go to #Disneyland! @ Disneyland",6
Beautiful evening supporting the Leukemia & Lymphoma Society and their Man & Woman of the Year!!…,6
"Coach Val, Justine and me. Father's Day 5K to benefit the Leukemia and Lymphoma Society #5k…",6
Spent my Saturday night volunteering at the Leukemia & Lymphoma… …,6
Last Saturday you may remember we partnered with the Leukemia Lymphoma Society ... We…,6
The Leukemia and Lymphoma Society …,6
