tweet_text,month_of_tweet
"Oh chad, i have been called ‘guy’ and also kaposi’s sarcoma.",3
"This alone should make us “see” many things – where it begins and where it is significant, and also kaposi’s sarcoma.",2
Our pelvic sarcoma survivor from alzahra cancer center dubai operated upon by the soft tissue…,10
"July 13th is GIST Awareness Day . GIST is a rare cancer , a type of sarcoma found in the…",7
"Secret fact: Americans drive on the doors are locked. The pharmacist has only chocolate laxative, and also kaposi’s sarcoma.",7
