tweet_text,month_of_tweet"Cancer Means: Fight, Love, Hope #cancerjourney #motivation #inspiration #women…",10
I'm at National Cancer Centre in Singapore,10
Charmaine Seah. #WoWInPink . In support of Breast Cancer Awareness month and the Breast Cancer…,10
Had an awkward hand moment just now at Estee Lauder's Breast Cancer Awareness event with…,9
#blessedbirthdayNancy #scscolleague @ Singapore Cancer Society …,9
#lunchtimestaffwelfare #scs @ Singapore Cancer Society …,9
MCRX // Cancer & Disenchanted (@ Jalan Mawar 48),9
"The pink ribbon is an international symbol of breast cancer awareness. Pink ribbons, and the…",9
"At KPJ Johor Specialist Hospital, meeting clients for National Cancer Conference to be held in Nov.",9
coming here gives me cancer lol (@ Suntec City Mall in Singapore),9
I'm at National Cancer Centre in Singapore,9
Drinking in support of cancer research @ Singapore Botanic Gardens,9
Science. @ Cancer Science Institute,9
Fruitful way to start the weekend! #volunteer #scs #gastric and #colorectal #cancer talk,9
"#Repost james_awyong with repostapp ・・・ “Fight Cancer Together, One… …",9
