tweet_text,month_of_tweet
Cancer is not a death sentence. Fight on. @ VivoCity,9
Just found out that an ex colleague's wife passed away today due to cancer. :( They only got married last year...,9
“Bitterness is like cancer. It eats upon the host. But anger is like fire. It burns it all…,8
Fight until it's finished. Powerful message dari atlet triathlon yang kena cancer… (at [vid] —,8
Doing our part to raise money for the Singapore Cancer Society :) drop by the AXA booth at Nex…,8
Thank you so much to Breast Cancer Foundation #Singapore for sponsoring our…,8
Cancer is like a roller-coaster? But roller-coasters usually don't kill you (@ The Academia) pic.twitter.com/qBsXlSSfVI,6
With cancer survivors who are volunteering at the Singtel-SCS Race… …,6
#pathdaily (at National Cancer Centre) [pic] —,6
""" Listen to God with a broken heart. He is not only the doctor who mends it, but… (at National Cancer Centre) —",6
May God heal me body and soul. (at National Cancer Centre) —,6
The Singtel-Singapore Cancer Society Race Against Cancer (RAC) is… …,6
regram #KICKPICSkickinCANCER #2016ATAWorldChampionships #CANCER - #ATA…,6
I think i got cancer,6
ccfsingapore discussing the stages that kids with cancer undergoes… …,6
Need to prevent prostate cancer …,6
"Rehearsal for rachael_he ""The Fight Against Cancer"" this coming sat… …",6
"Cancer fall in love with those who are comfortable - who fit right, are fun to be around, loyal…",6
"Cancers are selfish eaters & hate sharing food, so if they share their food, they must really…",6
"Cancer Traits: Can be unrealistic, evasive, passive, anxious, dependent, stubborn, moody, lazy &…",6
"Wonderful time hearing about Daphne's story, her spunkiness and #faith in the face of #cancer,…",6
"Cancers won't lie to you, but they may avoid telling the truth. #cancerhoroscope #june2017…",6
Early greeting. #cancer @ Singapore,5
Early greeting. #cancer @ Singapore,5
Early greeting. #cancer @ Singapore,5
#singaporecancersociety women gynecological cancer GP symposium ...… …,5
SCS Team Stewardship! #singaporecancersociety @ Singapore Cancer… …,5
":: LIVE UPDATES :: All set! Ready to go... World Cancer Survivors' Day Location: The Vibe,…",5
Awesome Possum Mothers Day Event in support of Cervical Cancer awareness and in aide for Juliana…,5
Work on a Saturday. Sigh. (@ National Cancer Centre in Singapore),3
"TGIF, but work tomorrow. Sigh. (@ National Cancer Centre in Singapore)",3
Another 50 more mins to go. (@ National Cancer Centre in Singapore),3
I'm at National Cancer Centre in Singapore,3
I'm at Thomson Women Cancer Centre in Singapore,3
I'm at National Cancer Centre in Singapore,3
I'm at National Cancer Centre in Singapore,3
Friday is here. TAHAN!! (@ National Cancer Centre in Singapore),3
#Singapore Cancer Society partnering American Cancer Society in the… …,3
I'm at National Cancer Centre in Singapore,3
I'm at National Cancer Centre in Singapore,3
At Parkway Cancer Centre (Mount Elizabeth Hospital) —,3
平安 @ Concord Cancer Hospital Singapore …,2
I'm at National Cancer Centre in Singapore,2
The tired is real. (@ National Cancer Centre in Singapore),2
"""Leo and Cancer are neighbours in the zodiac and typically get along… …",2
I'm at National Cancer Centre in Singapore,2
I'm at National Cancer Centre in Singapore,2
Showing our support for Children's Cancer Foundation by wearing the golden ribbon!…,2
"Meh.... (@ National University Cancer Institute, Singapore)",10
PostOp checkup today! @ Thomson Medical Cancer Specialist - Dr… …,10
I'm at Breast Cancer Foundation,9
My Lunch at work #lunchtime #lunchatwork @ National Cancer Centre Singapore,9
A memorious meeting between leaders of Singapore Cancer Society (led… …,9
I'm at National Cancer Centre in Singapore,9
Cancer (@ Singapore in Singapore w/,9
At National Cancer Centre —,5
Feeling really emotional when my good friend's brother is diagnosed with end stage liver cancer.…,5
#projekKasih tonight LIVE! #cancer #donate #cancersucks @ Singapore,5
"Today we run for cancer.. this is for the survivors, for the fighters and for all the hero. This…",5
I personally take #Turmeric #Supplements for these health benefits … Fights #Cancer #Alzheimer #Inflammationpic.twitter.com/18eecT7tb9,4
#singaporecancersociety staff #keepfit session! @ Singapore Cancer… …,4
“Time is shortening. But every day that I challenge this cancer and survive is a… (at National Cancer Centre) —,4
Health benefits of drinking green beer prevents prostate cancer. @ Skylight Lounge,4
Now I'll have to see the doctor every one year!! @ National Cancer Centre Singapore,4
SCS Gastric Cancer Awareness Month Public Forum - know your diet and… …,8
SCS Gastric Cancer Awareness Month Public Forum - know your diet and… …,8
Wil Dasovich diagnosed with cancer …,8
"Jason Chee, medal-winning para-athlete, loses right eye to cancer …",8
#singaporecancersociety Zumba performance by cancer survivors at the… …,8
wenpei_ is 14 years old and she is a cancer fighter. Was privileged to cut her hair off as she…,7
30.07.2017 Race Against Cancer 2017 1. With 10km 1:00 pacer group. So good to have experienced…,7
Completed Race Against Cancer 15km in 1:27:07 hr with 5:48 min/km pace. Out-ran the 6min/km…,7
At work attending customer's committee meeting (@ National Cancer Centre in Singapore),5
Happy birthday ernch @ Singapore Cancer Society …,5
I'm at National Cancer Centre in Singapore,5
Celebrating all these wonderful ladies with ainsociety. #mothersday #cancer @ Royal Palm Singapore,5
I'm at National Cancer Centre in Singapore,4
Tired~ (@ National Cancer Centre in Singapore),4
#love972 #waisee2016 #waiseeatwork pls come to support 颜黎明，LOVE 972，VIVA Children Cancer…,4
I'm at National Cancer Centre in Singapore,4
I'm at National Cancer Centre in Singapore,4
"“I heard starlight gives you cancer, then again what doesn’t these days” LOLOLOL",4
I'm at National Cancer Centre in Singapore,4
I'm at National Cancer Centre in Singapore,4
Terry Fox Run 2017 Singapore Cancer Society Angsana Green East Coast Park Singapore 26 February…,2
"#sgcancersociety cancer survivors, volunteers and staff at the… …",2
"#sgcancersociety cancer survivors, volunteers and staff at the… …",2
#sgcancersociety at the Terry Fox Run to raise fund for cancer… …,2
Run for Hope - the day when medical breakthrough for better cancer treatments. . . . #runforhope…,2
Congrats to all the cancer coy people for getting Sgt rank finally… …,2
Guest-of-Honour Minister of State for Health Mr Chee Hong Tat with National Cancer Centre…,2
"It's a wrap! Kudos to all cancer survivors, volunteers and staff for… …",2
I'm dedicating this run to my beloved grandma & all the cancer… …,2
6:15am Cancer Survivors rally through the night! Cancer don't… …,2
3am cancer survivors keeping the relay going at the #scsrelayforlife… …,2
Cancer survivors going strong! #singaporecancersociety… …,2
Thanks & for your support for the cancer… …,2
Committee! Join us at the Singapore Cancer Society Relay For Life… …,2
Cancer warriors! Join us at the Singapore Cancer Society Relay For… …,2
#guesswhoishere Join us at the Singapore Cancer Society Relay For… …,2
JurongHealth!!! Join us at the Singapore Cancer Society Relay For… …,2
#guesswhoishere Join us at the Singapore Cancer Society Relay For… …,2
The world's full of little cancers that we take extra time to eliminate them out : jiayinn_,2
"Singapore Cancer Society Chingay Volunteers 妆艺 CHINGAY PARADE 2017 Soundwaves Chingay, Wecare…",2
Fantastic to finish our icongroupau SOC Lunar New Year fun at our flagship Farrer Park cancer…,2
#Repost with ・・・ Today is World Cancer Day… …,2
"#Repost with ・・・ This World Cancer Day,… …",2
"World Cancer Day is a chance to reflect on what you can do, make a pledge and take action.…",2
Blessed birthday Hua Jun! #singaporecancersociety @ Singapore Cancer… …,2
SCS LO hei! #singaporecancersociety @ Singapore Cancer Society… …,2
World Cancer Day (4 Feb) - We can. I can. Everyone - as a… …,2
Happy New Year! @ Singapore Cancer Society …,2
"Bismillah.. (with Puput at Parkway Cancer Centre (Gleneagles Hospital, Level 3)) —",2
I'm at National Cancer Centre in Singapore,2
Thanks! @ Singapore Cancer Society …,2
Singapore Cancer Society Cancer survivors gathering! @ Singapore… …,1
Huat ah @ Singapore Cancer Society Rehabilitation Centre …,1
Someone I know had their tongue removed cus of cancer. What are my problems compared to theirs ?,1
I'm at National Cancer Centre in Singapore,1
Can we please cancel cancer?,1
Chemo meds shopping (@ National Cancer Centre in Singapore),1
Midweek date. @ National Cancer Centre Singapore,1
"Holiday is over. Back to hospitals, doctors and needles. #cestlavie @ National Cancer Centre…",1
Celine Dion's brother died of cancer two days after her husband died fr similar sickness. Deeply shared her sorrow.,1
"Patricia Husband, Prostate Cancer Specialist Nurse from Townsvile… …",1
I'm at National Cancer Centre in Singapore,1
"Bowie, Rickman, Haggerty (Grizzly Adam's star) n R Angelli (Celine Dion's husband) had all died of cancer recently. Hope cure cld b found.",1
"British stage/screen star Alan Rickman died fr cancer at age 69 following David Bowie's death, who also died fr cancer n at same age.",1
David Bowie didn't 'fear death' after turning to God following terminal cancer diagnosis - Mirror Online - …,1
Legendary singer David Bowie died at 69yrs after 18-mth battle with cancer! RIP. I shall never forget his hit song Let's Dance!,1
Lung cancer with dareen (@ Changi General Hospital (CGH) in Singapore w/,1
Happy second years birthday couple cancer.. Love always. Happy always..smile together..love you…,1
Cuman lewat @ Singapore Cancer Society …,1
Playing my part in my race against cancer. Hope to run in one of these events with my dad and…,7
SingTel race against cancer @ East Coast Park Angsana Field,7
SingTel race against cancer @ East Coast Park Angsana Field,7
SingTel race against cancer @ East Coast Park Angsana Field,7
SingTel race against cancer @ East Coast Park Angsana Field,7
SingTel race against cancer @ East Coast Park Angsana Field,7
SingTel race against cancer @ East Coast Park Angsana Field,7
SingTel race against cancer @ East Coast Lagoon Food Centre,7
"Magnus Bocker, ex-SGX CEO, dies of cancer at 55 …",7
"colorectal cancer GP symposium, in partnership with… …",7
"Charity Program with Cancer Kids Your greatness is not what you have, its what you give .…",7
"#schamazing day with TeamSilverClub a.k.a Platoon Cancer @ Adventure Cove Waterpark, Resorts…",7
Desserts #lunchfellowship with SCS cancer screening team… …,7
Sometimes too difficult to put into words @ National Cancer Centre… …,7
"Pls give us good news (@ NUH Cancer Centre, 10th floor in Singapore)",7
#singaporecancersociety women Gynaecological cancer awareness forum… …,7
#singaporecancersociety women Gynaecological cancer awareness forum… …,7
#hooray for #labtech #kill #cancer #art #magick #meditation #okc #ontheroad #reading @ Singapore…,1
Mini-reunion makan ! @ Singapore Cancer Society …,1
Movie Time - xXx Return of Cancer Cage (@ Golden Village - in Singapore w/,1
"#Cancer's are tough on the outside. If they let you in, you'll learn they're softies on the…",1
05:20pm - BaoMakers Brunch with cancer-free girl from Melbourne @ Bao Makers,1
Virgo - Cancer - Aries @ Marina Bay Sands,1
#Repost with ・・・ Cancer is a battle… …,1
"Union for International Cancer Control (UICC), in partnership with… …",1
Checking up ... (at National Cancer Centre) —,1
Straits Times - Expectant mum finds out she has colon cancer.… …,1
Straits Times - Expectant mum finds out she has colon cancer.… …,1
will be organising the Singapore Cancer Society… …,1
will be organising the Singapore Cancer Society… …,1
#Repost leehsienloong with ・・・ Having survived cancer… …,1
Singapore Cancer Society Relay for Life 2017 Press Conference in… …,1
ocl week? cancer in my face @ Dairy Farm Nature Park …,1
Entering 2016 with a cancer . So I'm leaving it behind too . Bopi I won't kenna cancer again.…,1
#lastmeetingfortheyear ! @ Singapore Cancer Society …,12
Thanks for the ice cream cake! @ Singapore Cancer Society …,12
Checking up (with Kevin Happy at National Cancer Centre) —,12
#Cancer are hard to fool. They are very good at picking up on what is really going on & putting…,12
Ready for another treatment... #jiayou.. (at National Cancer Centre) —,12
"Liam Miller, former Manchester United and Celtic midfielder, undergoing cancer ... …",11
Cool little box for cancer sticks #b&w #monochrome #nofilter @ DoubleTree by Hilton,11
Give blood for cancer research. Yeah!!! #cancerinspiration #fightcancer @ National Cancer…,10
#singaporecancersociety GP Cancer Education Series @ Health… …,10
Lunch with my bosses! #singaporecancersociety @ Singapore Cancer… …,10
"Breast Cancer Awareness Month. Join us to know, learn and prevent with Cancer Information…",10
Just posted a photo @ Marina Bay Sands,10
Just posted a video @ ArtScience Museum,10
"Dory @ S.E.A. Aquarium, Marine Life Park",10
Support the breast cancer awareness. Wear the Pink Ribbon #temporarytattoo…,10
Just posted a photo @ Universal Studios Singapore Fans,10
"Siluet @ S.E.A. Aquarium, Marine Life Park",10
"I'm at S.E.A. Aquarium - in Sentosa Island, Singapore",10
"Gord Downie, Tragically Hip frontman, dies of cancer aged 53 …",10
"Slowly regaining my strength back and overcoming cancer. I can say that I am Father Courage,…",10
Just visited him. He was diagnosed with bladder cancer stage 2. It… …,10
"Celebrity hairstylist Shunji Matsuo, 67, dies of pancreatic cancer …",10
5 more hours to TGIF. (@ National Cancer Centre in Singapore),4
I'm at National Cancer Centre in Singapore,4
Serious operation! #projectleap @ Singapore Cancer Society …,4
Virgin Mookata experience with these folks. Had a blast even though I was eating cancer with…,4
I'm at National Cancer Centre in Singapore,4
Just posted a photo @ Singapore Cancer Society Rehabilitation Centre …,4
"Ex.Cancer Ex.VHF Ex.Leo Ex.Taurus Ex.Gemini Ex.Starlight here we come To Lead,To…",4
Pull through today and it's long weekend. (@ National Cancer Centre in Singapore),4
I'm at National Cancer Centre in Singapore,4
Monday blues. (@ National Cancer Centre in Singapore),4
Saturday shift. (@ National Cancer Centre in Singapore),4
What's there to TGIF about when there's work tomorrow. (@ National Cancer Centre in Singapore),4
"Hey, Zul let's fight this cancer together! Wa chaa! @ Johor Bahru …",3
I'm at National Cancer Centre in Singapore,3
I'm at National Cancer Centre in Singapore,3
Fr Peter Paul is Cancer free! Praise God! It's amazing how he said thank you God for the…,3
I'm at National Cancer Centre in Singapore,3
Still at work meeting (@ National Cancer Centre in Singapore),3
Long weekend coming. Woohoo!!! (@ National Cancer Centre in Singapore),3
I'm at National Cancer Centre in Singapore,3
I'm at National Cancer Centre in Singapore,3
Halo dr. Tham Weng Keong & dr. Michelle Poon! (with Nadia at NUHS Cancer Centre) [pic] —,3
Back to work. (@ National Cancer Centre in Singapore),3
I'm at National Cancer Centre in Singapore,3
I'm at National Cancer Centre in Singapore,3
Too early and Monday blues. Whole body aching from yesterday. Hahahaha. (@ National Cancer Centre in Singapore),3
gonna have cancer soon (@ SingTel Shop in Singapore),12
Comedian Choi Seo In Passes Away After Battle With Cancer …,12
"The AACI (American Anti-Cancer Institute) chose Alkaline Ionized water ""Enagic Kangen Water"" as…",12
I'm at National Cancer Centre in Singapore,12
"NCCS first ever public performance featuring patients, cancer survivors and caregivers. Never so…",12
Celebrating #skin #cancer free night appropriately! #singapore #club #street #street #post…,12
"Celebrity hairstylist Shunji Matsuo, 67, dies of pancreatic cancer …",12
"Celebrity hairstylist Shunji Matsuo, 67, dies of pancreatic cancer …",12
"Celebrity hairstylist Shunji Matsuo, 67, dies of pancreatic cancer …",12
SelfiPOP for Children’s Cancer Foundation 25th Staff Appreciation Dinner~ #selfie #wefie…,12
Lunch fellowship! Thanks kuoren for serving the cancer community!… …,11
It’s the third session of Interact.Think at One North and it’s about Prostate Cancer . They…,11
Emcing for JTC one north’s interact.think seminar series today highlighting prostrate cancer for…,11
Cancer awareness run #honoringsurvivors #sasedu @ Singapore American… …,11
"If everyone read this book, the #cancer industry would be finished in 6 months. For more…",11
More SCS colleagues birthday! @ Singapore Cancer Society …,11
I'm at National Cancer Centre in Singapore,8
"Cancer sucks (@ Hospital Sultanah Aminah in Johor Bahru, Johor)",7
#hairforhope2016 .... in support to Children Cancer Foundation...… …,7
"#Repost hawaariyannuryouth with repostapp ・・・ We know about all the different cancer like liver,…",7
Singapore Cancer Society's Gastric Cancer GP Symposium in… …,7
"fuck you, your love life is cancer last stage.",7
Green tea bottle now supports to fight cancer .,7
A new partnership @ Singapore Cancer Society Rehabilitation Centre …,7
"Loooooong talk. Yawns @ National University Cancer Institute, Singapore",7
Lets go! #singaporecancersociety @ Singapore Cancer Society… …,7
health screening (cancer) (@ Health Promotion Board (HPB) - in Singapore),7
Beating breast cancer one step at a time @ Eiffel Tower,7
"After 5 years in remission, I'm cured from cancer. #livestrong #fuckcancer @ Cancer Centre Annex…",7
2016 RACE AGAINST CANCER #raceagainstcancer #taimongyaw #taimongtai #tailashio @ East Coast Park…,7
Happy birthday cancer buddy! Hoped you like the gift @ The Fullerton Bay Hotel Singapore,7
03-07-16 : Singtel Race Against Cancer 2016 #singel #rac @ Angsana Green,7
Race against cancer 2016 10km @ East Coast Park …,7
It's a wrap! More than $1M was raised in support of cancer fight!… …,7
Awesome run at the Race Against Cancer run organized by Singtel #rac2016 #cancerwarrior @ East…,7
Conquered 5km fun run! #cancerwarriors #rac2016 #cancerwarrior @ 2016 Race Against Cancer At…,7
SingTel race for cancer 2016 - young superhero #rac2016 #cancerwarriors @ East Coast Park…,7
SingTel race for cancer 2016 #rac2016 #cancerwarroirs @ East Coast Park Angsana Green,7
Starting Race Against Cancer 15km competitive run soon! #RAC2016 #Limitless @ East Coast Park…,7
SingTel race for cancer 2016 @ East Coast Park Angsana Green,7
SingTel race for cancer 2016 @ East Coast Park Angsana Green,7
Singtel-Singapore Cancer Society Race Against Cancer 2016!… …,7
regram savannat8 We just walked into the cancer unit at the hospital and Hayes burst into tears!…,7
#colleaguesbirthday #singaporecancersociety @ Singapore Cancer Society …,7
I'm at National Cancer Centre in Singapore,7
I hope they donated it to the cancer society :),12
#singaporecancersociety December birthday kids! @ Singapore Cancer… …,12
Party @ Singapore Cancer Society Rehabilitation Centre …,12
#SCS #TGIF #christmasparty @ Singapore Cancer Society Rehabilitation… …,12
Dulcie Eng @ Singapore Cancer Society …,12
Checking up. .. (with Kevin Happy at National Cancer Centre) —,12
Hosting Juwairiya Seed (Chairman) and Abdullah Saeed from Cancer… …,12
Tryna catch skin cancer. Being on the equator helps. @ Bukit Timah Nature Reserve,12
"Please be strong baby girl! Let's fight this cancer in your body,… …",12
Finnaly the last one .. #readyforthenexttreatment (at National Cancer Centre) —,12
I intend to populate the instagram with children's characters for Child Cancer Awareness Week.…,12
"""I intend to populate Instagram with children's characters for Child Cancer Awareness Week. Give…",12
yes :( liver cancer,12
SCS #drawbloodday ! @ Singapore Cancer Society …,12
SCS Cancer Support Groups Annual Year End Celebration! @ Concorde… …,12
Group activity! @ National Cancer Centre Singapore …,12
Morning 'breakfast'! @ National Cancer Centre Singapore …,12
I intend to populate the Instagram with children's characters for Child Cancer Awareness Week.…,12
Met an old friend - Anthony Chew! Thanks for sharing your cancer… …,12
Bloodlust. #blood #leukemia #cancer #like4like #haematology #sgh #likeforlike #instagood…,12
Monthly routine #cancerinspiration #keepfighting #enjoythegame @ National Cancer Centre Singapore,11
National Cancer Foundation #lightupncf @ Big 3 Media,11
"I got my lashes done in October for Breast Cancer Awareness. And now, since its near the…",11
Why does cancer this illness even exist lol. (@ Singapore General Hospital (SGH) in Singapore),11
Warm Up sessions #mascsingaporetour2016 #JKHGroupPteLtd #cancer #CharityMatch…,11
Breast Cancer is the number one cancer among women in Singapore. In support of Breast Cancer…,10
"Thank you Pokka International for the 'Fight Cancer Together, One… …",10
"Thank you Pokka International for the 'Fight Cancer Together, One… …",10
#pressconference @ Singapore Cancer Society Rehabilitation Centre …,10
Settle jd model for today make up..ari breast cancer..theme make up go to office..make up dlm…,10
"Seminar"" Breast Cancer "" #gerakanpedulikankerbatam (at Swiss-Belhotel) [pic] —",10
Breast cancer is the most common cancer in women worldwide & it is still increasing. Having…,10
Cancer by twenty one pilots (with Rudy and Ade at PLN TANJUNG UBAN) —,10
@ Parkway Cancer Center Mount Elizabeth Hospital …,10
I'm at National Cancer Centre in Singapore,10
Ms Pan Ling Ling MediaCorp Actress Breast Cancer Survivor . The Pink Ribbon Fashion Show &…,10
"The pink ribbon is an international symbol of breast cancer awareness. Pink ribbons, and the…",10
"The pink ribbon is an international symbol of breast cancer awareness. Pink ribbons, and the…",10
Real man wears pink. 13th October is Breast Cancer Awareness Day. #alfatihah to my sister…,10
"The pink ribbon is an international symbol of breast cancer awareness. Pink ribbons, and the…",10
"The pink ribbon is an international symbol of breast cancer awareness. Pink ribbons, and the…",10
"The pink ribbon is an international symbol of breast cancer awareness. Pink ribbons, and the…",10
WAHAHAHAHAHAHAHAHAHAHA I may not be able to cure cancer but I sure can do pivot tables now!!!,4
The Tropic of Cancer #tropicanathemusical #techtime @ Capitol Theatre,4
Let's rock n roll! #cancerinspiration #cancerfighter @ National Cancer Centre Singapore,4
Let's get FIT! colorectal cancer awareness campaign… …,4
Celebrating life with our friends at the Singapore Cancer Society this evening. On behalf of…,4
Great collaborative meeting with South West CDC team on cancer… …,4
Throughout everything #7 #herseptin #cancersurvivor.. (at National Cancer Centre) —,4
(at National Cancer Centre) —,4
"Turmeric has over 9,000 studies and they say... … #Turmeric is potentially the best herb to fight #Cancer and ... pic.twitter.com/GCii22dpcx",4
With friend from National Cancer Society Malaysia! @ Yan Palace… …,3
War on Cancer! #economist @ One Farrer Hotel & Spa …,3
Love is like cancer ... it comes without an invitation and it kills us and leaves @ Somerset M…,3
Asia Pacific Cancer Control Leadership Forum @ Orchard Hotel Singapore …,3
Mount Everest for Cancer! In support of… …,3
#singaporecancersociety Staff training! @ Singapore Cancer Society …,3
#Crochet for #Children who've survived #Cancer - that was Project Crochet: Resilience Against…,3
#healthydinnermeeting @ Singapore Cancer Society Rehabilitation Centre …,3
Skin cancer conference! @ Matrix,3
The last time I did a game was a couple years ago before I was diagnosed with cancer. After…,3
"No good. (@ Clinic C, National Cancer Centre Singapore in Singapore)",3
Lunch with (cancer) doctors! Should be quite safe (diet) right! …,3
Waiting list... #cancersurvivor (at National Cancer Centre) —,3
skip ♫ Cancer by twenty one pilots (at Perumahan Villa Mas) —,3
TODAY! Watch Asia's top female bar talent battle it out while raising money for breast cancer…,3
"Miumiu's condition is getting worse everyday, her cancer tumour is… …",3
If skin-cancer and pneumonia isn't enough... I now got lumps in my man-boobs...…,3
"thank you team; w poseidon, capricorn and cancer earlier! :) thank you yuui for taking this…",10
Cheers to more collaborations for the benefit of the cancer… …,10
Just posted a photo @ Singapore Cancer Society Rehabilitation Centre …,10
#cancer just started trending with 32154 tweets. More trends at … #trndnl,10
With the gurus in cancer care! tohhanchong #michaelstubblefield… …,10
Donated and supports Breast Cancer Awareness Month...… …,10
All Clear! @ National Cancer Centre Singapore,10
Waiting. Hungry. Sleepy. Cold. @ National Cancer Centre Singapore,10
qt patooties or stupid potatoes? no wonder #bobo #cancer #tilt… …,10
